2026-05-20 15:17:12,732 - INFO - ----- Fine Tuning -----
2026-05-20 15:17:12,732 - INFO - A new study created in memory with name: no-name-5a201adc-b430-43cd-a155-192ac3c8ee02
2026-05-20 15:20:35,213 - INFO - ----- Fine Tuning -----
2026-05-20 15:20:35,214 - INFO - A new study created in memory with name: no-name-accff23d-1502-47e1-8ea5-dc3b4f8110ec
2026-05-20 15:26:43,427 - INFO - ----- Fine Tuning -----
2026-05-20 15:26:43,428 - INFO - A new study created in memory with name: no-name-0d13cd0e-e3fe-4138-ad48-7da1be2eeb90
2026-05-20 15:31:34,321 - INFO - Trial 3 finished with value: 0.6528988958831774 and parameters: {'n_components': 0.8354361232476882, 'svd_solver': 'full', 'whiten': False, 'iterated_power': 1, 'power_iteration_normalizer': 'QR', 'num_leaves': 217, 'max_depth': 3, 'learning_rate': 0.13791457773269394, 'lambda_l1': 0.235027381557295, 'lambda_l2': 1.0979583833322488, 'feature_fraction': 0.6225692917966296, 'bagging_fraction': 0.7114508079560941, 'bagging_freq': 6, 'min_child_samples': 76}. Best is trial 3 with value: 0.6528988958831774.
2026-05-20 15:32:11,418 - INFO - Trial 5 finished with value: 0.597989820687518 and parameters: {'n_components': 0.8045472937033997, 'svd_solver': 'auto', 'whiten': False, 'iterated_power': 9, 'power_iteration_normalizer': 'LU', 'num_leaves': 70, 'max_depth': 4, 'learning_rate': 0.019301086828490476, 'lambda_l1': 0.0012668778642242673, 'lambda_l2': 0.36024039175067823, 'feature_fraction': 0.9058335884989792, 'bagging_fraction': 0.6198740757388929, 'bagging_freq': 1, 'min_child_samples': 97}. Best is trial 3 with value: 0.6528988958831774.
2026-05-20 15:32:29,126 - INFO - Trial 6 finished with value: 0.7897464689135334 and parameters: {'n_components': 0.9056434826276604, 'svd_solver': 'full', 'whiten': True, 'iterated_power': 4, 'power_iteration_normalizer': 'LU', 'num_leaves': 24, 'max_depth': 8, 'learning_rate': 0.14864897441632172, 'lambda_l1': 0.4560321450381031, 'lambda_l2': 0.001508219689764589, 'feature_fraction': 0.9792318140530724, 'bagging_fraction': 0.6312428756868153, 'bagging_freq': 5, 'min_child_samples': 28}. Best is trial 6 with value: 0.7897464689135334.
2026-05-20 15:33:43,658 - INFO - Trial 9 finished with value: 0.7824995734192035 and parameters: {'n_components': 0.8899491183251027, 'svd_solver': 'full', 'whiten': False, 'iterated_power': 8, 'power_iteration_normalizer': 'LU', 'num_leaves': 139, 'max_depth': 5, 'learning_rate': 0.04736896991774313, 'lambda_l1': 0.0019210593440109778, 'lambda_l2': 0.3330817743614383, 'feature_fraction': 0.6118808566624321, 'bagging_fraction': 0.6275149202718956, 'bagging_freq': 7, 'min_child_samples': 29}. Best is trial 6 with value: 0.7897464689135334.
2026-05-20 15:35:58,055 - INFO - Trial 12 finished with value: 0.7584698380178656 and parameters: {'n_components': 0.8794339391940643, 'svd_solver': 'auto', 'whiten': False, 'iterated_power': 7, 'power_iteration_normalizer': 'QR', 'num_leaves': 158, 'max_depth': 3, 'learning_rate': 0.022790495188973667, 'lambda_l1': 1.5512721818513198, 'lambda_l2': 0.0025089431036584868, 'feature_fraction': 0.7453337733312912, 'bagging_fraction': 0.6545808628914045, 'bagging_freq': 6, 'min_child_samples': 99}. Best is trial 6 with value: 0.7897464689135334.
2026-05-20 15:37:51,961 - INFO - Trial 8 finished with value: 0.7169142817571357 and parameters: {'n_components': 0.8737978954044794, 'svd_solver': 'full', 'whiten': False, 'iterated_power': 10, 'power_iteration_normalizer': 'QR', 'num_leaves': 254, 'max_depth': 6, 'learning_rate': 0.17914803431073728, 'lambda_l1': 7.006031489429626, 'lambda_l2': 0.16563629840747163, 'feature_fraction': 0.7701832556480173, 'bagging_fraction': 0.7807417416652825, 'bagging_freq': 6, 'min_child_samples': 17}. Best is trial 6 with value: 0.7897464689135334.
2026-05-20 15:38:15,719 - INFO - Trial 4 finished with value: 0.6997389321008683 and parameters: {'n_components': 0.8734700928149236, 'svd_solver': 'auto', 'whiten': True, 'iterated_power': 7, 'power_iteration_normalizer': 'QR', 'num_leaves': 156, 'max_depth': 7, 'learning_rate': 0.030500236530645444, 'lambda_l1': 2.2221727516027525, 'lambda_l2': 9.19551197752191, 'feature_fraction': 0.6909580040009924, 'bagging_fraction': 0.6408645653214978, 'bagging_freq': 4, 'min_child_samples': 66}. Best is trial 6 with value: 0.7897464689135334.
2026-05-20 15:38:30,080 - INFO - Trial 11 pruned. 
2026-05-20 15:38:58,773 - INFO - Trial 0 pruned. 
2026-05-20 15:42:04,822 - INFO - Trial 2 pruned. 
2026-05-20 15:42:29,481 - INFO - Trial 1 finished with value: 0.8351462032575899 and parameters: {'n_components': 0.9333651500257171, 'svd_solver': 'auto', 'whiten': True, 'iterated_power': 2, 'power_iteration_normalizer': 'LU', 'num_leaves': 132, 'max_depth': 7, 'learning_rate': 0.0375809751711727, 'lambda_l1': 1.9577397978392155, 'lambda_l2': 0.0016183158098588566, 'feature_fraction': 0.88193592476648, 'bagging_fraction': 0.7218468954546693, 'bagging_freq': 1, 'min_child_samples': 86}. Best is trial 1 with value: 0.8351462032575899.
2026-05-20 15:42:34,910 - INFO - Trial 15 finished with value: 0.7216869170376545 and parameters: {'n_components': 0.8735284300153678, 'svd_solver': 'full', 'whiten': True, 'iterated_power': 8, 'power_iteration_normalizer': 'QR', 'num_leaves': 219, 'max_depth': 6, 'learning_rate': 0.034744811661489364, 'lambda_l1': 3.9925753173006973, 'lambda_l2': 5.845031884722179, 'feature_fraction': 0.7721345303676566, 'bagging_fraction': 0.6205010380067714, 'bagging_freq': 7, 'min_child_samples': 10}. Best is trial 1 with value: 0.8351462032575899.
2026-05-20 15:42:39,980 - INFO - Trial 20 pruned. 
2026-05-20 15:47:15,196 - INFO - Trial 21 finished with value: 0.8609712569460124 and parameters: {'n_components': 0.954188909969149, 'svd_solver': 'full', 'whiten': True, 'iterated_power': 4, 'power_iteration_normalizer': 'auto', 'num_leaves': 18, 'max_depth': 9, 'learning_rate': 0.08801764536283378, 'lambda_l1': 0.022722636717262445, 'lambda_l2': 0.0010073911107721244, 'feature_fraction': 0.9996746941267521, 'bagging_fraction': 0.9914631133659131, 'bagging_freq': 3, 'min_child_samples': 45}. Best is trial 21 with value: 0.8609712569460124.
2026-05-20 15:47:25,483 - INFO - Trial 7 finished with value: 0.8593084561284007 and parameters: {'n_components': 0.9498371751829346, 'svd_solver': 'full', 'whiten': True, 'iterated_power': 6, 'power_iteration_normalizer': 'LU', 'num_leaves': 103, 'max_depth': 10, 'learning_rate': 0.01830550940952952, 'lambda_l1': 5.684481083562945, 'lambda_l2': 0.9869105775721397, 'feature_fraction': 0.6511736256037752, 'bagging_fraction': 0.8500986278400078, 'bagging_freq': 7, 'min_child_samples': 25}. Best is trial 21 with value: 0.8609712569460124.
2026-05-20 15:47:33,068 - INFO - Trial 23 finished with value: 0.8503796392389864 and parameters: {'n_components': 0.9442376784737135, 'svd_solver': 'full', 'whiten': True, 'iterated_power': 4, 'power_iteration_normalizer': 'LU', 'num_leaves': 17, 'max_depth': 9, 'learning_rate': 0.08560288637556904, 'lambda_l1': 0.2715489396036348, 'lambda_l2': 0.0017330547594741317, 'feature_fraction': 0.9955971019635594, 'bagging_fraction': 0.7260995632277291, 'bagging_freq': 3, 'min_child_samples': 45}. Best is trial 21 with value: 0.8609712569460124.
2026-05-20 15:47:43,859 - INFO - Trial 16 pruned. 
2026-05-20 15:47:45,815 - INFO - Trial 22 finished with value: 0.8593821031691513 and parameters: {'n_components': 0.948630062175838, 'svd_solver': 'full', 'whiten': True, 'iterated_power': 4, 'power_iteration_normalizer': 'LU', 'num_leaves': 23, 'max_depth': 9, 'learning_rate': 0.08472349135876313, 'lambda_l1': 0.1927781733898447, 'lambda_l2': 0.001051800001959056, 'feature_fraction': 0.9774751296688162, 'bagging_fraction': 0.9963083915312436, 'bagging_freq': 3, 'min_child_samples': 48}. Best is trial 21 with value: 0.8609712569460124.
2026-05-20 15:49:37,593 - INFO - Trial 18 finished with value: 0.7951382259164145 and parameters: {'n_components': 0.9159051023386046, 'svd_solver': 'auto', 'whiten': True, 'iterated_power': 8, 'power_iteration_normalizer': 'QR', 'num_leaves': 212, 'max_depth': 6, 'learning_rate': 0.14744467201805866, 'lambda_l1': 0.06514396855107989, 'lambda_l2': 0.10025334179468229, 'feature_fraction': 0.8416065035975278, 'bagging_fraction': 0.6281472814068425, 'bagging_freq': 6, 'min_child_samples': 46}. Best is trial 21 with value: 0.8609712569460124.
2026-05-20 15:50:30,772 - INFO - Trial 13 finished with value: 0.8771772634116308 and parameters: {'n_components': 0.9672429154714827, 'svd_solver': 'full', 'whiten': False, 'iterated_power': 7, 'power_iteration_normalizer': 'LU', 'num_leaves': 101, 'max_depth': 10, 'learning_rate': 0.07828217239132049, 'lambda_l1': 0.0985107547586245, 'lambda_l2': 0.006154686468724573, 'feature_fraction': 0.8997176193735605, 'bagging_fraction': 0.7667504665386714, 'bagging_freq': 6, 'min_child_samples': 100}. Best is trial 13 with value: 0.8771772634116308.
2026-05-20 15:52:51,386 - INFO - Trial 19 pruned. 
2026-05-20 15:54:31,883 - INFO - Trial 24 finished with value: 0.8446767718780122 and parameters: {'n_components': 0.9413794103953322, 'svd_solver': 'auto', 'whiten': True, 'iterated_power': 4, 'power_iteration_normalizer': 'LU', 'num_leaves': 81, 'max_depth': 9, 'learning_rate': 0.08421778592156062, 'lambda_l1': 0.036666182281276966, 'lambda_l2': 0.0010533718317850792, 'feature_fraction': 0.9802172617353718, 'bagging_fraction': 0.9916947109369526, 'bagging_freq': 3, 'min_child_samples': 57}. Best is trial 13 with value: 0.8771772634116308.
2026-05-20 15:55:09,276 - INFO - Trial 14 finished with value: 0.7959105343939445 and parameters: {'n_components': 0.9241954082230961, 'svd_solver': 'full', 'whiten': False, 'iterated_power': 2, 'power_iteration_normalizer': 'auto', 'num_leaves': 152, 'max_depth': 9, 'learning_rate': 0.09061278567304029, 'lambda_l1': 0.06769842247201804, 'lambda_l2': 0.14680207476673188, 'feature_fraction': 0.9852077495427981, 'bagging_fraction': 0.7079933511695959, 'bagging_freq': 2, 'min_child_samples': 24}. Best is trial 13 with value: 0.8771772634116308.
2026-05-20 15:56:18,524 - INFO - Trial 10 finished with value: 0.8838068800723384 and parameters: {'n_components': 0.9722311008357588, 'svd_solver': 'full', 'whiten': False, 'iterated_power': 3, 'power_iteration_normalizer': 'LU', 'num_leaves': 209, 'max_depth': 11, 'learning_rate': 0.0657843884590986, 'lambda_l1': 1.079138477889979, 'lambda_l2': 0.09129560899242403, 'feature_fraction': 0.9296339693373629, 'bagging_fraction': 0.9424420663323042, 'bagging_freq': 2, 'min_child_samples': 98}. Best is trial 10 with value: 0.8838068800723384.
2026-05-20 15:56:19,101 - INFO - Trial 29 finished with value: 0.9139652787546744 and parameters: {'n_components': 0.9899637136469868, 'svd_solver': 'full', 'whiten': True, 'iterated_power': 4, 'power_iteration_normalizer': 'auto', 'num_leaves': 71, 'max_depth': 10, 'learning_rate': 0.09239580767387014, 'lambda_l1': 0.023465620344668994, 'lambda_l2': 0.0062930191059754155, 'feature_fraction': 0.9279390099372771, 'bagging_fraction': 0.9982575845414055, 'bagging_freq': 3, 'min_child_samples': 61}. Best is trial 29 with value: 0.9139652787546744.
2026-05-20 15:57:01,428 - INFO - ----- Fine Tuning -----
2026-05-20 15:57:01,428 - INFO - A new study created in memory with name: no-name-e7de548a-e63c-4a1e-843c-ec2842be922a
2026-05-20 16:01:53,449 - INFO - Trial 7 finished with value: 0.6992214288984618 and parameters: {'n_components': 0.8692212854207386, 'svd_solver': 'full', 'whiten': True, 'iterated_power': 10, 'power_iteration_normalizer': 'LU', 'num_leaves': 23, 'max_depth': 3, 'learning_rate': 0.03168166825986483, 'lambda_l1': 0.0016229466720020418, 'lambda_l2': 0.0011350883793538572, 'feature_fraction': 0.6162157605329075, 'bagging_fraction': 0.6841496840154131, 'bagging_freq': 1, 'min_child_samples': 78}. Best is trial 7 with value: 0.6992214288984618.
2026-05-20 16:02:15,185 - INFO - Trial 11 finished with value: 0.7955621404778294 and parameters: {'n_components': 0.9128425554229284, 'svd_solver': 'full', 'whiten': True, 'iterated_power': 3, 'power_iteration_normalizer': 'QR', 'num_leaves': 17, 'max_depth': 9, 'learning_rate': 0.027302625327949418, 'lambda_l1': 0.0062739404948665735, 'lambda_l2': 0.03645616455606204, 'feature_fraction': 0.9065394203846402, 'bagging_fraction': 0.9084881306075934, 'bagging_freq': 2, 'min_child_samples': 29}. Best is trial 11 with value: 0.7955621404778294.
2026-05-20 16:04:04,818 - INFO - Trial 10 finished with value: 0.6863285050285092 and parameters: {'n_components': 0.8468141065942552, 'svd_solver': 'full', 'whiten': False, 'iterated_power': 9, 'power_iteration_normalizer': 'auto', 'num_leaves': 24, 'max_depth': 5, 'learning_rate': 0.014983729891705537, 'lambda_l1': 0.0022358800298685616, 'lambda_l2': 0.06117570503768027, 'feature_fraction': 0.7727128200435404, 'bagging_fraction': 0.8351478924304381, 'bagging_freq': 2, 'min_child_samples': 57}. Best is trial 11 with value: 0.7955621404778294.
2026-05-20 16:05:00,790 - INFO - Trial 9 finished with value: 0.7833543805279854 and parameters: {'n_components': 0.9000830771909634, 'svd_solver': 'full', 'whiten': False, 'iterated_power': 10, 'power_iteration_normalizer': 'auto', 'num_leaves': 55, 'max_depth': 5, 'learning_rate': 0.017260012690572996, 'lambda_l1': 0.3487024658199609, 'lambda_l2': 0.001038923539018584, 'feature_fraction': 0.6157998086525709, 'bagging_fraction': 0.9663104951938877, 'bagging_freq': 5, 'min_child_samples': 51}. Best is trial 11 with value: 0.7955621404778294.
2026-05-20 16:07:06,514 - INFO - Trial 4 finished with value: 0.9099437025076782 and parameters: {'n_components': 0.9885561169729329, 'svd_solver': 'auto', 'whiten': False, 'iterated_power': 2, 'power_iteration_normalizer': 'QR', 'num_leaves': 133, 'max_depth': 5, 'learning_rate': 0.12298064311262175, 'lambda_l1': 0.7723188932318318, 'lambda_l2': 0.015015250213249611, 'feature_fraction': 0.619162702191963, 'bagging_fraction': 0.9316928881950299, 'bagging_freq': 7, 'min_child_samples': 96}. Best is trial 4 with value: 0.9099437025076782.
2026-05-20 16:08:02,240 - INFO - Trial 13 pruned. 
2026-05-20 16:09:36,437 - INFO - Trial 12 finished with value: 0.8746385568428332 and parameters: {'n_components': 0.9671767021934186, 'svd_solver': 'auto', 'whiten': False, 'iterated_power': 4, 'power_iteration_normalizer': 'QR', 'num_leaves': 135, 'max_depth': 5, 'learning_rate': 0.06519339775933289, 'lambda_l1': 0.0034353506619259366, 'lambda_l2': 0.001319396746310345, 'feature_fraction': 0.9261240171519688, 'bagging_fraction': 0.6214704915453161, 'bagging_freq': 3, 'min_child_samples': 63}. Best is trial 4 with value: 0.9099437025076782.
2026-05-20 16:09:49,462 - INFO - Trial 0 pruned. 
2026-05-20 16:10:27,944 - INFO - Trial 5 finished with value: 0.9027379727215086 and parameters: {'n_components': 0.9826729730269959, 'svd_solver': 'full', 'whiten': False, 'iterated_power': 3, 'power_iteration_normalizer': 'auto', 'num_leaves': 68, 'max_depth': 6, 'learning_rate': 0.042070207636166666, 'lambda_l1': 0.0317955969933538, 'lambda_l2': 0.28722659261612027, 'feature_fraction': 0.7648992132420531, 'bagging_fraction': 0.698095011606362, 'bagging_freq': 6, 'min_child_samples': 84}. Best is trial 4 with value: 0.9099437025076782.
2026-05-20 16:10:40,459 - INFO - Trial 8 pruned. 
2026-05-20 16:11:00,658 - INFO - Trial 1 finished with value: 0.8191918419378853 and parameters: {'n_components': 0.9310663724890467, 'svd_solver': 'full', 'whiten': False, 'iterated_power': 1, 'power_iteration_normalizer': 'auto', 'num_leaves': 68, 'max_depth': 9, 'learning_rate': 0.15248759308765447, 'lambda_l1': 0.44097738355379396, 'lambda_l2': 0.023003247193870965, 'feature_fraction': 0.8507341946645142, 'bagging_fraction': 0.6933227825738707, 'bagging_freq': 3, 'min_child_samples': 23}. Best is trial 4 with value: 0.9099437025076782.
2026-05-20 16:11:03,696 - INFO - Trial 15 pruned. 
2026-05-20 16:12:52,402 - INFO - Trial 3 pruned. 
2026-05-20 16:13:49,034 - INFO - Trial 16 pruned. 
2026-05-20 16:13:54,166 - INFO - Trial 14 pruned. 
2026-05-20 16:14:24,889 - INFO - Trial 6 pruned. 
2026-05-20 16:14:33,822 - INFO - Trial 2 pruned. 
2026-05-20 16:15:46,008 - INFO - Trial 21 finished with value: 0.8458815798067187 and parameters: {'n_components': 0.9404112157901692, 'svd_solver': 'auto', 'whiten': False, 'iterated_power': 1, 'power_iteration_normalizer': 'LU', 'num_leaves': 227, 'max_depth': 3, 'learning_rate': 0.18888654599984192, 'lambda_l1': 8.790480800321344, 'lambda_l2': 4.437479951321851, 'feature_fraction': 0.8489224220027513, 'bagging_fraction': 0.9880933443948692, 'bagging_freq': 7, 'min_child_samples': 98}. Best is trial 4 with value: 0.9099437025076782.
2026-05-20 16:16:07,182 - INFO - Trial 23 finished with value: 0.8961644963602196 and parameters: {'n_components': 0.9849897795611993, 'svd_solver': 'auto', 'whiten': False, 'iterated_power': 1, 'power_iteration_normalizer': 'LU', 'num_leaves': 208, 'max_depth': 3, 'learning_rate': 0.17254700973497092, 'lambda_l1': 0.03699169249588561, 'lambda_l2': 0.8195846282717937, 'feature_fraction': 0.668100703203787, 'bagging_fraction': 0.7457887880657235, 'bagging_freq': 7, 'min_child_samples': 93}. Best is trial 4 with value: 0.9099437025076782.
2026-05-20 16:16:09,071 - INFO - Trial 20 pruned. 
2026-05-20 16:18:55,260 - INFO - Trial 17 pruned. 
2026-05-20 16:19:49,065 - INFO - Trial 25 finished with value: 0.8669802162226043 and parameters: {'n_components': 0.9741764577057811, 'svd_solver': 'full', 'whiten': False, 'iterated_power': 1, 'power_iteration_normalizer': 'LU', 'num_leaves': 198, 'max_depth': 3, 'learning_rate': 0.04235724734255456, 'lambda_l1': 0.03559657058224255, 'lambda_l2': 0.4011347411150997, 'feature_fraction': 0.8384436797138641, 'bagging_fraction': 0.903672030659131, 'bagging_freq': 7, 'min_child_samples': 84}. Best is trial 4 with value: 0.9099437025076782.
2026-05-20 16:19:53,879 - INFO - Trial 28 finished with value: 0.8727377308134546 and parameters: {'n_components': 0.9769469901870138, 'svd_solver': 'full', 'whiten': False, 'iterated_power': 6, 'power_iteration_normalizer': 'LU', 'num_leaves': 170, 'max_depth': 3, 'learning_rate': 0.040496849072609795, 'lambda_l1': 0.07003579378490683, 'lambda_l2': 0.3427839714315156, 'feature_fraction': 0.8386220963533115, 'bagging_fraction': 0.6037855756961541, 'bagging_freq': 7, 'min_child_samples': 88}. Best is trial 4 with value: 0.9099437025076782.
2026-05-20 16:19:58,939 - INFO - Trial 26 finished with value: 0.8827251400656824 and parameters: {'n_components': 0.9860903403761412, 'svd_solver': 'full', 'whiten': False, 'iterated_power': 5, 'power_iteration_normalizer': 'LU', 'num_leaves': 184, 'max_depth': 3, 'learning_rate': 0.040491831593961726, 'lambda_l1': 0.04237493574472877, 'lambda_l2': 0.4622370489707434, 'feature_fraction': 0.6753348969309677, 'bagging_fraction': 0.9275921328203343, 'bagging_freq': 7, 'min_child_samples': 90}. Best is trial 4 with value: 0.9099437025076782.
2026-05-20 16:20:00,530 - INFO - Trial 31 pruned. 
2026-05-20 16:21:48,102 - INFO - Trial 30 pruned. 
2026-05-20 16:22:10,093 - INFO - Trial 27 finished with value: 0.9064701925647611 and parameters: {'n_components': 0.9899085674821139, 'svd_solver': 'auto', 'whiten': False, 'iterated_power': 6, 'power_iteration_normalizer': 'LU', 'num_leaves': 177, 'max_depth': 4, 'learning_rate': 0.10634919135918272, 'lambda_l1': 0.04261315314931813, 'lambda_l2': 0.45127516076305274, 'feature_fraction': 0.6783897020607441, 'bagging_fraction': 0.9218390544486669, 'bagging_freq': 7, 'min_child_samples': 89}. Best is trial 4 with value: 0.9099437025076782.
2026-05-20 16:22:31,980 - INFO - Trial 29 finished with value: 0.8980444930649336 and parameters: {'n_components': 0.9876955914023434, 'svd_solver': 'full', 'whiten': False, 'iterated_power': 6, 'power_iteration_normalizer': 'QR', 'num_leaves': 169, 'max_depth': 4, 'learning_rate': 0.03915883090702095, 'lambda_l1': 0.057321303134299034, 'lambda_l2': 0.2838438655118141, 'feature_fraction': 0.6715418595119301, 'bagging_fraction': 0.6088149506426397, 'bagging_freq': 7, 'min_child_samples': 85}. Best is trial 4 with value: 0.9099437025076782.
2026-05-20 16:23:25,013 - INFO - Trial 35 pruned. 
2026-05-20 16:23:25,505 - INFO - Trial 36 pruned. 
2026-05-20 16:23:48,020 - INFO - Trial 18 pruned. 
2026-05-20 16:23:54,640 - INFO - Trial 32 finished with value: 0.8875319802676694 and parameters: {'n_components': 0.9889828594211858, 'svd_solver': 'auto', 'whiten': False, 'iterated_power': 2, 'power_iteration_normalizer': 'LU', 'num_leaves': 155, 'max_depth': 3, 'learning_rate': 0.041238024319997756, 'lambda_l1': 0.051787876962096496, 'lambda_l2': 0.38783508627582386, 'feature_fraction': 0.6592997013330939, 'bagging_fraction': 0.610163197602021, 'bagging_freq': 7, 'min_child_samples': 88}. Best is trial 4 with value: 0.9099437025076782.
2026-05-20 16:25:47,927 - INFO - Trial 38 pruned. 
2026-05-20 16:26:11,213 - INFO - Trial 33 finished with value: 0.905293867496578 and parameters: {'n_components': 0.9883898929479804, 'svd_solver': 'auto', 'whiten': False, 'iterated_power': 2, 'power_iteration_normalizer': 'LU', 'num_leaves': 162, 'max_depth': 4, 'learning_rate': 0.11195695239428723, 'lambda_l1': 0.10797945167381186, 'lambda_l2': 0.27663000028782525, 'feature_fraction': 0.6733814038107042, 'bagging_fraction': 0.6160693566370815, 'bagging_freq': 7, 'min_child_samples': 89}. Best is trial 4 with value: 0.9099437025076782.
2026-05-20 16:26:13,475 - INFO - Trial 39 pruned. 
