2026-05-20 16:26:31,225 - INFO - Trial 34 finished with value: 0.9058729786357468 and parameters: {'n_components': 0.9890610657479673, 'svd_solver': 'auto', 'whiten': False, 'iterated_power': 2, 'power_iteration_normalizer': 'LU', 'num_leaves': 178, 'max_depth': 4, 'learning_rate': 0.11331222667664308, 'lambda_l1': 0.1239565086552369, 'lambda_l2': 1.9138711870816494, 'feature_fraction': 0.6599625601156135, 'bagging_fraction': 0.7340535002849514, 'bagging_freq': 7, 'min_child_samples': 89}. Best is trial 4 with value: 0.9099437025076782.
2026-05-20 16:28:22,934 - INFO - Trial 37 finished with value: 0.9069294921191806 and parameters: {'n_components': 0.9898434951866408, 'svd_solver': 'auto', 'whiten': False, 'iterated_power': 2, 'power_iteration_normalizer': 'LU', 'num_leaves': 253, 'max_depth': 4, 'learning_rate': 0.11654644085005705, 'lambda_l1': 0.02640964371686404, 'lambda_l2': 1.5921377206284246, 'feature_fraction': 0.649585750848787, 'bagging_fraction': 0.7333245951459936, 'bagging_freq': 5, 'min_child_samples': 91}. Best is trial 4 with value: 0.9099437025076782.
2026-05-20 16:28:35,300 - INFO - Trial 43 pruned. 
2026-05-20 16:31:52,789 - INFO - Trial 19 finished with value: 0.8868346142959995 and parameters: {'n_components': 0.9716578241156096, 'svd_solver': 'full', 'whiten': True, 'iterated_power': 6, 'power_iteration_normalizer': 'auto', 'num_leaves': 111, 'max_depth': 12, 'learning_rate': 0.07220712039222221, 'lambda_l1': 5.766021582601511, 'lambda_l2': 0.06710077661879219, 'feature_fraction': 0.8022822810520814, 'bagging_fraction': 0.7968421281087882, 'bagging_freq': 4, 'min_child_samples': 99}. Best is trial 4 with value: 0.9099437025076782.
2026-05-20 16:32:17,276 - INFO - Trial 42 finished with value: 0.9069300554206764 and parameters: {'n_components': 0.9877853325667966, 'svd_solver': 'full', 'whiten': False, 'iterated_power': 5, 'power_iteration_normalizer': 'QR', 'num_leaves': 129, 'max_depth': 5, 'learning_rate': 0.054386254875477685, 'lambda_l1': 0.024274601369864184, 'lambda_l2': 0.17898095048547183, 'feature_fraction': 0.7232298265105537, 'bagging_fraction': 0.8662392092722588, 'bagging_freq': 7, 'min_child_samples': 82}. Best is trial 4 with value: 0.9099437025076782.
2026-05-20 16:32:40,478 - INFO - Trial 48 pruned. 
2026-05-20 16:33:21,035 - INFO - Trial 41 pruned. 
2026-05-20 16:33:46,287 - INFO - Trial 40 pruned. 
2026-05-20 16:34:04,761 - INFO - Trial 45 pruned. 
2026-05-20 16:34:25,567 - INFO - Trial 47 pruned. 
2026-05-20 16:35:45,182 - INFO - Trial 49 pruned. 
2026-05-20 16:36:28,047 - INFO - Trial 44 finished with value: 0.8824425978871824 and parameters: {'n_components': 0.9719279671780088, 'svd_solver': 'full', 'whiten': False, 'iterated_power': 5, 'power_iteration_normalizer': 'QR', 'num_leaves': 127, 'max_depth': 7, 'learning_rate': 0.0555318234163554, 'lambda_l1': 0.01629397705086851, 'lambda_l2': 0.1078946334011271, 'feature_fraction': 0.6016948307209555, 'bagging_fraction': 0.6545733340594663, 'bagging_freq': 7, 'min_child_samples': 72}. Best is trial 4 with value: 0.9099437025076782.
2026-05-20 16:36:40,544 - INFO - Trial 24 finished with value: 0.9008841334604556 and parameters: {'n_components': 0.9850658013101541, 'svd_solver': 'auto', 'whiten': False, 'iterated_power': 1, 'power_iteration_normalizer': 'LU', 'num_leaves': 203, 'max_depth': 12, 'learning_rate': 0.1929534684543245, 'lambda_l1': 0.023954412797844032, 'lambda_l2': 0.42062360070725313, 'feature_fraction': 0.6804944809379219, 'bagging_fraction': 0.7471148472233512, 'bagging_freq': 7, 'min_child_samples': 100}. Best is trial 4 with value: 0.9099437025076782.
2026-05-20 16:36:49,456 - INFO - Trial 46 finished with value: 0.8830747510728536 and parameters: {'n_components': 0.9717400091237208, 'svd_solver': 'auto', 'whiten': False, 'iterated_power': 4, 'power_iteration_normalizer': 'LU', 'num_leaves': 121, 'max_depth': 7, 'learning_rate': 0.053106182675056346, 'lambda_l1': 0.02127343700434014, 'lambda_l2': 0.15470558617973723, 'feature_fraction': 0.6255862965899626, 'bagging_fraction': 0.6539472374421933, 'bagging_freq': 6, 'min_child_samples': 71}. Best is trial 4 with value: 0.9099437025076782.
2026-05-20 16:36:50,874 - INFO - Trial 22 finished with value: 0.896562380355833 and parameters: {'n_components': 0.9821119385695755, 'svd_solver': 'auto', 'whiten': False, 'iterated_power': 1, 'power_iteration_normalizer': 'LU', 'num_leaves': 220, 'max_depth': 12, 'learning_rate': 0.16827940786912907, 'lambda_l1': 0.03491330610246094, 'lambda_l2': 1.3750760357543215, 'feature_fraction': 0.6832761272304071, 'bagging_fraction': 0.7477498943980048, 'bagging_freq': 7, 'min_child_samples': 100}. Best is trial 4 with value: 0.9099437025076782.
2026-05-20 16:36:50,878 - INFO - Best AUC: 0.9099437025076782 | Best params: {'n_components': 0.9885561169729329, 'svd_solver': 'auto', 'whiten': False, 'iterated_power': 2, 'power_iteration_normalizer': 'QR', 'num_leaves': 133, 'max_depth': 5, 'learning_rate': 0.12298064311262175, 'lambda_l1': 0.7723188932318318, 'lambda_l2': 0.015015250213249611, 'feature_fraction': 0.619162702191963, 'bagging_fraction': 0.9316928881950299, 'bagging_freq': 7, 'min_child_samples': 96}
2026-05-20 16:36:50,878 - INFO - ----- Saving Pipeline -----
