2026-05-16 12:08:19,151 - INFO - Trial 93 finished with value: 0.8692398864496637 and parameters: {'n_components': 0.9814828578425381, 'svd_solver': 'full', 'whiten': False, 'iterated_power': 10, 'power_iteration_normalizer': 'auto', 'n_neighbors': 9, 'weights': 'uniform', 'metric': 'euclidean', 'p': 1, 'leaf_size': 53}. Best is trial 79 with value: 0.8863677063767883.
2026-05-16 12:08:52,384 - INFO - Trial 95 pruned. 
2026-05-16 12:09:01,981 - INFO - Trial 96 pruned. 
2026-05-16 12:09:56,359 - INFO - Trial 97 pruned. 
2026-05-16 12:10:15,194 - INFO - Trial 98 pruned. 
2026-05-16 12:10:20,392 - INFO - Trial 99 pruned. 
2026-05-16 12:13:21,170 - INFO - Trial 88 finished with value: 0.8764979071044822 and parameters: {'n_components': 0.9812288989157713, 'svd_solver': 'full', 'whiten': False, 'iterated_power': 10, 'power_iteration_normalizer': 'auto', 'n_neighbors': 10, 'weights': 'distance', 'metric': 'manhattan', 'p': 1, 'leaf_size': 53}. Best is trial 79 with value: 0.8863677063767883.
2026-05-16 12:17:33,261 - INFO - Trial 73 finished with value: 0.8719297758204367 and parameters: {'n_components': 0.9809628878040771, 'svd_solver': 'full', 'whiten': True, 'iterated_power': 6, 'power_iteration_normalizer': 'QR', 'n_neighbors': 9, 'weights': 'distance', 'metric': 'minkowski', 'p': 1, 'leaf_size': 97}. Best is trial 79 with value: 0.8863677063767883.
2026-05-16 12:20:39,889 - INFO - Trial 94 finished with value: 0.8745713836895496 and parameters: {'n_components': 0.9844159425787227, 'svd_solver': 'full', 'whiten': True, 'iterated_power': 10, 'power_iteration_normalizer': 'auto', 'n_neighbors': 9, 'weights': 'distance', 'metric': 'euclidean', 'p': 1, 'leaf_size': 50}. Best is trial 79 with value: 0.8863677063767883.
2026-05-16 12:23:47,434 - INFO - Trial 70 finished with value: 0.8836423994327571 and parameters: {'n_components': 0.9893062208867061, 'svd_solver': 'full', 'whiten': False, 'iterated_power': 1, 'power_iteration_normalizer': 'QR', 'n_neighbors': 8, 'weights': 'distance', 'metric': 'minkowski', 'p': 1, 'leaf_size': 94}. Best is trial 79 with value: 0.8863677063767883.
2026-05-16 12:23:57,518 - INFO - Trial 87 finished with value: 0.8852003354091856 and parameters: {'n_components': 0.9899739466165407, 'svd_solver': 'full', 'whiten': False, 'iterated_power': 10, 'power_iteration_normalizer': 'auto', 'n_neighbors': 8, 'weights': 'distance', 'metric': 'manhattan', 'p': 1, 'leaf_size': 37}. Best is trial 79 with value: 0.8863677063767883.
2026-05-16 12:35:03,685 - INFO - Trial 74 finished with value: 0.8914149276506438 and parameters: {'n_components': 0.9882684046228931, 'svd_solver': 'full', 'whiten': True, 'iterated_power': 1, 'power_iteration_normalizer': 'QR', 'n_neighbors': 9, 'weights': 'distance', 'metric': 'minkowski', 'p': 1, 'leaf_size': 39}. Best is trial 74 with value: 0.8914149276506438.
2026-05-16 12:42:13,044 - INFO - Trial 78 finished with value: 0.869872385039622 and parameters: {'n_components': 0.9883366029135306, 'svd_solver': 'full', 'whiten': True, 'iterated_power': 9, 'power_iteration_normalizer': 'auto', 'n_neighbors': 5, 'weights': 'uniform', 'metric': 'manhattan', 'p': 2, 'leaf_size': 45}. Best is trial 74 with value: 0.8914149276506438.
2026-05-16 12:50:19,417 - INFO - Trial 76 finished with value: 0.8903183592565274 and parameters: {'n_components': 0.9890456131034104, 'svd_solver': 'full', 'whiten': True, 'iterated_power': 1, 'power_iteration_normalizer': 'QR', 'n_neighbors': 9, 'weights': 'uniform', 'metric': 'minkowski', 'p': 1, 'leaf_size': 66}. Best is trial 74 with value: 0.8914149276506438.
2026-05-16 13:00:38,738 - INFO - Trial 72 finished with value: 0.884770811180654 and parameters: {'n_components': 0.989155272172689, 'svd_solver': 'full', 'whiten': True, 'iterated_power': 1, 'power_iteration_normalizer': 'QR', 'n_neighbors': 7, 'weights': 'distance', 'metric': 'minkowski', 'p': 1, 'leaf_size': 87}. Best is trial 74 with value: 0.8914149276506438.
2026-05-16 13:00:38,741 - INFO - Best AUC: 0.8914149276506438 | Best params: {'n_components': 0.9882684046228931, 'svd_solver': 'full', 'whiten': True, 'iterated_power': 1, 'power_iteration_normalizer': 'QR', 'n_neighbors': 9, 'weights': 'distance', 'metric': 'minkowski', 'p': 1, 'leaf_size': 39}
2026-05-16 13:00:38,741 - INFO - ----- Saving Pipeline -----
