2026-05-16 10:05:21,939 - INFO - Trial 6 finished with value: 0.7967305838392733 and parameters: {'n_components': 0.9501895134927844, 'svd_solver': 'full', 'whiten': True, 'iterated_power': 9, 'power_iteration_normalizer': 'auto', 'n_neighbors': 5, 'weights': 'uniform', 'metric': 'euclidean', 'p': 1, 'leaf_size': 66}. Best is trial 6 with value: 0.7967305838392733.
2026-05-16 10:05:48,257 - INFO - Trial 16 pruned. 
2026-05-16 10:05:48,300 - INFO - Trial 14 pruned. 
2026-05-16 10:05:48,438 - INFO - Trial 15 pruned. 
2026-05-16 10:05:49,390 - INFO - Trial 17 pruned. 
2026-05-16 10:06:30,089 - INFO - Trial 5 finished with value: 0.8264955189445355 and parameters: {'n_components': 0.9549708455985786, 'svd_solver': 'full', 'whiten': False, 'iterated_power': 1, 'power_iteration_normalizer': 'auto', 'n_neighbors': 9, 'weights': 'distance', 'metric': 'minkowski', 'p': 1, 'leaf_size': 30}. Best is trial 5 with value: 0.8264955189445355.
2026-05-16 10:06:38,004 - INFO - Trial 12 finished with value: 0.8016647492831872 and parameters: {'n_components': 0.9335465830073821, 'svd_solver': 'full', 'whiten': False, 'iterated_power': 8, 'power_iteration_normalizer': 'LU', 'n_neighbors': 7, 'weights': 'uniform', 'metric': 'euclidean', 'p': 1, 'leaf_size': 33}. Best is trial 5 with value: 0.8264955189445355.
2026-05-16 10:07:22,492 - INFO - Trial 18 finished with value: 0.7719929178507516 and parameters: {'n_components': 0.9334549958460896, 'svd_solver': 'full', 'whiten': False, 'iterated_power': 3, 'power_iteration_normalizer': 'LU', 'n_neighbors': 4, 'weights': 'distance', 'metric': 'manhattan', 'p': 2, 'leaf_size': 32}. Best is trial 5 with value: 0.8264955189445355.
2026-05-16 10:07:34,539 - INFO - Trial 13 finished with value: 0.8125702797020662 and parameters: {'n_components': 0.9358072703826771, 'svd_solver': 'full', 'whiten': False, 'iterated_power': 5, 'power_iteration_normalizer': 'QR', 'n_neighbors': 9, 'weights': 'uniform', 'metric': 'minkowski', 'p': 1, 'leaf_size': 66}. Best is trial 5 with value: 0.8264955189445355.
2026-05-16 10:08:44,277 - INFO - Trial 0 finished with value: 0.842291323630624 and parameters: {'n_components': 0.9676946047375592, 'svd_solver': 'full', 'whiten': False, 'iterated_power': 8, 'power_iteration_normalizer': 'auto', 'n_neighbors': 8, 'weights': 'distance', 'metric': 'manhattan', 'p': 1, 'leaf_size': 39}. Best is trial 0 with value: 0.842291323630624.
2026-05-16 10:09:19,601 - INFO - Trial 22 finished with value: 0.8204350193211974 and parameters: {'n_components': 0.9577791491209511, 'svd_solver': 'full', 'whiten': True, 'iterated_power': 7, 'power_iteration_normalizer': 'QR', 'n_neighbors': 6, 'weights': 'distance', 'metric': 'euclidean', 'p': 1, 'leaf_size': 99}. Best is trial 0 with value: 0.842291323630624.
2026-05-16 10:09:39,954 - INFO - Trial 9 finished with value: 0.8321650152565988 and parameters: {'n_components': 0.9789756994899621, 'svd_solver': 'full', 'whiten': False, 'iterated_power': 10, 'power_iteration_normalizer': 'LU', 'n_neighbors': 4, 'weights': 'uniform', 'metric': 'euclidean', 'p': 2, 'leaf_size': 44}. Best is trial 0 with value: 0.842291323630624.
2026-05-16 10:14:53,622 - INFO - Trial 21 finished with value: 0.8452533327462882 and parameters: {'n_components': 0.9801107038746646, 'svd_solver': 'full', 'whiten': False, 'iterated_power': 10, 'power_iteration_normalizer': 'auto', 'n_neighbors': 5, 'weights': 'uniform', 'metric': 'euclidean', 'p': 1, 'leaf_size': 96}. Best is trial 21 with value: 0.8452533327462882.
2026-05-16 10:15:32,378 - INFO - Trial 10 finished with value: 0.8501605228194297 and parameters: {'n_components': 0.9793800938438185, 'svd_solver': 'full', 'whiten': True, 'iterated_power': 2, 'power_iteration_normalizer': 'QR', 'n_neighbors': 6, 'weights': 'uniform', 'metric': 'minkowski', 'p': 2, 'leaf_size': 61}. Best is trial 10 with value: 0.8501605228194297.
2026-05-16 10:20:19,854 - INFO - Trial 20 finished with value: 0.853995663922032 and parameters: {'n_components': 0.9855024425922841, 'svd_solver': 'full', 'whiten': False, 'iterated_power': 10, 'power_iteration_normalizer': 'auto', 'n_neighbors': 5, 'weights': 'uniform', 'metric': 'euclidean', 'p': 1, 'leaf_size': 96}. Best is trial 20 with value: 0.853995663922032.
2026-05-16 10:20:57,811 - INFO - Trial 25 finished with value: 0.8712886105611819 and parameters: {'n_components': 0.984112338310828, 'svd_solver': 'full', 'whiten': False, 'iterated_power': 6, 'power_iteration_normalizer': 'auto', 'n_neighbors': 8, 'weights': 'distance', 'metric': 'euclidean', 'p': 1, 'leaf_size': 96}. Best is trial 25 with value: 0.8712886105611819.
2026-05-16 10:22:57,064 - INFO - Trial 24 finished with value: 0.8731054156553946 and parameters: {'n_components': 0.9854531722275502, 'svd_solver': 'full', 'whiten': False, 'iterated_power': 7, 'power_iteration_normalizer': 'LU', 'n_neighbors': 8, 'weights': 'distance', 'metric': 'euclidean', 'p': 1, 'leaf_size': 92}. Best is trial 24 with value: 0.8731054156553946.
2026-05-16 10:23:59,057 - INFO - Trial 19 finished with value: 0.862930897354877 and parameters: {'n_components': 0.9895154727704984, 'svd_solver': 'full', 'whiten': False, 'iterated_power': 10, 'power_iteration_normalizer': 'auto', 'n_neighbors': 5, 'weights': 'uniform', 'metric': 'euclidean', 'p': 1, 'leaf_size': 89}. Best is trial 24 with value: 0.8731054156553946.
2026-05-16 10:24:21,789 - INFO - Trial 35 pruned. 
2026-05-16 10:25:29,139 - INFO - Trial 23 finished with value: 0.8697258719553466 and parameters: {'n_components': 0.9877335475393788, 'svd_solver': 'full', 'whiten': False, 'iterated_power': 10, 'power_iteration_normalizer': 'auto', 'n_neighbors': 6, 'weights': 'distance', 'metric': 'euclidean', 'p': 1, 'leaf_size': 96}. Best is trial 24 with value: 0.8731054156553946.
2026-05-16 10:26:18,990 - INFO - Trial 1 finished with value: 0.8265092117551692 and parameters: {'n_components': 0.9857545916534708, 'svd_solver': 'full', 'whiten': True, 'iterated_power': 3, 'power_iteration_normalizer': 'QR', 'n_neighbors': 3, 'weights': 'uniform', 'metric': 'minkowski', 'p': 2, 'leaf_size': 51}. Best is trial 24 with value: 0.8731054156553946.
2026-05-16 10:28:35,111 - INFO - Trial 37 finished with value: 0.8445015225524877 and parameters: {'n_components': 0.9690701166857386, 'svd_solver': 'full', 'whiten': False, 'iterated_power': 7, 'power_iteration_normalizer': 'auto', 'n_neighbors': 9, 'weights': 'distance', 'metric': 'euclidean', 'p': 1, 'leaf_size': 83}. Best is trial 24 with value: 0.8731054156553946.
2026-05-16 10:28:49,935 - INFO - Trial 38 finished with value: 0.837262536894095 and parameters: {'n_components': 0.9636638889343195, 'svd_solver': 'full', 'whiten': False, 'iterated_power': 7, 'power_iteration_normalizer': 'auto', 'n_neighbors': 9, 'weights': 'distance', 'metric': 'euclidean', 'p': 1, 'leaf_size': 83}. Best is trial 24 with value: 0.8731054156553946.
2026-05-16 10:29:58,776 - INFO - Trial 40 pruned. 
2026-05-16 10:31:57,856 - INFO - Trial 39 finished with value: 0.8372387072635371 and parameters: {'n_components': 0.966063744574635, 'svd_solver': 'full', 'whiten': False, 'iterated_power': 7, 'power_iteration_normalizer': 'LU', 'n_neighbors': 8, 'weights': 'distance', 'metric': 'euclidean', 'p': 1, 'leaf_size': 89}. Best is trial 24 with value: 0.8731054156553946.
2026-05-16 10:32:44,264 - INFO - Trial 41 finished with value: 0.8314289507307235 and parameters: {'n_components': 0.9698182607846194, 'svd_solver': 'full', 'whiten': False, 'iterated_power': 9, 'power_iteration_normalizer': 'auto', 'n_neighbors': 6, 'weights': 'distance', 'metric': 'euclidean', 'p': 1, 'leaf_size': 75}. Best is trial 24 with value: 0.8731054156553946.
2026-05-16 10:35:37,050 - INFO - Trial 42 finished with value: 0.8365676368326052 and parameters: {'n_components': 0.9725987490714524, 'svd_solver': 'full', 'whiten': False, 'iterated_power': 9, 'power_iteration_normalizer': 'auto', 'n_neighbors': 6, 'weights': 'distance', 'metric': 'euclidean', 'p': 1, 'leaf_size': 77}. Best is trial 24 with value: 0.8731054156553946.
2026-05-16 10:37:51,284 - INFO - Trial 33 finished with value: 0.8694374477144564 and parameters: {'n_components': 0.989070095259029, 'svd_solver': 'full', 'whiten': False, 'iterated_power': 6, 'power_iteration_normalizer': 'auto', 'n_neighbors': 6, 'weights': 'uniform', 'metric': 'euclidean', 'p': 2, 'leaf_size': 84}. Best is trial 24 with value: 0.8731054156553946.
2026-05-16 10:38:00,659 - INFO - Trial 32 finished with value: 0.8638404119077784 and parameters: {'n_components': 0.9862058845067352, 'svd_solver': 'full', 'whiten': False, 'iterated_power': 10, 'power_iteration_normalizer': 'auto', 'n_neighbors': 6, 'weights': 'uniform', 'metric': 'euclidean', 'p': 2, 'leaf_size': 100}. Best is trial 24 with value: 0.8731054156553946.
2026-05-16 10:39:09,367 - INFO - Trial 45 pruned. 
2026-05-16 10:39:25,940 - INFO - Trial 46 pruned. 
2026-05-16 10:39:52,005 - INFO - Trial 47 pruned. 
2026-05-16 10:40:16,883 - INFO - Trial 48 pruned. 
2026-05-16 10:41:37,722 - INFO - Trial 49 pruned. 
2026-05-16 10:41:48,513 - INFO - Trial 50 pruned. 
2026-05-16 10:43:28,107 - INFO - Trial 36 finished with value: 0.8839768510229383 and parameters: {'n_components': 0.9879519170205581, 'svd_solver': 'full', 'whiten': False, 'iterated_power': 7, 'power_iteration_normalizer': 'auto', 'n_neighbors': 9, 'weights': 'distance', 'metric': 'euclidean', 'p': 1, 'leaf_size': 85}. Best is trial 36 with value: 0.8839768510229383.
2026-05-16 10:44:02,405 - INFO - Trial 34 finished with value: 0.8776289112682193 and parameters: {'n_components': 0.9899382139100477, 'svd_solver': 'full', 'whiten': False, 'iterated_power': 6, 'power_iteration_normalizer': 'auto', 'n_neighbors': 7, 'weights': 'distance', 'metric': 'euclidean', 'p': 1, 'leaf_size': 87}. Best is trial 36 with value: 0.8839768510229383.
2026-05-16 10:48:24,878 - INFO - Trial 51 finished with value: 0.845509656186084 and parameters: {'n_components': 0.9767666178205562, 'svd_solver': 'full', 'whiten': False, 'iterated_power': 8, 'power_iteration_normalizer': 'auto', 'n_neighbors': 6, 'weights': 'distance', 'metric': 'euclidean', 'p': 2, 'leaf_size': 100}. Best is trial 36 with value: 0.8839768510229383.
2026-05-16 10:49:06,460 - INFO - Trial 52 finished with value: 0.8476037723421058 and parameters: {'n_components': 0.9779838594787083, 'svd_solver': 'full', 'whiten': False, 'iterated_power': 9, 'power_iteration_normalizer': 'auto', 'n_neighbors': 6, 'weights': 'uniform', 'metric': 'euclidean', 'p': 2, 'leaf_size': 100}. Best is trial 36 with value: 0.8839768510229383.
2026-05-16 10:49:41,198 - INFO - Trial 44 finished with value: 0.8671128190879523 and parameters: {'n_components': 0.9834392861290001, 'svd_solver': 'full', 'whiten': False, 'iterated_power': 6, 'power_iteration_normalizer': 'auto', 'n_neighbors': 7, 'weights': 'distance', 'metric': 'euclidean', 'p': 1, 'leaf_size': 91}. Best is trial 36 with value: 0.8839768510229383.
2026-05-16 10:51:20,161 - INFO - Trial 53 finished with value: 0.8617404127203526 and parameters: {'n_components': 0.9763082176873658, 'svd_solver': 'full', 'whiten': False, 'iterated_power': 7, 'power_iteration_normalizer': 'auto', 'n_neighbors': 10, 'weights': 'distance', 'metric': 'euclidean', 'p': 1, 'leaf_size': 100}. Best is trial 36 with value: 0.8839768510229383.
2026-05-16 10:51:20,841 - INFO - Trial 43 finished with value: 0.8711486066153145 and parameters: {'n_components': 0.9864702166319431, 'svd_solver': 'full', 'whiten': False, 'iterated_power': 9, 'power_iteration_normalizer': 'auto', 'n_neighbors': 7, 'weights': 'distance', 'metric': 'euclidean', 'p': 1, 'leaf_size': 90}. Best is trial 36 with value: 0.8839768510229383.
2026-05-16 10:51:35,207 - INFO - Trial 54 finished with value: 0.860723661172524 and parameters: {'n_components': 0.9755484369674742, 'svd_solver': 'full', 'whiten': False, 'iterated_power': 7, 'power_iteration_normalizer': 'auto', 'n_neighbors': 10, 'weights': 'distance', 'metric': 'euclidean', 'p': 1, 'leaf_size': 100}. Best is trial 36 with value: 0.8839768510229383.
2026-05-16 10:52:05,081 - INFO - Trial 59 pruned. 
2026-05-16 10:52:10,808 - INFO - Trial 58 pruned. 
2026-05-16 10:52:49,716 - INFO - Trial 60 pruned. 
2026-05-16 10:54:25,271 - INFO - Trial 61 pruned. 
2026-05-16 10:54:47,771 - INFO - Trial 55 finished with value: 0.8616900299520637 and parameters: {'n_components': 0.9759294958147785, 'svd_solver': 'full', 'whiten': False, 'iterated_power': 7, 'power_iteration_normalizer': 'auto', 'n_neighbors': 10, 'weights': 'distance', 'metric': 'euclidean', 'p': 1, 'leaf_size': 57}. Best is trial 36 with value: 0.8839768510229383.
2026-05-16 10:57:08,673 - INFO - Trial 26 finished with value: 0.8740643775218612 and parameters: {'n_components': 0.9812024655617425, 'svd_solver': 'full', 'whiten': False, 'iterated_power': 1, 'power_iteration_normalizer': 'QR', 'n_neighbors': 9, 'weights': 'distance', 'metric': 'minkowski', 'p': 1, 'leaf_size': 95}. Best is trial 36 with value: 0.8839768510229383.
2026-05-16 10:58:56,481 - INFO - Trial 66 pruned. 
2026-05-16 11:02:09,252 - INFO - Trial 30 finished with value: 0.861325266296251 and parameters: {'n_components': 0.9822198826294982, 'svd_solver': 'full', 'whiten': False, 'iterated_power': 10, 'power_iteration_normalizer': 'auto', 'n_neighbors': 6, 'weights': 'distance', 'metric': 'manhattan', 'p': 1, 'leaf_size': 90}. Best is trial 36 with value: 0.8839768510229383.
2026-05-16 11:02:50,788 - INFO - Trial 57 finished with value: 0.8533147024128647 and parameters: {'n_components': 0.97354513109274, 'svd_solver': 'full', 'whiten': False, 'iterated_power': 7, 'power_iteration_normalizer': 'auto', 'n_neighbors': 9, 'weights': 'distance', 'metric': 'manhattan', 'p': 1, 'leaf_size': 57}. Best is trial 36 with value: 0.8839768510229383.
2026-05-16 11:03:08,692 - INFO - Trial 69 pruned. 
2026-05-16 11:03:43,388 - INFO - Trial 31 finished with value: 0.8771584218861775 and parameters: {'n_components': 0.989847667288815, 'svd_solver': 'full', 'whiten': True, 'iterated_power': 6, 'power_iteration_normalizer': 'QR', 'n_neighbors': 6, 'weights': 'uniform', 'metric': 'euclidean', 'p': 2, 'leaf_size': 98}. Best is trial 36 with value: 0.8839768510229383.
2026-05-16 11:04:26,705 - INFO - Trial 71 pruned. 
2026-05-16 11:05:06,569 - INFO - Trial 27 finished with value: 0.8729748729909851 and parameters: {'n_components': 0.9830407412008347, 'svd_solver': 'full', 'whiten': False, 'iterated_power': 7, 'power_iteration_normalizer': 'auto', 'n_neighbors': 8, 'weights': 'distance', 'metric': 'manhattan', 'p': 1, 'leaf_size': 95}. Best is trial 36 with value: 0.8839768510229383.
2026-05-16 11:07:17,769 - INFO - Trial 56 finished with value: 0.8841131211074259 and parameters: {'n_components': 0.9892405320286414, 'svd_solver': 'full', 'whiten': False, 'iterated_power': 7, 'power_iteration_normalizer': 'auto', 'n_neighbors': 9, 'weights': 'distance', 'metric': 'euclidean', 'p': 1, 'leaf_size': 56}. Best is trial 56 with value: 0.8841131211074259.
2026-05-16 11:08:05,475 - INFO - Trial 62 finished with value: 0.8816100729222744 and parameters: {'n_components': 0.9898690774230477, 'svd_solver': 'full', 'whiten': False, 'iterated_power': 9, 'power_iteration_normalizer': 'auto', 'n_neighbors': 8, 'weights': 'distance', 'metric': 'euclidean', 'p': 1, 'leaf_size': 63}. Best is trial 56 with value: 0.8841131211074259.
2026-05-16 11:08:24,298 - INFO - Trial 75 pruned. 
2026-05-16 11:11:05,933 - INFO - Trial 29 finished with value: 0.8754653625514536 and parameters: {'n_components': 0.9894690330066042, 'svd_solver': 'full', 'whiten': False, 'iterated_power': 10, 'power_iteration_normalizer': 'auto', 'n_neighbors': 6, 'weights': 'distance', 'metric': 'manhattan', 'p': 2, 'leaf_size': 53}. Best is trial 56 with value: 0.8841131211074259.
2026-05-16 11:12:19,672 - INFO - Trial 63 finished with value: 0.8816115113090435 and parameters: {'n_components': 0.9898189009964364, 'svd_solver': 'full', 'whiten': False, 'iterated_power': 9, 'power_iteration_normalizer': 'auto', 'n_neighbors': 8, 'weights': 'distance', 'metric': 'euclidean', 'p': 1, 'leaf_size': 87}. Best is trial 56 with value: 0.8841131211074259.
2026-05-16 11:14:13,864 - INFO - Trial 65 finished with value: 0.8816151651512529 and parameters: {'n_components': 0.9896303933626579, 'svd_solver': 'full', 'whiten': False, 'iterated_power': 9, 'power_iteration_normalizer': 'auto', 'n_neighbors': 8, 'weights': 'distance', 'metric': 'euclidean', 'p': 1, 'leaf_size': 86}. Best is trial 56 with value: 0.8841131211074259.
2026-05-16 11:15:16,646 - INFO - Trial 64 finished with value: 0.8809446036034982 and parameters: {'n_components': 0.9889410256528287, 'svd_solver': 'full', 'whiten': False, 'iterated_power': 9, 'power_iteration_normalizer': 'auto', 'n_neighbors': 8, 'weights': 'distance', 'metric': 'euclidean', 'p': 1, 'leaf_size': 87}. Best is trial 56 with value: 0.8841131211074259.
2026-05-16 11:21:22,527 - INFO - Trial 80 finished with value: 0.8636256696666024 and parameters: {'n_components': 0.9794508861221337, 'svd_solver': 'full', 'whiten': False, 'iterated_power': 9, 'power_iteration_normalizer': 'auto', 'n_neighbors': 8, 'weights': 'distance', 'metric': 'euclidean', 'p': 1, 'leaf_size': 66}. Best is trial 56 with value: 0.8841131211074259.
2026-05-16 11:22:24,202 - INFO - Trial 28 finished with value: 0.8835427480315794 and parameters: {'n_components': 0.9883784174367971, 'svd_solver': 'full', 'whiten': False, 'iterated_power': 10, 'power_iteration_normalizer': 'auto', 'n_neighbors': 8, 'weights': 'distance', 'metric': 'manhattan', 'p': 1, 'leaf_size': 49}. Best is trial 56 with value: 0.8841131211074259.
2026-05-16 11:22:42,142 - INFO - Trial 81 pruned. 
2026-05-16 11:24:01,704 - INFO - Trial 82 pruned. 
2026-05-16 11:28:04,018 - INFO - Trial 68 finished with value: 0.8679360108175388 and parameters: {'n_components': 0.9825304073911887, 'svd_solver': 'full', 'whiten': False, 'iterated_power': 1, 'power_iteration_normalizer': 'QR', 'n_neighbors': 7, 'weights': 'distance', 'metric': 'minkowski', 'p': 1, 'leaf_size': 26}. Best is trial 56 with value: 0.8841131211074259.
2026-05-16 11:38:42,258 - INFO - Trial 83 finished with value: 0.8809462146358247 and parameters: {'n_components': 0.9891670662255384, 'svd_solver': 'full', 'whiten': False, 'iterated_power': 9, 'power_iteration_normalizer': 'auto', 'n_neighbors': 8, 'weights': 'distance', 'metric': 'euclidean', 'p': 1, 'leaf_size': 43}. Best is trial 56 with value: 0.8841131211074259.
2026-05-16 11:39:48,890 - INFO - Trial 86 pruned. 
2026-05-16 11:40:17,508 - INFO - Trial 84 finished with value: 0.8849481889021902 and parameters: {'n_components': 0.9899720421231224, 'svd_solver': 'full', 'whiten': False, 'iterated_power': 10, 'power_iteration_normalizer': 'auto', 'n_neighbors': 9, 'weights': 'distance', 'metric': 'euclidean', 'p': 1, 'leaf_size': 52}. Best is trial 84 with value: 0.8849481889021902.
2026-05-16 11:41:18,478 - INFO - Trial 67 finished with value: 0.8742001892147984 and parameters: {'n_components': 0.9837602544233912, 'svd_solver': 'full', 'whiten': False, 'iterated_power': 1, 'power_iteration_normalizer': 'QR', 'n_neighbors': 8, 'weights': 'distance', 'metric': 'minkowski', 'p': 1, 'leaf_size': 79}. Best is trial 84 with value: 0.8849481889021902.
2026-05-16 11:41:33,644 - INFO - Trial 77 finished with value: 0.870416704752485 and parameters: {'n_components': 0.9896458924115732, 'svd_solver': 'full', 'whiten': True, 'iterated_power': 1, 'power_iteration_normalizer': 'QR', 'n_neighbors': 5, 'weights': 'uniform', 'metric': 'minkowski', 'p': 2, 'leaf_size': 65}. Best is trial 84 with value: 0.8849481889021902.
2026-05-16 11:44:25,724 - INFO - Trial 85 finished with value: 0.8847528130433489 and parameters: {'n_components': 0.9895221900224352, 'svd_solver': 'full', 'whiten': False, 'iterated_power': 10, 'power_iteration_normalizer': 'auto', 'n_neighbors': 9, 'weights': 'distance', 'metric': 'euclidean', 'p': 1, 'leaf_size': 49}. Best is trial 84 with value: 0.8849481889021902.
2026-05-16 11:54:01,080 - INFO - Trial 79 finished with value: 0.8863677063767883 and parameters: {'n_components': 0.9896849407524938, 'svd_solver': 'full', 'whiten': True, 'iterated_power': 9, 'power_iteration_normalizer': 'auto', 'n_neighbors': 8, 'weights': 'uniform', 'metric': 'euclidean', 'p': 1, 'leaf_size': 67}. Best is trial 79 with value: 0.8863677063767883.
2026-05-16 12:00:32,368 - INFO - Trial 89 finished with value: 0.8722697862679855 and parameters: {'n_components': 0.978944034180108, 'svd_solver': 'full', 'whiten': False, 'iterated_power': 10, 'power_iteration_normalizer': 'auto', 'n_neighbors': 10, 'weights': 'distance', 'metric': 'manhattan', 'p': 1, 'leaf_size': 37}. Best is trial 79 with value: 0.8863677063767883.
2026-05-16 12:00:52,278 - INFO - Trial 92 finished with value: 0.8661406690863711 and parameters: {'n_components': 0.9798900599445508, 'svd_solver': 'full', 'whiten': False, 'iterated_power': 10, 'power_iteration_normalizer': 'auto', 'n_neighbors': 9, 'weights': 'uniform', 'metric': 'euclidean', 'p': 1, 'leaf_size': 53}. Best is trial 79 with value: 0.8863677063767883.
2026-05-16 12:05:56,170 - INFO - Trial 91 finished with value: 0.8746575558677818 and parameters: {'n_components': 0.9804906556691619, 'svd_solver': 'full', 'whiten': False, 'iterated_power': 10, 'power_iteration_normalizer': 'auto', 'n_neighbors': 10, 'weights': 'distance', 'metric': 'manhattan', 'p': 1, 'leaf_size': 39}. Best is trial 79 with value: 0.8863677063767883.
2026-05-16 12:06:02,409 - INFO - Trial 90 finished with value: 0.8764980153253239 and parameters: {'n_components': 0.981537387222142, 'svd_solver': 'full', 'whiten': False, 'iterated_power': 10, 'power_iteration_normalizer': 'auto', 'n_neighbors': 10, 'weights': 'distance', 'metric': 'manhattan', 'p': 1, 'leaf_size': 39}. Best is trial 79 with value: 0.8863677063767883.
