2026-05-20 11:46:44,987 - INFO - ----- Fine Tuning -----
2026-05-20 11:46:44,988 - INFO - A new study created in memory with name: no-name-86a8d1d8-e818-418c-ac99-60387569d5c8
2026-05-20 11:48:00,090 - INFO - ----- Fine Tuning -----
2026-05-20 11:48:00,090 - INFO - A new study created in memory with name: no-name-0ba2c5e2-0f20-47bf-b1e3-b634a07bcacc
2026-05-20 11:49:21,729 - INFO - Trial 4 finished with value: 0.5 and parameters: {'n_components': 0.8439119366707473, 'svd_solver': 'auto', 'whiten': True, 'iterated_power': 7, 'power_iteration_normalizer': 'LU', 'solver': 'saga', 'C': 0.0001353709326540703, 'l1_ratio': 0.3969999418870581}. Best is trial 4 with value: 0.5.
2026-05-20 11:49:21,747 - INFO - Trial 11 finished with value: 0.5 and parameters: {'n_components': 0.8484109441536452, 'svd_solver': 'full', 'whiten': False, 'iterated_power': 5, 'power_iteration_normalizer': 'LU', 'solver': 'saga', 'C': 2.6412874894039e-05, 'l1_ratio': 0.8168478444866669}. Best is trial 4 with value: 0.5.
2026-05-20 11:49:33,904 - INFO - Trial 9 finished with value: 0.5214691489623081 and parameters: {'n_components': 0.8080775283794727, 'svd_solver': 'auto', 'whiten': True, 'iterated_power': 6, 'power_iteration_normalizer': 'LU', 'solver': 'saga', 'C': 0.9056892491469347, 'l1_ratio': 0.919185277999594}. Best is trial 9 with value: 0.5214691489623081.
2026-05-20 11:49:42,827 - INFO - Trial 2 finished with value: 0.5312935058893619 and parameters: {'n_components': 0.8717407565051927, 'svd_solver': 'full', 'whiten': True, 'iterated_power': 3, 'power_iteration_normalizer': 'LU', 'solver': 'saga', 'C': 0.018733466657761596, 'l1_ratio': 0.38444453240900334}. Best is trial 2 with value: 0.5312935058893619.
2026-05-20 11:49:44,304 - INFO - Trial 10 finished with value: 0.5342624047927608 and parameters: {'n_components': 0.8559047051945143, 'svd_solver': 'auto', 'whiten': True, 'iterated_power': 6, 'power_iteration_normalizer': 'auto', 'solver': 'saga', 'C': 0.06533314405087677, 'l1_ratio': 0.6379707651367952}. Best is trial 10 with value: 0.5342624047927608.
2026-05-20 11:49:47,773 - INFO - Trial 8 finished with value: 0.5494336618436253 and parameters: {'n_components': 0.8811935295985778, 'svd_solver': 'full', 'whiten': True, 'iterated_power': 7, 'power_iteration_normalizer': 'QR', 'solver': 'saga', 'C': 0.30040980615845075, 'l1_ratio': 0.8376291719930338}. Best is trial 8 with value: 0.5494336618436253.
2026-05-20 11:49:47,838 - INFO - Trial 5 finished with value: 0.5348232964643415 and parameters: {'n_components': 0.8526476654916266, 'svd_solver': 'auto', 'whiten': False, 'iterated_power': 2, 'power_iteration_normalizer': 'QR', 'solver': 'saga', 'C': 0.000361404350489144, 'l1_ratio': 0.9513141898225825}. Best is trial 8 with value: 0.5494336618436253.
2026-05-20 11:49:54,124 - INFO - Trial 3 finished with value: 0.5305974556513999 and parameters: {'n_components': 0.8303724811513324, 'svd_solver': 'auto', 'whiten': False, 'iterated_power': 5, 'power_iteration_normalizer': 'auto', 'solver': 'saga', 'C': 0.0027349256597392958, 'l1_ratio': 0.10271450806364113}. Best is trial 8 with value: 0.5494336618436253.
2026-05-20 11:50:13,810 - INFO - Trial 0 finished with value: 0.5310948289494529 and parameters: {'n_components': 0.8699629757305201, 'svd_solver': 'full', 'whiten': False, 'iterated_power': 2, 'power_iteration_normalizer': 'LU', 'solver': 'saga', 'C': 0.030017142814866653, 'l1_ratio': 0.068461872247638}. Best is trial 8 with value: 0.5494336618436253.
2026-05-20 11:50:15,157 - INFO - Trial 6 finished with value: 0.5310922401473304 and parameters: {'n_components': 0.8692005612093637, 'svd_solver': 'full', 'whiten': False, 'iterated_power': 1, 'power_iteration_normalizer': 'auto', 'solver': 'saga', 'C': 0.020196792470679997, 'l1_ratio': 0.001866821106328298}. Best is trial 8 with value: 0.5494336618436253.
2026-05-20 11:50:51,255 - INFO - Trial 17 pruned. 
2026-05-20 11:50:57,839 - INFO - Trial 12 finished with value: 0.521451882832084 and parameters: {'n_components': 0.807584887660621, 'svd_solver': 'auto', 'whiten': True, 'iterated_power': 1, 'power_iteration_normalizer': 'auto', 'solver': 'saga', 'C': 5.11211115493908, 'l1_ratio': 0.32374870503419373}. Best is trial 8 with value: 0.5494336618436253.
2026-05-20 11:51:07,930 - INFO - Trial 13 finished with value: 0.5289176476595173 and parameters: {'n_components': 0.8227630561060865, 'svd_solver': 'full', 'whiten': False, 'iterated_power': 6, 'power_iteration_normalizer': 'auto', 'solver': 'saga', 'C': 0.0004525594906458202, 'l1_ratio': 0.917953522226591}. Best is trial 8 with value: 0.5494336618436253.
2026-05-20 11:51:53,536 - INFO - ----- Fine Tuning -----
2026-05-20 11:51:53,536 - INFO - A new study created in memory with name: no-name-8afc2d86-44bc-48ba-9f6f-17482af89867
2026-05-20 11:53:00,754 - INFO - Trial 6 finished with value: 0.5 and parameters: {'n_components': 0.8443901452858532, 'svd_solver': 'auto', 'whiten': True, 'iterated_power': 8, 'power_iteration_normalizer': 'QR', 'solver': 'saga', 'C': 1.5591637294303626e-05, 'l1_ratio': 0.7966719666202452}. Best is trial 6 with value: 0.5.
2026-05-20 11:53:00,932 - INFO - Trial 8 finished with value: 0.5 and parameters: {'n_components': 0.8937943102395445, 'svd_solver': 'auto', 'whiten': False, 'iterated_power': 1, 'power_iteration_normalizer': 'auto', 'solver': 'saga', 'C': 2.3165119056832914e-05, 'l1_ratio': 0.23233302448109072}. Best is trial 6 with value: 0.5.
2026-05-20 11:53:00,962 - INFO - Trial 3 finished with value: 0.5 and parameters: {'n_components': 0.8923526997455186, 'svd_solver': 'auto', 'whiten': False, 'iterated_power': 10, 'power_iteration_normalizer': 'LU', 'solver': 'saga', 'C': 3.182826625796409e-05, 'l1_ratio': 0.828824235279081}. Best is trial 6 with value: 0.5.
2026-05-20 11:53:11,071 - INFO - Trial 1 finished with value: 0.7120472852915432 and parameters: {'n_components': 0.9454498814751755, 'svd_solver': 'auto', 'whiten': False, 'iterated_power': 1, 'power_iteration_normalizer': 'auto', 'solver': 'saga', 'C': 8.166711010358157e-05, 'l1_ratio': 0.5921433326411865}. Best is trial 1 with value: 0.7120472852915432.
2026-05-20 11:53:54,140 - INFO - ----- Fine Tuning -----
2026-05-20 11:53:54,140 - INFO - A new study created in memory with name: no-name-b995edcd-56fb-4f6c-b608-fb595b9be706
2026-05-20 11:55:26,860 - INFO - Trial 10 finished with value: 0.5256770237975404 and parameters: {'n_components': 0.8446692107166498, 'svd_solver': 'auto', 'whiten': False, 'iterated_power': 10, 'power_iteration_normalizer': 'auto', 'solver': 'saga', 'C': 0.0005058031432946601, 'l1_ratio': 0.5738448279991721}. Best is trial 10 with value: 0.5256770237975404.
2026-05-20 11:55:29,361 - INFO - Trial 11 finished with value: 0.5420236256104932 and parameters: {'n_components': 0.918280810990578, 'svd_solver': 'full', 'whiten': False, 'iterated_power': 8, 'power_iteration_normalizer': 'LU', 'solver': 'saga', 'C': 1.951115443516809e-05, 'l1_ratio': 0.3927529473468826}. Best is trial 11 with value: 0.5420236256104932.
2026-05-20 11:55:31,160 - INFO - Trial 9 finished with value: 0.5494246761715005 and parameters: {'n_components': 0.8854188753846258, 'svd_solver': 'auto', 'whiten': True, 'iterated_power': 4, 'power_iteration_normalizer': 'QR', 'solver': 'saga', 'C': 0.05617013294820209, 'l1_ratio': 0.41064559646774557}. Best is trial 9 with value: 0.5494246761715005.
2026-05-20 11:55:45,245 - INFO - Trial 7 finished with value: 0.5311326393962743 and parameters: {'n_components': 0.8429385277177845, 'svd_solver': 'auto', 'whiten': True, 'iterated_power': 9, 'power_iteration_normalizer': 'QR', 'solver': 'saga', 'C': 0.024252632716655193, 'l1_ratio': 0.830057203509501}. Best is trial 9 with value: 0.5494246761715005.
2026-05-20 11:55:45,333 - INFO - Trial 8 finished with value: 0.5207779600952369 and parameters: {'n_components': 0.8106286719155119, 'svd_solver': 'full', 'whiten': False, 'iterated_power': 8, 'power_iteration_normalizer': 'QR', 'solver': 'saga', 'C': 67.49209697749458, 'l1_ratio': 0.09191377226560948}. Best is trial 9 with value: 0.5494246761715005.
2026-05-20 11:55:45,448 - INFO - Trial 3 finished with value: 0.5494413671958508 and parameters: {'n_components': 0.9130652490990487, 'svd_solver': 'auto', 'whiten': False, 'iterated_power': 3, 'power_iteration_normalizer': 'QR', 'solver': 'saga', 'C': 0.6170885950559172, 'l1_ratio': 0.5693955917225224}. Best is trial 3 with value: 0.5494413671958508.
2026-05-20 11:55:45,465 - INFO - Trial 2 finished with value: 0.7372347946001178 and parameters: {'n_components': 0.9779467595485157, 'svd_solver': 'auto', 'whiten': False, 'iterated_power': 5, 'power_iteration_normalizer': 'LU', 'solver': 'saga', 'C': 1.096480590054959, 'l1_ratio': 0.7385118698307144}. Best is trial 2 with value: 0.7372347946001178.
2026-05-20 11:55:53,620 - INFO - Trial 4 finished with value: 0.5340995110828095 and parameters: {'n_components': 0.8603356836777726, 'svd_solver': 'full', 'whiten': False, 'iterated_power': 4, 'power_iteration_normalizer': 'LU', 'solver': 'saga', 'C': 1.23532499979617, 'l1_ratio': 0.4703778034910042}. Best is trial 2 with value: 0.7372347946001178.
2026-05-20 11:55:55,946 - INFO - Trial 1 finished with value: 0.5315853225725149 and parameters: {'n_components': 0.8467955871837856, 'svd_solver': 'full', 'whiten': False, 'iterated_power': 1, 'power_iteration_normalizer': 'auto', 'solver': 'saga', 'C': 0.011998149523296977, 'l1_ratio': 0.6959876313360059}. Best is trial 2 with value: 0.7372347946001178.
2026-05-20 11:55:56,017 - INFO - Trial 6 finished with value: 0.5493979697268931 and parameters: {'n_components': 0.9139257601883557, 'svd_solver': 'full', 'whiten': True, 'iterated_power': 4, 'power_iteration_normalizer': 'auto', 'solver': 'saga', 'C': 0.48116514865300813, 'l1_ratio': 0.8631045246460162}. Best is trial 2 with value: 0.7372347946001178.
2026-05-20 11:56:05,465 - INFO - Trial 0 finished with value: 0.7365169557890585 and parameters: {'n_components': 0.976825710461406, 'svd_solver': 'full', 'whiten': True, 'iterated_power': 2, 'power_iteration_normalizer': 'QR', 'solver': 'saga', 'C': 1.0103988630398002, 'l1_ratio': 0.4424367041237812}. Best is trial 2 with value: 0.7372347946001178.
2026-05-20 11:56:19,541 - INFO - Trial 5 finished with value: 0.768800058627409 and parameters: {'n_components': 0.9857799693936743, 'svd_solver': 'full', 'whiten': False, 'iterated_power': 5, 'power_iteration_normalizer': 'auto', 'solver': 'saga', 'C': 0.008550991374238122, 'l1_ratio': 0.849848586047571}. Best is trial 5 with value: 0.768800058627409.
2026-05-20 11:56:27,126 - INFO - Trial 12 pruned. 
2026-05-20 11:57:00,178 - INFO - Trial 14 pruned. 
2026-05-20 11:57:00,254 - INFO - Trial 13 pruned. 
2026-05-20 11:57:09,944 - INFO - Trial 15 pruned. 
2026-05-20 11:57:23,912 - INFO - Trial 17 finished with value: 0.5304762679520069 and parameters: {'n_components': 0.8495672324328547, 'svd_solver': 'full', 'whiten': True, 'iterated_power': 9, 'power_iteration_normalizer': 'auto', 'solver': 'saga', 'C': 44.20660424785112, 'l1_ratio': 0.636390505902575}. Best is trial 5 with value: 0.768800058627409.
2026-05-20 11:57:26,092 - INFO - Trial 18 finished with value: 0.7244677796691009 and parameters: {'n_components': 0.9741624344104639, 'svd_solver': 'auto', 'whiten': True, 'iterated_power': 8, 'power_iteration_normalizer': 'QR', 'solver': 'saga', 'C': 30.827611529134654, 'l1_ratio': 0.20817038775922492}. Best is trial 5 with value: 0.768800058627409.
2026-05-20 11:57:27,614 - INFO - Trial 16 finished with value: 0.5305258523386921 and parameters: {'n_components': 0.8220540726713145, 'svd_solver': 'full', 'whiten': False, 'iterated_power': 4, 'power_iteration_normalizer': 'auto', 'solver': 'saga', 'C': 47.708100413538375, 'l1_ratio': 0.6616441241227249}. Best is trial 5 with value: 0.768800058627409.
2026-05-20 11:57:35,937 - INFO - Trial 19 finished with value: 0.7125016065211156 and parameters: {'n_components': 0.9402999848857119, 'svd_solver': 'full', 'whiten': False, 'iterated_power': 2, 'power_iteration_normalizer': 'QR', 'solver': 'saga', 'C': 0.1365484050490816, 'l1_ratio': 0.8805637435479029}. Best is trial 5 with value: 0.768800058627409.
2026-05-20 11:57:38,742 - INFO - Trial 21 finished with value: 0.7365221593258438 and parameters: {'n_components': 0.9769508857628747, 'svd_solver': 'auto', 'whiten': True, 'iterated_power': 6, 'power_iteration_normalizer': 'LU', 'solver': 'saga', 'C': 56.144286988401554, 'l1_ratio': 0.9562700748842639}. Best is trial 5 with value: 0.768800058627409.
2026-05-20 11:57:40,733 - INFO - Trial 20 finished with value: 0.7683737929993971 and parameters: {'n_components': 0.984391182018214, 'svd_solver': 'auto', 'whiten': True, 'iterated_power': 6, 'power_iteration_normalizer': 'LU', 'solver': 'saga', 'C': 93.96701724903455, 'l1_ratio': 0.9791843560475587}. Best is trial 5 with value: 0.768800058627409.
2026-05-20 11:57:41,934 - INFO - Trial 23 finished with value: 0.7677306649702075 and parameters: {'n_components': 0.9821616385912386, 'svd_solver': 'auto', 'whiten': False, 'iterated_power': 6, 'power_iteration_normalizer': 'LU', 'solver': 'saga', 'C': 0.0009956657083157842, 'l1_ratio': 0.9700779282183982}. Best is trial 5 with value: 0.768800058627409.
2026-05-20 11:57:42,526 - INFO - Trial 22 finished with value: 0.7690443102977903 and parameters: {'n_components': 0.986855778470178, 'svd_solver': 'auto', 'whiten': True, 'iterated_power': 1, 'power_iteration_normalizer': 'LU', 'solver': 'saga', 'C': 19.177971314115805, 'l1_ratio': 0.1744354330711087}. Best is trial 22 with value: 0.7690443102977903.
2026-05-20 11:57:52,666 - INFO - Trial 24 finished with value: 0.77053686848568 and parameters: {'n_components': 0.9897095747135892, 'svd_solver': 'auto', 'whiten': False, 'iterated_power': 6, 'power_iteration_normalizer': 'LU', 'solver': 'saga', 'C': 35.51216502956903, 'l1_ratio': 0.9645280242638959}. Best is trial 24 with value: 0.77053686848568.
2026-05-20 11:58:08,225 - INFO - Trial 26 finished with value: 0.7687297110336301 and parameters: {'n_components': 0.9857117791748251, 'svd_solver': 'auto', 'whiten': False, 'iterated_power': 6, 'power_iteration_normalizer': 'LU', 'solver': 'saga', 'C': 7.193876668400804, 'l1_ratio': 0.9841248042030651}. Best is trial 24 with value: 0.77053686848568.
2026-05-20 11:58:09,782 - INFO - Trial 25 finished with value: 0.7700728766739464 and parameters: {'n_components': 0.9881292073987162, 'svd_solver': 'auto', 'whiten': False, 'iterated_power': 6, 'power_iteration_normalizer': 'LU', 'solver': 'saga', 'C': 7.48154989522924, 'l1_ratio': 0.9736709055229923}. Best is trial 24 with value: 0.77053686848568.
2026-05-20 11:58:20,566 - INFO - Trial 29 finished with value: 0.7130735403967823 and parameters: {'n_components': 0.9512973187005767, 'svd_solver': 'auto', 'whiten': False, 'iterated_power': 6, 'power_iteration_normalizer': 'LU', 'solver': 'saga', 'C': 5.161617706037509, 'l1_ratio': 0.9989048920649882}. Best is trial 24 with value: 0.77053686848568.
2026-05-20 11:58:22,525 - INFO - Trial 27 finished with value: 0.7687573965063145 and parameters: {'n_components': 0.9858301185691983, 'svd_solver': 'auto', 'whiten': False, 'iterated_power': 6, 'power_iteration_normalizer': 'LU', 'solver': 'saga', 'C': 6.082494588169171, 'l1_ratio': 0.9630704193897223}. Best is trial 24 with value: 0.77053686848568.
2026-05-20 11:58:22,931 - INFO - Trial 30 finished with value: 0.7130690122660129 and parameters: {'n_components': 0.9551847986572382, 'svd_solver': 'auto', 'whiten': False, 'iterated_power': 6, 'power_iteration_normalizer': 'LU', 'solver': 'saga', 'C': 0.11874122607888697, 'l1_ratio': 0.9994309321915806}. Best is trial 24 with value: 0.77053686848568.
2026-05-20 11:58:32,964 - INFO - Trial 33 finished with value: 0.7130705892954294 and parameters: {'n_components': 0.9537546815909743, 'svd_solver': 'auto', 'whiten': False, 'iterated_power': 6, 'power_iteration_normalizer': 'LU', 'solver': 'saga', 'C': 5.377947398874207, 'l1_ratio': 0.7753972775546154}. Best is trial 24 with value: 0.77053686848568.
2026-05-20 11:58:33,816 - INFO - Trial 35 finished with value: 0.7129892122598763 and parameters: {'n_components': 0.9503207526516817, 'svd_solver': 'auto', 'whiten': True, 'iterated_power': 5, 'power_iteration_normalizer': 'LU', 'solver': 'saga', 'C': 6.32428577154353, 'l1_ratio': 0.28266242607150355}. Best is trial 24 with value: 0.77053686848568.
2026-05-20 11:58:34,536 - INFO - Trial 34 finished with value: 0.713073182946833 and parameters: {'n_components': 0.9536500038540272, 'svd_solver': 'auto', 'whiten': True, 'iterated_power': 5, 'power_iteration_normalizer': 'LU', 'solver': 'saga', 'C': 8.322812830221508, 'l1_ratio': 0.31303414019703835}. Best is trial 24 with value: 0.77053686848568.
2026-05-20 11:58:36,550 - INFO - Trial 31 finished with value: 0.7701641333446844 and parameters: {'n_components': 0.9891646947488899, 'svd_solver': 'auto', 'whiten': False, 'iterated_power': 6, 'power_iteration_normalizer': 'LU', 'solver': 'saga', 'C': 7.015350453650178, 'l1_ratio': 0.9956625810805648}. Best is trial 24 with value: 0.77053686848568.
2026-05-20 11:58:36,610 - INFO - Trial 28 finished with value: 0.7705339039600817 and parameters: {'n_components': 0.9898027613386262, 'svd_solver': 'auto', 'whiten': False, 'iterated_power': 6, 'power_iteration_normalizer': 'LU', 'solver': 'saga', 'C': 5.229336672575932, 'l1_ratio': 0.9843155604928525}. Best is trial 24 with value: 0.77053686848568.
2026-05-20 11:58:38,433 - INFO - Trial 32 finished with value: 0.7705317842269201 and parameters: {'n_components': 0.989839531616922, 'svd_solver': 'auto', 'whiten': False, 'iterated_power': 6, 'power_iteration_normalizer': 'LU', 'solver': 'saga', 'C': 4.622225569559663, 'l1_ratio': 0.9940704624371772}. Best is trial 24 with value: 0.77053686848568.
2026-05-20 11:58:44,721 - INFO - Trial 36 finished with value: 0.7130717553224913 and parameters: {'n_components': 0.9549924172672374, 'svd_solver': 'auto', 'whiten': False, 'iterated_power': 1, 'power_iteration_normalizer': 'LU', 'solver': 'saga', 'C': 11.662725870533922, 'l1_ratio': 0.31612355538903925}. Best is trial 24 with value: 0.77053686848568.
2026-05-20 11:58:58,915 - INFO - Trial 37 finished with value: 0.7130719984932299 and parameters: {'n_components': 0.9541253447375767, 'svd_solver': 'auto', 'whiten': False, 'iterated_power': 1, 'power_iteration_normalizer': 'LU', 'solver': 'saga', 'C': 3.7297574352949967, 'l1_ratio': 0.3097818087193258}. Best is trial 24 with value: 0.77053686848568.
2026-05-20 11:59:00,482 - INFO - Trial 38 finished with value: 0.71306659405811 and parameters: {'n_components': 0.9547674742917186, 'svd_solver': 'auto', 'whiten': False, 'iterated_power': 7, 'power_iteration_normalizer': 'LU', 'solver': 'saga', 'C': 7.479691409974042, 'l1_ratio': 0.31718376014738947}. Best is trial 24 with value: 0.77053686848568.
2026-05-20 11:59:11,674 - INFO - Trial 39 finished with value: 0.7138218513203938 and parameters: {'n_components': 0.9624386751136407, 'svd_solver': 'auto', 'whiten': True, 'iterated_power': 7, 'power_iteration_normalizer': 'LU', 'solver': 'saga', 'C': 7.125098828647025, 'l1_ratio': 0.25302874097164235}. Best is trial 24 with value: 0.77053686848568.
2026-05-20 11:59:19,411 - INFO - Trial 43 finished with value: 0.7148970947812938 and parameters: {'n_components': 0.9646556722071133, 'svd_solver': 'auto', 'whiten': False, 'iterated_power': 2, 'power_iteration_normalizer': 'LU', 'solver': 'saga', 'C': 0.0032094120643266586, 'l1_ratio': 0.8990919802483806}. Best is trial 24 with value: 0.77053686848568.
2026-05-20 11:59:19,634 - INFO - Trial 42 finished with value: 0.7151776092028154 and parameters: {'n_components': 0.9662388188562224, 'svd_solver': 'auto', 'whiten': False, 'iterated_power': 1, 'power_iteration_normalizer': 'LU', 'solver': 'saga', 'C': 0.004945758036454156, 'l1_ratio': 0.25828942620322226}. Best is trial 24 with value: 0.77053686848568.
2026-05-20 11:59:19,701 - INFO - Trial 41 finished with value: 0.7138250971495993 and parameters: {'n_components': 0.9621421633374145, 'svd_solver': 'auto', 'whiten': True, 'iterated_power': 7, 'power_iteration_normalizer': 'LU', 'solver': 'saga', 'C': 17.8378223157404, 'l1_ratio': 0.3001270174771847}. Best is trial 24 with value: 0.77053686848568.
2026-05-20 11:59:19,750 - INFO - Trial 40 finished with value: 0.71382422442058 and parameters: {'n_components': 0.9621760143601318, 'svd_solver': 'auto', 'whiten': True, 'iterated_power': 1, 'power_iteration_normalizer': 'LU', 'solver': 'saga', 'C': 11.632802100451352, 'l1_ratio': 0.3129984298238219}. Best is trial 24 with value: 0.77053686848568.
2026-05-20 11:59:24,773 - INFO - Trial 44 finished with value: 0.7159571555732378 and parameters: {'n_components': 0.9678480302345872, 'svd_solver': 'auto', 'whiten': False, 'iterated_power': 1, 'power_iteration_normalizer': 'LU', 'solver': 'saga', 'C': 0.006158444432095228, 'l1_ratio': 0.7883054885539609}. Best is trial 24 with value: 0.77053686848568.
2026-05-20 11:59:24,918 - INFO - Trial 46 finished with value: 0.7152038135991724 and parameters: {'n_components': 0.9670381840419456, 'svd_solver': 'auto', 'whiten': False, 'iterated_power': 7, 'power_iteration_normalizer': 'LU', 'solver': 'saga', 'C': 2.010246395460346, 'l1_ratio': 0.9210777689272296}. Best is trial 24 with value: 0.77053686848568.
2026-05-20 11:59:25,089 - INFO - Trial 45 finished with value: 0.7160294030397085 and parameters: {'n_components': 0.9673280675336043, 'svd_solver': 'auto', 'whiten': False, 'iterated_power': 7, 'power_iteration_normalizer': 'LU', 'solver': 'saga', 'C': 1.9753171634087667, 'l1_ratio': 0.7716336252301534}. Best is trial 24 with value: 0.77053686848568.
