2026-05-20 12:12:52,296 - INFO - Trial 63 finished with value: 0.719455747093148 and parameters: {'n_components': 0.9708835079250019, 'svd_solver': 'full', 'whiten': True, 'iterated_power': 4, 'power_iteration_normalizer': 'QR', 'solver': 'saga', 'C': 0.024511800323776083, 'l1_ratio': 0.4571268746513468}. Best is trial 34 with value: 0.7705476471922582.
2026-05-20 12:12:52,333 - INFO - Trial 70 finished with value: 0.722472606712532 and parameters: {'n_components': 0.9733318307614284, 'svd_solver': 'auto', 'whiten': False, 'iterated_power': 4, 'power_iteration_normalizer': 'QR', 'solver': 'saga', 'C': 0.015791899852503382, 'l1_ratio': 0.40979456009237036}. Best is trial 34 with value: 0.7705476471922582.
2026-05-20 12:12:52,388 - INFO - Trial 65 finished with value: 0.7194603234195232 and parameters: {'n_components': 0.9706177519913864, 'svd_solver': 'full', 'whiten': True, 'iterated_power': 4, 'power_iteration_normalizer': 'QR', 'solver': 'saga', 'C': 0.021442270213548244, 'l1_ratio': 0.116969992451561}. Best is trial 34 with value: 0.7705476471922582.
2026-05-20 12:13:15,286 - INFO - Trial 71 finished with value: 0.7194643732987387 and parameters: {'n_components': 0.970909438084079, 'svd_solver': 'auto', 'whiten': False, 'iterated_power': 6, 'power_iteration_normalizer': 'QR', 'solver': 'saga', 'C': 0.038370420085876475, 'l1_ratio': 0.20497924275734}. Best is trial 34 with value: 0.7705476471922582.
2026-05-20 12:13:18,930 - INFO - Trial 72 finished with value: 0.7224353780660261 and parameters: {'n_components': 0.9726525103351129, 'svd_solver': 'auto', 'whiten': False, 'iterated_power': 6, 'power_iteration_normalizer': 'auto', 'solver': 'saga', 'C': 0.0005716435441474178, 'l1_ratio': 0.10035284953585434}. Best is trial 34 with value: 0.7705476471922582.
2026-05-20 12:13:31,577 - INFO - Trial 73 pruned. 
2026-05-20 12:14:31,760 - INFO - Trial 74 finished with value: 0.7705772625356764 and parameters: {'n_components': 0.9897915880081687, 'svd_solver': 'auto', 'whiten': False, 'iterated_power': 4, 'power_iteration_normalizer': 'auto', 'solver': 'saga', 'C': 0.0004611147888960536, 'l1_ratio': 0.10091407732900061}. Best is trial 74 with value: 0.7705772625356764.
2026-05-20 12:14:42,615 - INFO - Trial 75 finished with value: 0.7705787491690775 and parameters: {'n_components': 0.9897963266087805, 'svd_solver': 'auto', 'whiten': False, 'iterated_power': 4, 'power_iteration_normalizer': 'auto', 'solver': 'saga', 'C': 0.0004893295414431934, 'l1_ratio': 0.10887180117807685}. Best is trial 75 with value: 0.7705787491690775.
2026-05-20 12:15:00,465 - INFO - Trial 79 finished with value: 0.7690630661031432 and parameters: {'n_components': 0.9880970409455827, 'svd_solver': 'full', 'whiten': True, 'iterated_power': 9, 'power_iteration_normalizer': 'auto', 'solver': 'saga', 'C': 2.7668221753716647e-05, 'l1_ratio': 0.060576271647447395}. Best is trial 75 with value: 0.7705787491690775.
2026-05-20 12:15:08,971 - INFO - Trial 76 finished with value: 0.7701806408853212 and parameters: {'n_components': 0.988573945882387, 'svd_solver': 'full', 'whiten': True, 'iterated_power': 6, 'power_iteration_normalizer': 'auto', 'solver': 'saga', 'C': 0.0022819449454536253, 'l1_ratio': 0.10578696290669339}. Best is trial 75 with value: 0.7705787491690775.
2026-05-20 12:15:08,995 - INFO - Trial 77 finished with value: 0.7701750754646821 and parameters: {'n_components': 0.9889258625468698, 'svd_solver': 'full', 'whiten': True, 'iterated_power': 9, 'power_iteration_normalizer': 'auto', 'solver': 'saga', 'C': 0.0024515995285390637, 'l1_ratio': 0.07548855481349367}. Best is trial 75 with value: 0.7705787491690775.
2026-05-20 12:15:13,827 - INFO - Trial 78 finished with value: 0.7700050758707372 and parameters: {'n_components': 0.9898796733410662, 'svd_solver': 'full', 'whiten': True, 'iterated_power': 9, 'power_iteration_normalizer': 'auto', 'solver': 'saga', 'C': 4.8967982727863536e-05, 'l1_ratio': 0.07249380375548321}. Best is trial 75 with value: 0.7705787491690775.
2026-05-20 12:15:13,838 - INFO - Trial 82 finished with value: 0.7699500123292097 and parameters: {'n_components': 0.9899548979870992, 'svd_solver': 'full', 'whiten': True, 'iterated_power': 9, 'power_iteration_normalizer': 'auto', 'solver': 'saga', 'C': 4.2780191172177434e-05, 'l1_ratio': 0.06465302245708117}. Best is trial 75 with value: 0.7705787491690775.
2026-05-20 12:15:27,684 - INFO - Trial 81 finished with value: 0.770547860855226 and parameters: {'n_components': 0.9898747339213716, 'svd_solver': 'full', 'whiten': True, 'iterated_power': 9, 'power_iteration_normalizer': 'auto', 'solver': 'saga', 'C': 0.0018999871584259047, 'l1_ratio': 0.08060334028002562}. Best is trial 75 with value: 0.7705787491690775.
2026-05-20 12:15:36,568 - INFO - Trial 80 finished with value: 0.7705341898119267 and parameters: {'n_components': 0.989512989300254, 'svd_solver': 'full', 'whiten': True, 'iterated_power': 9, 'power_iteration_normalizer': 'auto', 'solver': 'saga', 'C': 0.16726791558826476, 'l1_ratio': 0.06732714537592101}. Best is trial 75 with value: 0.7705787491690775.
2026-05-20 12:15:39,501 - INFO - Trial 83 finished with value: 0.7701642541289859 and parameters: {'n_components': 0.9891703762522028, 'svd_solver': 'full', 'whiten': True, 'iterated_power': 8, 'power_iteration_normalizer': 'auto', 'solver': 'saga', 'C': 0.20027715582842512, 'l1_ratio': 0.06904493914324547}. Best is trial 75 with value: 0.7705787491690775.
2026-05-20 12:15:42,475 - INFO - Trial 84 finished with value: 0.7701602431358177 and parameters: {'n_components': 0.9893227357530018, 'svd_solver': 'full', 'whiten': True, 'iterated_power': 9, 'power_iteration_normalizer': 'auto', 'solver': 'saga', 'C': 0.19297477124766535, 'l1_ratio': 0.051391184728047684}. Best is trial 75 with value: 0.7705787491690775.
2026-05-20 12:15:52,522 - INFO - Trial 85 finished with value: 0.7701612323430632 and parameters: {'n_components': 0.9891485155320339, 'svd_solver': 'full', 'whiten': True, 'iterated_power': 8, 'power_iteration_normalizer': 'auto', 'solver': 'saga', 'C': 0.18781145653083306, 'l1_ratio': 0.05690025620764237}. Best is trial 75 with value: 0.7705787491690775.
2026-05-20 12:16:20,899 - INFO - Trial 86 finished with value: 0.7705463645386114 and parameters: {'n_components': 0.9898921635134584, 'svd_solver': 'full', 'whiten': True, 'iterated_power': 8, 'power_iteration_normalizer': 'auto', 'solver': 'saga', 'C': 0.002180123497899496, 'l1_ratio': 0.0661718863614131}. Best is trial 75 with value: 0.7705787491690775.
2026-05-20 12:16:25,065 - INFO - Trial 89 finished with value: 0.7372310451736375 and parameters: {'n_components': 0.9775658457287377, 'svd_solver': 'auto', 'whiten': False, 'iterated_power': 7, 'power_iteration_normalizer': 'auto', 'solver': 'saga', 'C': 0.0021709102765616493, 'l1_ratio': 0.06451662525650084}. Best is trial 75 with value: 0.7705787491690775.
2026-05-20 12:16:28,543 - INFO - Trial 92 finished with value: 0.7447049347485593 and parameters: {'n_components': 0.9781175532042569, 'svd_solver': 'auto', 'whiten': False, 'iterated_power': 8, 'power_iteration_normalizer': 'auto', 'solver': 'saga', 'C': 0.0002366900605939585, 'l1_ratio': 0.12727506850731912}. Best is trial 75 with value: 0.7705787491690775.
2026-05-20 12:16:29,310 - INFO - Trial 90 finished with value: 0.7372308442743514 and parameters: {'n_components': 0.9779646754077417, 'svd_solver': 'auto', 'whiten': False, 'iterated_power': 7, 'power_iteration_normalizer': 'auto', 'solver': 'saga', 'C': 0.0025204812547369427, 'l1_ratio': 0.05163613221654859}. Best is trial 75 with value: 0.7705787491690775.
2026-05-20 12:16:29,829 - INFO - Trial 88 finished with value: 0.7705596644035583 and parameters: {'n_components': 0.9895733761670179, 'svd_solver': 'auto', 'whiten': False, 'iterated_power': 5, 'power_iteration_normalizer': 'auto', 'solver': 'saga', 'C': 0.0002511312388520013, 'l1_ratio': 0.05656171720511045}. Best is trial 75 with value: 0.7705787491690775.
2026-05-20 12:16:30,180 - INFO - Trial 91 finished with value: 0.7526203453145732 and parameters: {'n_components': 0.9801418057553497, 'svd_solver': 'auto', 'whiten': False, 'iterated_power': 8, 'power_iteration_normalizer': 'auto', 'solver': 'saga', 'C': 0.002506642093996614, 'l1_ratio': 0.12118710260586088}. Best is trial 75 with value: 0.7705787491690775.
2026-05-20 12:16:31,181 - INFO - Trial 87 finished with value: 0.7700878802112243 and parameters: {'n_components': 0.9881592552405871, 'svd_solver': 'auto', 'whiten': False, 'iterated_power': 5, 'power_iteration_normalizer': 'auto', 'solver': 'saga', 'C': 0.002217282233936139, 'l1_ratio': 0.06349172233571948}. Best is trial 75 with value: 0.7705787491690775.
2026-05-20 12:16:36,810 - INFO - Trial 93 finished with value: 0.7452093558854819 and parameters: {'n_components': 0.9789903438640369, 'svd_solver': 'auto', 'whiten': False, 'iterated_power': 8, 'power_iteration_normalizer': 'auto', 'solver': 'saga', 'C': 0.002269975989374837, 'l1_ratio': 0.12752245817835553}. Best is trial 75 with value: 0.7705787491690775.
2026-05-20 12:16:37,158 - INFO - Trial 94 finished with value: 0.7451978174134073 and parameters: {'n_components': 0.9791065086602531, 'svd_solver': 'auto', 'whiten': False, 'iterated_power': 8, 'power_iteration_normalizer': 'auto', 'solver': 'saga', 'C': 0.0025924981425612535, 'l1_ratio': 0.04546965574321812}. Best is trial 75 with value: 0.7705787491690775.
2026-05-20 12:16:37,732 - INFO - Trial 95 finished with value: 0.7451953008162449 and parameters: {'n_components': 0.9795543144218914, 'svd_solver': 'auto', 'whiten': False, 'iterated_power': 5, 'power_iteration_normalizer': 'auto', 'solver': 'saga', 'C': 0.22197030640779047, 'l1_ratio': 0.12285659426808936}. Best is trial 75 with value: 0.7705787491690775.
2026-05-20 12:16:39,090 - INFO - Trial 96 finished with value: 0.7449383407673297 and parameters: {'n_components': 0.9787083094164686, 'svd_solver': 'auto', 'whiten': False, 'iterated_power': 5, 'power_iteration_normalizer': 'auto', 'solver': 'saga', 'C': 0.002232292890541747, 'l1_ratio': 0.12192090106993662}. Best is trial 75 with value: 0.7705787491690775.
2026-05-20 12:16:42,721 - INFO - Trial 97 finished with value: 0.745211696756663 and parameters: {'n_components': 0.9794029479814201, 'svd_solver': 'auto', 'whiten': False, 'iterated_power': 5, 'power_iteration_normalizer': 'auto', 'solver': 'saga', 'C': 0.0023904073960329952, 'l1_ratio': 0.12565271578023446}. Best is trial 75 with value: 0.7705787491690775.
2026-05-20 12:16:49,461 - INFO - Trial 98 finished with value: 0.7446522561125877 and parameters: {'n_components': 0.9783513730890432, 'svd_solver': 'auto', 'whiten': False, 'iterated_power': 5, 'power_iteration_normalizer': 'auto', 'solver': 'saga', 'C': 0.002205870198631386, 'l1_ratio': 0.1273489842921685}. Best is trial 75 with value: 0.7705787491690775.
2026-05-20 12:16:49,843 - INFO - Trial 99 finished with value: 0.7452126800763267 and parameters: {'n_components': 0.9797016789243725, 'svd_solver': 'auto', 'whiten': False, 'iterated_power': 5, 'power_iteration_normalizer': 'auto', 'solver': 'saga', 'C': 0.0020149485288218556, 'l1_ratio': 0.13420748887902018}. Best is trial 75 with value: 0.7705787491690775.
2026-05-20 12:16:49,844 - INFO - Best AUC: 0.7705787491690775 | Best params: {'n_components': 0.9897963266087805, 'svd_solver': 'auto', 'whiten': False, 'iterated_power': 4, 'power_iteration_normalizer': 'auto', 'solver': 'saga', 'C': 0.0004893295414431934, 'l1_ratio': 0.10887180117807685}
2026-05-20 12:16:49,845 - INFO - ----- Saving Pipeline -----
