2026-05-16 09:12:23,966 - INFO - ----- Model Tuning -----
2026-05-16 09:12:23,966 - INFO - A new study created in memory with name: no-name-a7e4741a-a186-470f-9793-e7eca0e4fcf6
2026-05-16 09:14:37,225 - INFO - Trial 0 finished with value: 0.6095054114452167 and parameters: {'n_components': 0.8183752435117223, 'svd_solver': 'full', 'whiten': True, 'iterated_power': 4, 'power_iteration_normalizer': 'auto', 'n_neighbors': 7, 'weights': 'distance', 'metric': 'minkowski', 'p': 2, 'leaf_size': 13}. Best is trial 0 with value: 0.6095054114452167.
2026-05-16 09:14:42,976 - INFO - Trial 8 finished with value: 0.5967002138444597 and parameters: {'n_components': 0.8478223723994086, 'svd_solver': 'full', 'whiten': True, 'iterated_power': 10, 'power_iteration_normalizer': 'auto', 'n_neighbors': 5, 'weights': 'distance', 'metric': 'euclidean', 'p': 2, 'leaf_size': 71}. Best is trial 0 with value: 0.6095054114452167.
2026-05-16 09:14:43,390 - INFO - Trial 4 finished with value: 0.6450166332456082 and parameters: {'n_components': 0.8577998639117583, 'svd_solver': 'full', 'whiten': False, 'iterated_power': 10, 'power_iteration_normalizer': 'LU', 'n_neighbors': 9, 'weights': 'distance', 'metric': 'euclidean', 'p': 1, 'leaf_size': 38}. Best is trial 4 with value: 0.6450166332456082.
2026-05-16 09:14:51,825 - INFO - Trial 3 finished with value: 0.5471288401258138 and parameters: {'n_components': 0.8124185306622813, 'svd_solver': 'full', 'whiten': True, 'iterated_power': 1, 'power_iteration_normalizer': 'auto', 'n_neighbors': 3, 'weights': 'uniform', 'metric': 'minkowski', 'p': 2, 'leaf_size': 92}. Best is trial 4 with value: 0.6450166332456082.
2026-05-16 09:14:52,280 - INFO - Trial 10 finished with value: 0.575569174452737 and parameters: {'n_components': 0.8209357961583569, 'svd_solver': 'full', 'whiten': False, 'iterated_power': 10, 'power_iteration_normalizer': 'QR', 'n_neighbors': 3, 'weights': 'distance', 'metric': 'manhattan', 'p': 1, 'leaf_size': 65}. Best is trial 4 with value: 0.6450166332456082.
2026-05-16 09:14:53,766 - INFO - Trial 7 finished with value: 0.6442079092115939 and parameters: {'n_components': 0.8760046579366425, 'svd_solver': 'full', 'whiten': True, 'iterated_power': 10, 'power_iteration_normalizer': 'LU', 'n_neighbors': 3, 'weights': 'distance', 'metric': 'manhattan', 'p': 2, 'leaf_size': 32}. Best is trial 4 with value: 0.6450166332456082.
2026-05-16 09:14:53,813 - INFO - Trial 6 finished with value: 0.6407167444397184 and parameters: {'n_components': 0.8501228841769225, 'svd_solver': 'full', 'whiten': False, 'iterated_power': 9, 'power_iteration_normalizer': 'auto', 'n_neighbors': 7, 'weights': 'uniform', 'metric': 'minkowski', 'p': 1, 'leaf_size': 31}. Best is trial 4 with value: 0.6450166332456082.
2026-05-16 09:14:54,320 - INFO - Trial 5 pruned. 
2026-05-16 09:14:57,099 - INFO - Trial 2 finished with value: 0.6882008082566105 and parameters: {'n_components': 0.9057316353071593, 'svd_solver': 'full', 'whiten': True, 'iterated_power': 5, 'power_iteration_normalizer': 'auto', 'n_neighbors': 3, 'weights': 'uniform', 'metric': 'manhattan', 'p': 1, 'leaf_size': 30}. Best is trial 2 with value: 0.6882008082566105.
2026-05-16 09:15:07,268 - INFO - Trial 9 finished with value: 0.7416422565448182 and parameters: {'n_components': 0.9115311705632521, 'svd_solver': 'full', 'whiten': True, 'iterated_power': 9, 'power_iteration_normalizer': 'LU', 'n_neighbors': 7, 'weights': 'distance', 'metric': 'manhattan', 'p': 2, 'leaf_size': 77}. Best is trial 9 with value: 0.7416422565448182.
2026-05-16 09:15:07,428 - INFO - Trial 11 finished with value: 0.7467501562527301 and parameters: {'n_components': 0.9253398959085808, 'svd_solver': 'full', 'whiten': False, 'iterated_power': 3, 'power_iteration_normalizer': 'LU', 'n_neighbors': 5, 'weights': 'distance', 'metric': 'euclidean', 'p': 2, 'leaf_size': 94}. Best is trial 11 with value: 0.7467501562527301.
2026-05-16 09:15:35,789 - INFO - Trial 1 finished with value: 0.8041725889395325 and parameters: {'n_components': 0.9355646901714824, 'svd_solver': 'full', 'whiten': False, 'iterated_power': 9, 'power_iteration_normalizer': 'auto', 'n_neighbors': 7, 'weights': 'distance', 'metric': 'manhattan', 'p': 2, 'leaf_size': 38}. Best is trial 1 with value: 0.8041725889395325.
2026-05-16 09:16:22,119 - INFO - Trial 19 pruned. 
2026-05-16 09:16:22,279 - INFO - Trial 18 pruned. 
2026-05-16 09:16:38,187 - INFO - Trial 12 pruned. 
2026-05-16 09:16:53,049 - INFO - Trial 17 pruned. 
2026-05-16 09:17:10,398 - INFO - Trial 13 finished with value: 0.7332003632166698 and parameters: {'n_components': 0.9184513124870612, 'svd_solver': 'full', 'whiten': False, 'iterated_power': 8, 'power_iteration_normalizer': 'QR', 'n_neighbors': 5, 'weights': 'distance', 'metric': 'manhattan', 'p': 2, 'leaf_size': 12}. Best is trial 1 with value: 0.8041725889395325.
2026-05-16 09:17:27,535 - INFO - Trial 15 finished with value: 0.7534032398954686 and parameters: {'n_components': 0.911243795965661, 'svd_solver': 'full', 'whiten': True, 'iterated_power': 5, 'power_iteration_normalizer': 'LU', 'n_neighbors': 9, 'weights': 'distance', 'metric': 'minkowski', 'p': 1, 'leaf_size': 21}. Best is trial 1 with value: 0.8041725889395325.
2026-05-16 09:18:08,536 - INFO - Trial 16 finished with value: 0.8136579196991433 and parameters: {'n_components': 0.959232250408421, 'svd_solver': 'full', 'whiten': False, 'iterated_power': 3, 'power_iteration_normalizer': 'LU', 'n_neighbors': 5, 'weights': 'distance', 'metric': 'euclidean', 'p': 2, 'leaf_size': 29}. Best is trial 16 with value: 0.8136579196991433.
2026-05-16 09:18:25,111 - INFO - Trial 21 finished with value: 0.8116736409520847 and parameters: {'n_components': 0.9545958087474177, 'svd_solver': 'full', 'whiten': False, 'iterated_power': 2, 'power_iteration_normalizer': 'LU', 'n_neighbors': 6, 'weights': 'distance', 'metric': 'euclidean', 'p': 2, 'leaf_size': 79}. Best is trial 16 with value: 0.8136579196991433.
2026-05-16 09:18:41,660 - INFO - Trial 22 finished with value: 0.8067294824088155 and parameters: {'n_components': 0.9479826166954763, 'svd_solver': 'full', 'whiten': False, 'iterated_power': 2, 'power_iteration_normalizer': 'LU', 'n_neighbors': 6, 'weights': 'distance', 'metric': 'euclidean', 'p': 2, 'leaf_size': 100}. Best is trial 16 with value: 0.8136579196991433.
2026-05-16 09:18:47,493 - INFO - Trial 23 finished with value: 0.8345911746794478 and parameters: {'n_components': 0.9608963050701317, 'svd_solver': 'full', 'whiten': False, 'iterated_power': 2, 'power_iteration_normalizer': 'LU', 'n_neighbors': 9, 'weights': 'distance', 'metric': 'euclidean', 'p': 2, 'leaf_size': 53}. Best is trial 23 with value: 0.8345911746794478.
2026-05-16 09:19:12,236 - INFO - Trial 26 finished with value: 0.8314625021551988 and parameters: {'n_components': 0.9559199192167649, 'svd_solver': 'full', 'whiten': False, 'iterated_power': 1, 'power_iteration_normalizer': 'LU', 'n_neighbors': 9, 'weights': 'distance', 'metric': 'euclidean', 'p': 2, 'leaf_size': 52}. Best is trial 23 with value: 0.8345911746794478.
2026-05-16 09:19:16,586 - INFO - Trial 24 finished with value: 0.8346050188778035 and parameters: {'n_components': 0.9592557672612729, 'svd_solver': 'full', 'whiten': False, 'iterated_power': 2, 'power_iteration_normalizer': 'LU', 'n_neighbors': 9, 'weights': 'distance', 'metric': 'euclidean', 'p': 2, 'leaf_size': 52}. Best is trial 24 with value: 0.8346050188778035.
2026-05-16 09:19:27,226 - INFO - Trial 25 finished with value: 0.8346397094629696 and parameters: {'n_components': 0.9583986026905313, 'svd_solver': 'full', 'whiten': False, 'iterated_power': 1, 'power_iteration_normalizer': 'LU', 'n_neighbors': 9, 'weights': 'distance', 'metric': 'euclidean', 'p': 2, 'leaf_size': 56}. Best is trial 25 with value: 0.8346397094629696.
2026-05-16 09:19:38,717 - INFO - Trial 28 finished with value: 0.8372945328107008 and parameters: {'n_components': 0.958870862556184, 'svd_solver': 'full', 'whiten': False, 'iterated_power': 1, 'power_iteration_normalizer': 'auto', 'n_neighbors': 10, 'weights': 'distance', 'metric': 'euclidean', 'p': 2, 'leaf_size': 55}. Best is trial 28 with value: 0.8372945328107008.
2026-05-16 09:19:45,325 - INFO - Trial 14 finished with value: 0.8320914948416419 and parameters: {'n_components': 0.9598806479850085, 'svd_solver': 'full', 'whiten': True, 'iterated_power': 2, 'power_iteration_normalizer': 'QR', 'n_neighbors': 8, 'weights': 'distance', 'metric': 'manhattan', 'p': 1, 'leaf_size': 77}. Best is trial 28 with value: 0.8372945328107008.
2026-05-16 09:19:48,102 - INFO - Trial 20 finished with value: 0.8367824005773178 and parameters: {'n_components': 0.9669501591135996, 'svd_solver': 'full', 'whiten': False, 'iterated_power': 8, 'power_iteration_normalizer': 'LU', 'n_neighbors': 7, 'weights': 'distance', 'metric': 'manhattan', 'p': 1, 'leaf_size': 35}. Best is trial 28 with value: 0.8372945328107008.
2026-05-16 09:19:54,400 - INFO - Trial 27 finished with value: 0.8471853170827846 and parameters: {'n_components': 0.96920275450985, 'svd_solver': 'full', 'whiten': False, 'iterated_power': 2, 'power_iteration_normalizer': 'auto', 'n_neighbors': 10, 'weights': 'distance', 'metric': 'euclidean', 'p': 2, 'leaf_size': 55}. Best is trial 27 with value: 0.8471853170827846.
2026-05-16 09:20:17,872 - INFO - Trial 29 finished with value: 0.8413315686093039 and parameters: {'n_components': 0.9629401488098568, 'svd_solver': 'full', 'whiten': False, 'iterated_power': 6, 'power_iteration_normalizer': 'auto', 'n_neighbors': 10, 'weights': 'distance', 'metric': 'minkowski', 'p': 1, 'leaf_size': 51}. Best is trial 27 with value: 0.8471853170827846.
2026-05-16 09:20:17,874 - INFO - Best AUC: 0.8471853170827846 | Best params: {'n_components': 0.96920275450985, 'svd_solver': 'full', 'whiten': False, 'iterated_power': 2, 'power_iteration_normalizer': 'auto', 'n_neighbors': 10, 'weights': 'distance', 'metric': 'euclidean', 'p': 2, 'leaf_size': 55}
2026-05-16 09:20:17,874 - INFO - ----- Saving Pipeline -----
2026-05-16 09:48:20,665 - INFO - ----- Model Tuning -----
2026-05-16 09:48:20,666 - INFO - A new study created in memory with name: no-name-a43e33e8-4d48-402a-877a-a4a974061301
2026-05-16 09:50:40,448 - INFO - Trial 9 finished with value: 0.5759192919827414 and parameters: {'n_components': 0.8246633369547457, 'svd_solver': 'full', 'whiten': True, 'iterated_power': 6, 'power_iteration_normalizer': 'auto', 'n_neighbors': 3, 'weights': 'uniform', 'metric': 'minkowski', 'p': 1, 'leaf_size': 37}. Best is trial 9 with value: 0.5759192919827414.
2026-05-16 09:50:40,498 - INFO - Trial 5 finished with value: 0.5549795616059001 and parameters: {'n_components': 0.8068365898605657, 'svd_solver': 'full', 'whiten': False, 'iterated_power': 7, 'power_iteration_normalizer': 'auto', 'n_neighbors': 8, 'weights': 'uniform', 'metric': 'manhattan', 'p': 2, 'leaf_size': 19}. Best is trial 9 with value: 0.5759192919827414.
2026-05-16 09:50:43,849 - INFO - Trial 7 finished with value: 0.572641634647507 and parameters: {'n_components': 0.8120092660391861, 'svd_solver': 'full', 'whiten': False, 'iterated_power': 4, 'power_iteration_normalizer': 'auto', 'n_neighbors': 9, 'weights': 'distance', 'metric': 'euclidean', 'p': 1, 'leaf_size': 55}. Best is trial 9 with value: 0.5759192919827414.
2026-05-16 09:50:43,964 - INFO - Trial 1 finished with value: 0.6208804398171054 and parameters: {'n_components': 0.8419197264872078, 'svd_solver': 'full', 'whiten': True, 'iterated_power': 8, 'power_iteration_normalizer': 'auto', 'n_neighbors': 8, 'weights': 'uniform', 'metric': 'minkowski', 'p': 1, 'leaf_size': 74}. Best is trial 1 with value: 0.6208804398171054.
2026-05-16 09:50:43,967 - INFO - Trial 2 finished with value: 0.5966889749811697 and parameters: {'n_components': 0.8241064107135403, 'svd_solver': 'full', 'whiten': True, 'iterated_power': 1, 'power_iteration_normalizer': 'LU', 'n_neighbors': 5, 'weights': 'distance', 'metric': 'euclidean', 'p': 2, 'leaf_size': 91}. Best is trial 1 with value: 0.6208804398171054.
2026-05-16 09:50:43,977 - INFO - Trial 11 finished with value: 0.7212426374764731 and parameters: {'n_components': 0.9155311392521129, 'svd_solver': 'full', 'whiten': True, 'iterated_power': 9, 'power_iteration_normalizer': 'QR', 'n_neighbors': 4, 'weights': 'distance', 'metric': 'minkowski', 'p': 1, 'leaf_size': 21}. Best is trial 11 with value: 0.7212426374764731.
2026-05-16 09:50:49,816 - INFO - Trial 0 finished with value: 0.7479356652560335 and parameters: {'n_components': 0.8985596302404392, 'svd_solver': 'full', 'whiten': False, 'iterated_power': 9, 'power_iteration_normalizer': 'auto', 'n_neighbors': 8, 'weights': 'uniform', 'metric': 'euclidean', 'p': 2, 'leaf_size': 60}. Best is trial 0 with value: 0.7479356652560335.
2026-05-16 09:50:57,800 - INFO - Trial 3 finished with value: 0.7321462195873427 and parameters: {'n_components': 0.8922957614194617, 'svd_solver': 'full', 'whiten': False, 'iterated_power': 3, 'power_iteration_normalizer': 'LU', 'n_neighbors': 6, 'weights': 'distance', 'metric': 'minkowski', 'p': 2, 'leaf_size': 93}. Best is trial 0 with value: 0.7479356652560335.
2026-05-16 09:51:06,172 - INFO - Trial 6 finished with value: 0.7122639650151152 and parameters: {'n_components': 0.9287346389989969, 'svd_solver': 'full', 'whiten': False, 'iterated_power': 5, 'power_iteration_normalizer': 'auto', 'n_neighbors': 3, 'weights': 'distance', 'metric': 'minkowski', 'p': 1, 'leaf_size': 45}. Best is trial 0 with value: 0.7479356652560335.
2026-05-16 09:51:06,588 - INFO - Trial 8 finished with value: 0.7705857466070806 and parameters: {'n_components': 0.9237018966612213, 'svd_solver': 'full', 'whiten': False, 'iterated_power': 7, 'power_iteration_normalizer': 'LU', 'n_neighbors': 8, 'weights': 'uniform', 'metric': 'minkowski', 'p': 2, 'leaf_size': 74}. Best is trial 8 with value: 0.7705857466070806.
2026-05-16 09:51:11,853 - INFO - Trial 4 finished with value: 0.7553031728058646 and parameters: {'n_components': 0.881532076836294, 'svd_solver': 'full', 'whiten': False, 'iterated_power': 9, 'power_iteration_normalizer': 'QR', 'n_neighbors': 10, 'weights': 'distance', 'metric': 'minkowski', 'p': 2, 'leaf_size': 93}. Best is trial 8 with value: 0.7705857466070806.
2026-05-16 09:51:42,356 - INFO - Trial 10 finished with value: 0.7996584322485194 and parameters: {'n_components': 0.9427379217040127, 'svd_solver': 'full', 'whiten': False, 'iterated_power': 6, 'power_iteration_normalizer': 'LU', 'n_neighbors': 6, 'weights': 'uniform', 'metric': 'manhattan', 'p': 1, 'leaf_size': 27}. Best is trial 10 with value: 0.7996584322485194.
2026-05-16 09:52:09,010 - INFO - Trial 14 pruned. 
2026-05-16 09:52:38,034 - INFO - Trial 16 pruned. 
2026-05-16 09:52:38,459 - INFO - Trial 18 pruned. 
2026-05-16 09:52:53,145 - INFO - Trial 12 finished with value: 0.7417822983680388 and parameters: {'n_components': 0.9009881821720408, 'svd_solver': 'full', 'whiten': True, 'iterated_power': 6, 'power_iteration_normalizer': 'QR', 'n_neighbors': 7, 'weights': 'distance', 'metric': 'minkowski', 'p': 2, 'leaf_size': 33}. Best is trial 10 with value: 0.7996584322485194.
2026-05-16 09:53:04,901 - INFO - Trial 17 finished with value: 0.7417755216406903 and parameters: {'n_components': 0.890995006840756, 'svd_solver': 'full', 'whiten': False, 'iterated_power': 2, 'power_iteration_normalizer': 'LU', 'n_neighbors': 7, 'weights': 'uniform', 'metric': 'manhattan', 'p': 1, 'leaf_size': 64}. Best is trial 10 with value: 0.7996584322485194.
2026-05-16 09:53:05,404 - INFO - Trial 15 finished with value: 0.7575756150409844 and parameters: {'n_components': 0.8881658173864577, 'svd_solver': 'full', 'whiten': True, 'iterated_power': 9, 'power_iteration_normalizer': 'QR', 'n_neighbors': 10, 'weights': 'distance', 'metric': 'manhattan', 'p': 2, 'leaf_size': 46}. Best is trial 10 with value: 0.7996584322485194.
2026-05-16 09:56:42,551 - INFO - Trial 27 finished with value: 0.8320164926944269 and parameters: {'n_components': 0.968927454564132, 'svd_solver': 'full', 'whiten': False, 'iterated_power': 7, 'power_iteration_normalizer': 'LU', 'n_neighbors': 6, 'weights': 'uniform', 'metric': 'manhattan', 'p': 1, 'leaf_size': 11}. Best is trial 27 with value: 0.8320164926944269.
2026-05-16 09:56:58,344 - INFO - Trial 24 finished with value: 0.8337249146858257 and parameters: {'n_components': 0.970529081319879, 'svd_solver': 'full', 'whiten': False, 'iterated_power': 6, 'power_iteration_normalizer': 'LU', 'n_neighbors': 6, 'weights': 'uniform', 'metric': 'manhattan', 'p': 2, 'leaf_size': 11}. Best is trial 24 with value: 0.8337249146858257.
2026-05-16 09:58:59,598 - INFO - ----- Model Tuning -----
2026-05-16 09:58:59,598 - INFO - A new study created in memory with name: no-name-d4b9933d-63c0-485f-b978-5e02983f0651
2026-05-16 10:00:56,832 - INFO - Trial 9 finished with value: 0.5472636176084006 and parameters: {'n_components': 0.8108947171957057, 'svd_solver': 'full', 'whiten': False, 'iterated_power': 5, 'power_iteration_normalizer': 'auto', 'n_neighbors': 3, 'weights': 'uniform', 'metric': 'minkowski', 'p': 1, 'leaf_size': 20}. Best is trial 9 with value: 0.5472636176084006.
2026-05-16 10:00:57,602 - INFO - Trial 10 finished with value: 0.6871639848367239 and parameters: {'n_components': 0.895128405123983, 'svd_solver': 'full', 'whiten': False, 'iterated_power': 5, 'power_iteration_normalizer': 'auto', 'n_neighbors': 3, 'weights': 'uniform', 'metric': 'minkowski', 'p': 1, 'leaf_size': 20}. Best is trial 10 with value: 0.6871639848367239.
2026-05-16 10:01:08,260 - INFO - Trial 2 finished with value: 0.6080849555943582 and parameters: {'n_components': 0.8214219193881467, 'svd_solver': 'full', 'whiten': True, 'iterated_power': 9, 'power_iteration_normalizer': 'QR', 'n_neighbors': 6, 'weights': 'uniform', 'metric': 'manhattan', 'p': 1, 'leaf_size': 41}. Best is trial 10 with value: 0.6871639848367239.
2026-05-16 10:01:08,275 - INFO - Trial 5 finished with value: 0.5592548503975939 and parameters: {'n_components': 0.8148883875387668, 'svd_solver': 'full', 'whiten': False, 'iterated_power': 1, 'power_iteration_normalizer': 'auto', 'n_neighbors': 3, 'weights': 'distance', 'metric': 'manhattan', 'p': 1, 'leaf_size': 71}. Best is trial 10 with value: 0.6871639848367239.
2026-05-16 10:01:12,423 - INFO - Trial 1 finished with value: 0.7071942448528146 and parameters: {'n_components': 0.9143565830675305, 'svd_solver': 'full', 'whiten': False, 'iterated_power': 10, 'power_iteration_normalizer': 'QR', 'n_neighbors': 4, 'weights': 'distance', 'metric': 'manhattan', 'p': 2, 'leaf_size': 39}. Best is trial 1 with value: 0.7071942448528146.
2026-05-16 10:01:18,866 - INFO - Trial 0 finished with value: 0.6439090052217805 and parameters: {'n_components': 0.8760368391268989, 'svd_solver': 'full', 'whiten': True, 'iterated_power': 9, 'power_iteration_normalizer': 'auto', 'n_neighbors': 3, 'weights': 'distance', 'metric': 'minkowski', 'p': 1, 'leaf_size': 99}. Best is trial 1 with value: 0.7071942448528146.
2026-05-16 10:01:24,672 - INFO - Trial 3 finished with value: 0.7400774295802626 and parameters: {'n_components': 0.9040308975706229, 'svd_solver': 'full', 'whiten': False, 'iterated_power': 10, 'power_iteration_normalizer': 'QR', 'n_neighbors': 7, 'weights': 'distance', 'metric': 'minkowski', 'p': 1, 'leaf_size': 61}. Best is trial 3 with value: 0.7400774295802626.
2026-05-16 10:02:19,004 - INFO - ----- Model Tuning -----
2026-05-16 10:02:19,004 - INFO - A new study created in memory with name: no-name-0b9fe243-3e0b-43d0-9cb6-acb2a28614c0
2026-05-16 10:04:08,451 - INFO - Trial 11 finished with value: 0.598318058063656 and parameters: {'n_components': 0.832886216463277, 'svd_solver': 'full', 'whiten': False, 'iterated_power': 4, 'power_iteration_normalizer': 'LU', 'n_neighbors': 5, 'weights': 'uniform', 'metric': 'euclidean', 'p': 1, 'leaf_size': 69}. Best is trial 11 with value: 0.598318058063656.
2026-05-16 10:04:34,766 - INFO - Trial 2 finished with value: 0.621829337873564 and parameters: {'n_components': 0.8292093944187453, 'svd_solver': 'full', 'whiten': True, 'iterated_power': 2, 'power_iteration_normalizer': 'LU', 'n_neighbors': 10, 'weights': 'distance', 'metric': 'manhattan', 'p': 1, 'leaf_size': 69}. Best is trial 2 with value: 0.621829337873564.
2026-05-16 10:04:41,063 - INFO - Trial 4 finished with value: 0.7071017169607249 and parameters: {'n_components': 0.8808331141564169, 'svd_solver': 'full', 'whiten': False, 'iterated_power': 2, 'power_iteration_normalizer': 'LU', 'n_neighbors': 4, 'weights': 'distance', 'metric': 'manhattan', 'p': 2, 'leaf_size': 35}. Best is trial 4 with value: 0.7071017169607249.
2026-05-16 10:04:42,259 - INFO - Trial 8 finished with value: 0.7502728141012354 and parameters: {'n_components': 0.8993164812194075, 'svd_solver': 'full', 'whiten': True, 'iterated_power': 4, 'power_iteration_normalizer': 'QR', 'n_neighbors': 8, 'weights': 'uniform', 'metric': 'minkowski', 'p': 1, 'leaf_size': 23}. Best is trial 8 with value: 0.7502728141012354.
2026-05-16 10:04:42,277 - INFO - Trial 3 finished with value: 0.6568831547516105 and parameters: {'n_components': 0.8500767586180082, 'svd_solver': 'full', 'whiten': True, 'iterated_power': 8, 'power_iteration_normalizer': 'auto', 'n_neighbors': 10, 'weights': 'uniform', 'metric': 'manhattan', 'p': 1, 'leaf_size': 69}. Best is trial 8 with value: 0.7502728141012354.
2026-05-16 10:04:42,580 - INFO - Trial 7 finished with value: 0.7909145257591701 and parameters: {'n_components': 0.9320355136722763, 'svd_solver': 'full', 'whiten': True, 'iterated_power': 6, 'power_iteration_normalizer': 'QR', 'n_neighbors': 7, 'weights': 'distance', 'metric': 'minkowski', 'p': 1, 'leaf_size': 11}. Best is trial 7 with value: 0.7909145257591701.
