2026-05-20 11:59:25,123 - INFO - Trial 48 finished with value: 0.7176227831740306 and parameters: {'n_components': 0.9689592324189289, 'svd_solver': 'auto', 'whiten': False, 'iterated_power': 7, 'power_iteration_normalizer': 'LU', 'solver': 'saga', 'C': 2.0678926572459764, 'l1_ratio': 0.903176111760838}. Best is trial 24 with value: 0.77053686848568.
2026-05-20 11:59:25,211 - INFO - Trial 47 finished with value: 0.7160286798141783 and parameters: {'n_components': 0.9684051441910276, 'svd_solver': 'auto', 'whiten': False, 'iterated_power': 7, 'power_iteration_normalizer': 'LU', 'solver': 'saga', 'C': 1.7380859810961355, 'l1_ratio': 0.7817754983408599}. Best is trial 24 with value: 0.77053686848568.
2026-05-20 11:59:29,847 - INFO - Trial 49 finished with value: 0.7152022880262987 and parameters: {'n_components': 0.9667214904696062, 'svd_solver': 'auto', 'whiten': False, 'iterated_power': 7, 'power_iteration_normalizer': 'LU', 'solver': 'saga', 'C': 2.0219412138026818, 'l1_ratio': 0.8997595369942356}. Best is trial 24 with value: 0.77053686848568.
2026-05-20 11:59:29,854 - INFO - Best AUC: 0.77053686848568 | Best params: {'n_components': 0.9897095747135892, 'svd_solver': 'auto', 'whiten': False, 'iterated_power': 6, 'power_iteration_normalizer': 'LU', 'solver': 'saga', 'C': 35.51216502956903, 'l1_ratio': 0.9645280242638959}
2026-05-20 11:59:29,855 - INFO - ----- Saving Pipeline -----
2026-05-20 12:00:30,852 - INFO - ----- Fine Tuning -----
2026-05-20 12:00:30,852 - INFO - A new study created in memory with name: no-name-bde8d3bd-1478-4a50-b302-f31c80914bcc
2026-05-20 12:01:35,007 - INFO - Trial 6 finished with value: 0.5 and parameters: {'n_components': 0.8046727182398828, 'svd_solver': 'auto', 'whiten': True, 'iterated_power': 1, 'power_iteration_normalizer': 'LU', 'solver': 'saga', 'C': 2.5370680729566045e-05, 'l1_ratio': 0.7218432633404185}. Best is trial 6 with value: 0.5.
2026-05-20 12:01:38,379 - INFO - Trial 8 finished with value: 0.5 and parameters: {'n_components': 0.8426582275865299, 'svd_solver': 'auto', 'whiten': False, 'iterated_power': 10, 'power_iteration_normalizer': 'LU', 'solver': 'saga', 'C': 4.772784677721344e-05, 'l1_ratio': 0.4846602006838403}. Best is trial 6 with value: 0.5.
2026-05-20 12:02:03,218 - INFO - Trial 9 finished with value: 0.6123805725476696 and parameters: {'n_components': 0.9276548006821961, 'svd_solver': 'full', 'whiten': False, 'iterated_power': 6, 'power_iteration_normalizer': 'LU', 'solver': 'saga', 'C': 0.00032534763923191314, 'l1_ratio': 0.6170297360532637}. Best is trial 9 with value: 0.6123805725476696.
2026-05-20 12:02:03,580 - INFO - Trial 0 finished with value: 0.5256720427898495 and parameters: {'n_components': 0.8461882650285716, 'svd_solver': 'auto', 'whiten': True, 'iterated_power': 3, 'power_iteration_normalizer': 'auto', 'solver': 'saga', 'C': 0.0003136347137464827, 'l1_ratio': 0.3860412830558171}. Best is trial 9 with value: 0.6123805725476696.
2026-05-20 12:02:03,621 - INFO - Trial 4 finished with value: 0.549445891385301 and parameters: {'n_components': 0.9073111879527092, 'svd_solver': 'auto', 'whiten': False, 'iterated_power': 4, 'power_iteration_normalizer': 'auto', 'solver': 'saga', 'C': 25.85850274638804, 'l1_ratio': 0.7593050206558166}. Best is trial 9 with value: 0.6123805725476696.
2026-05-20 12:02:09,737 - INFO - Trial 10 finished with value: 0.5494283716144694 and parameters: {'n_components': 0.9113911917283525, 'svd_solver': 'auto', 'whiten': False, 'iterated_power': 7, 'power_iteration_normalizer': 'auto', 'solver': 'saga', 'C': 0.1111626573728644, 'l1_ratio': 0.8306678957115615}. Best is trial 9 with value: 0.6123805725476696.
2026-05-20 12:02:09,780 - INFO - Trial 1 finished with value: 0.5311694830120322 and parameters: {'n_components': 0.8219393853874795, 'svd_solver': 'full', 'whiten': False, 'iterated_power': 10, 'power_iteration_normalizer': 'QR', 'solver': 'saga', 'C': 0.01576046005148773, 'l1_ratio': 0.5841262353639358}. Best is trial 9 with value: 0.6123805725476696.
2026-05-20 12:02:09,805 - INFO - Trial 5 finished with value: 0.5319245742505968 and parameters: {'n_components': 0.8290694932175614, 'svd_solver': 'full', 'whiten': False, 'iterated_power': 7, 'power_iteration_normalizer': 'QR', 'solver': 'saga', 'C': 0.008694227741583328, 'l1_ratio': 0.6499081576560881}. Best is trial 9 with value: 0.6123805725476696.
2026-05-20 12:02:14,144 - INFO - Trial 7 finished with value: 0.5305122145970043 and parameters: {'n_components': 0.8358773711860688, 'svd_solver': 'auto', 'whiten': False, 'iterated_power': 9, 'power_iteration_normalizer': 'LU', 'solver': 'saga', 'C': 1.6016843602227915, 'l1_ratio': 0.32143559660103804}. Best is trial 9 with value: 0.6123805725476696.
2026-05-20 12:02:14,290 - INFO - Trial 11 finished with value: 0.5305313573141293 and parameters: {'n_components': 0.8375622953521469, 'svd_solver': 'full', 'whiten': False, 'iterated_power': 4, 'power_iteration_normalizer': 'LU', 'solver': 'saga', 'C': 0.5010101588970829, 'l1_ratio': 0.7723715622246283}. Best is trial 9 with value: 0.6123805725476696.
2026-05-20 12:02:16,724 - INFO - Trial 2 finished with value: 0.7129859480936271 and parameters: {'n_components': 0.950405091340458, 'svd_solver': 'full', 'whiten': False, 'iterated_power': 7, 'power_iteration_normalizer': 'auto', 'solver': 'saga', 'C': 1.793915319498467, 'l1_ratio': 0.28138628761713236}. Best is trial 2 with value: 0.7129859480936271.
2026-05-20 12:02:20,824 - INFO - Trial 3 finished with value: 0.7124957892296853 and parameters: {'n_components': 0.9439392927362044, 'svd_solver': 'auto', 'whiten': False, 'iterated_power': 4, 'power_iteration_normalizer': 'LU', 'solver': 'saga', 'C': 0.0774623666220638, 'l1_ratio': 0.725526442596531}. Best is trial 2 with value: 0.7129859480936271.
2026-05-20 12:03:16,035 - INFO - Trial 12 finished with value: 0.5342408522348384 and parameters: {'n_components': 0.8544909137901167, 'svd_solver': 'full', 'whiten': False, 'iterated_power': 10, 'power_iteration_normalizer': 'QR', 'solver': 'saga', 'C': 0.09496417227572765, 'l1_ratio': 0.8682615190704451}. Best is trial 2 with value: 0.7129859480936271.
2026-05-20 12:03:32,647 - INFO - Trial 13 finished with value: 0.5311164377951669 and parameters: {'n_components': 0.8302372394297431, 'svd_solver': 'auto', 'whiten': False, 'iterated_power': 6, 'power_iteration_normalizer': 'QR', 'solver': 'saga', 'C': 0.006860476265924657, 'l1_ratio': 0.2184567035474949}. Best is trial 2 with value: 0.7129859480936271.
2026-05-20 12:03:47,678 - INFO - Trial 16 finished with value: 0.519429670760806 and parameters: {'n_components': 0.8161408799090277, 'svd_solver': 'auto', 'whiten': False, 'iterated_power': 7, 'power_iteration_normalizer': 'auto', 'solver': 'saga', 'C': 2.777377673384224, 'l1_ratio': 0.18060346868749566}. Best is trial 2 with value: 0.7129859480936271.
2026-05-20 12:03:47,696 - INFO - Trial 14 finished with value: 0.7130336240045603 and parameters: {'n_components': 0.9555523986389792, 'svd_solver': 'auto', 'whiten': True, 'iterated_power': 8, 'power_iteration_normalizer': 'auto', 'solver': 'saga', 'C': 0.0016006898625813188, 'l1_ratio': 0.5072037208277114}. Best is trial 14 with value: 0.7130336240045603.
2026-05-20 12:03:47,726 - INFO - Trial 18 finished with value: 0.6692087064086624 and parameters: {'n_components': 0.9322108597317518, 'svd_solver': 'auto', 'whiten': True, 'iterated_power': 2, 'power_iteration_normalizer': 'LU', 'solver': 'saga', 'C': 1.2467049253112569e-05, 'l1_ratio': 0.6557228997339681}. Best is trial 14 with value: 0.7130336240045603.
2026-05-20 12:03:54,125 - INFO - Trial 17 finished with value: 0.5494630655919299 and parameters: {'n_components': 0.8881131209307811, 'svd_solver': 'auto', 'whiten': False, 'iterated_power': 8, 'power_iteration_normalizer': 'LU', 'solver': 'saga', 'C': 21.077114693868406, 'l1_ratio': 0.7360211326753227}. Best is trial 14 with value: 0.7130336240045603.
2026-05-20 12:03:54,159 - INFO - Trial 15 finished with value: 0.5305466040290842 and parameters: {'n_components': 0.8326218259282095, 'svd_solver': 'auto', 'whiten': False, 'iterated_power': 2, 'power_iteration_normalizer': 'QR', 'solver': 'saga', 'C': 8.807865629557213, 'l1_ratio': 0.8088274483886385}. Best is trial 14 with value: 0.7130336240045603.
2026-05-20 12:03:54,204 - INFO - Trial 19 finished with value: 0.530535125945414 and parameters: {'n_components': 0.8211136363242454, 'svd_solver': 'full', 'whiten': True, 'iterated_power': 7, 'power_iteration_normalizer': 'LU', 'solver': 'saga', 'C': 29.8247383436008, 'l1_ratio': 0.922039203953254}. Best is trial 14 with value: 0.7130336240045603.
2026-05-20 12:04:00,534 - INFO - Trial 20 finished with value: 0.7446704535557374 and parameters: {'n_components': 0.9783844328645503, 'svd_solver': 'full', 'whiten': True, 'iterated_power': 6, 'power_iteration_normalizer': 'LU', 'solver': 'saga', 'C': 0.001020014711587817, 'l1_ratio': 0.13353020642839875}. Best is trial 20 with value: 0.7446704535557374.
2026-05-20 12:04:08,151 - INFO - Trial 21 finished with value: 0.7224596319983201 and parameters: {'n_components': 0.9734255901979886, 'svd_solver': 'full', 'whiten': True, 'iterated_power': 6, 'power_iteration_normalizer': 'LU', 'solver': 'saga', 'C': 0.0014302883442781553, 'l1_ratio': 0.07512849384185327}. Best is trial 20 with value: 0.7446704535557374.
2026-05-20 12:04:08,247 - INFO - Trial 22 finished with value: 0.7149972204046994 and parameters: {'n_components': 0.9658509310959155, 'svd_solver': 'full', 'whiten': True, 'iterated_power': 7, 'power_iteration_normalizer': 'auto', 'solver': 'saga', 'C': 69.64331698726039, 'l1_ratio': 0.08476757484736358}. Best is trial 20 with value: 0.7446704535557374.
2026-05-20 12:04:26,910 - INFO - Trial 23 finished with value: 0.7452004825642182 and parameters: {'n_components': 0.9792512981159048, 'svd_solver': 'full', 'whiten': True, 'iterated_power': 5, 'power_iteration_normalizer': 'auto', 'solver': 'saga', 'C': 17.334991678299875, 'l1_ratio': 0.055676518598544}. Best is trial 23 with value: 0.7452004825642182.
2026-05-20 12:05:41,523 - INFO - Trial 24 finished with value: 0.7372312432232668 and parameters: {'n_components': 0.9778973757599926, 'svd_solver': 'full', 'whiten': True, 'iterated_power': 5, 'power_iteration_normalizer': 'auto', 'solver': 'saga', 'C': 34.575972710017126, 'l1_ratio': 0.08377385368607745}. Best is trial 23 with value: 0.7452004825642182.
2026-05-20 12:06:18,872 - INFO - Trial 25 finished with value: 0.7452003851351108 and parameters: {'n_components': 0.9791012921575727, 'svd_solver': 'full', 'whiten': True, 'iterated_power': 2, 'power_iteration_normalizer': 'auto', 'solver': 'saga', 'C': 17.139603496581827, 'l1_ratio': 0.04124733743711184}. Best is trial 23 with value: 0.7452004825642182.
2026-05-20 12:06:29,957 - INFO - Trial 27 finished with value: 0.768760009512493 and parameters: {'n_components': 0.9855723453078212, 'svd_solver': 'full', 'whiten': True, 'iterated_power': 8, 'power_iteration_normalizer': 'auto', 'solver': 'saga', 'C': 0.0013069258369087426, 'l1_ratio': 0.11573520566024642}. Best is trial 27 with value: 0.768760009512493.
2026-05-20 12:06:30,008 - INFO - Trial 28 finished with value: 0.7674929143712079 and parameters: {'n_components': 0.9822308869495029, 'svd_solver': 'full', 'whiten': True, 'iterated_power': 8, 'power_iteration_normalizer': 'auto', 'solver': 'saga', 'C': 52.85468908277573, 'l1_ratio': 0.015470203900030677}. Best is trial 27 with value: 0.768760009512493.
2026-05-20 12:06:40,406 - INFO - Trial 26 finished with value: 0.7683749670272695 and parameters: {'n_components': 0.9839117478826235, 'svd_solver': 'full', 'whiten': True, 'iterated_power': 8, 'power_iteration_normalizer': 'auto', 'solver': 'saga', 'C': 34.44839274560206, 'l1_ratio': 0.029506307883019056}. Best is trial 27 with value: 0.768760009512493.
2026-05-20 12:06:40,414 - INFO - Trial 31 finished with value: 0.7690456489332997 and parameters: {'n_components': 0.9870682637146283, 'svd_solver': 'full', 'whiten': True, 'iterated_power': 8, 'power_iteration_normalizer': 'auto', 'solver': 'saga', 'C': 0.0016650815210884032, 'l1_ratio': 0.003427977311456054}. Best is trial 31 with value: 0.7690456489332997.
2026-05-20 12:06:40,444 - INFO - Trial 29 finished with value: 0.7687552782657946 and parameters: {'n_components': 0.985983520145617, 'svd_solver': 'full', 'whiten': True, 'iterated_power': 8, 'power_iteration_normalizer': 'auto', 'solver': 'saga', 'C': 0.0008641757183250614, 'l1_ratio': 0.003030684285607488}. Best is trial 31 with value: 0.7690456489332997.
2026-05-20 12:06:52,098 - INFO - Trial 32 finished with value: 0.7683761475225193 and parameters: {'n_components': 0.9843709480000782, 'svd_solver': 'full', 'whiten': True, 'iterated_power': 8, 'power_iteration_normalizer': 'auto', 'solver': 'saga', 'C': 0.001181963700410669, 'l1_ratio': 0.011518296542869233}. Best is trial 31 with value: 0.7690456489332997.
2026-05-20 12:06:52,105 - INFO - Trial 30 finished with value: 0.7700753042625954 and parameters: {'n_components': 0.9880593300110789, 'svd_solver': 'full', 'whiten': True, 'iterated_power': 8, 'power_iteration_normalizer': 'auto', 'solver': 'saga', 'C': 0.0011238238636736718, 'l1_ratio': 0.016060822362201188}. Best is trial 30 with value: 0.7700753042625954.
2026-05-20 12:07:02,662 - INFO - Trial 33 finished with value: 0.768110801864854 and parameters: {'n_components': 0.9830118611729673, 'svd_solver': 'full', 'whiten': True, 'iterated_power': 5, 'power_iteration_normalizer': 'LU', 'solver': 'saga', 'C': 0.0010841767876700222, 'l1_ratio': 0.024643068938764688}. Best is trial 30 with value: 0.7700753042625954.
2026-05-20 12:07:02,831 - INFO - Trial 34 finished with value: 0.7705476471922582 and parameters: {'n_components': 0.9897064026266257, 'svd_solver': 'full', 'whiten': True, 'iterated_power': 5, 'power_iteration_normalizer': 'LU', 'solver': 'saga', 'C': 0.0010926634475070126, 'l1_ratio': 0.022066460894354614}. Best is trial 34 with value: 0.7705476471922582.
2026-05-20 12:07:14,992 - INFO - Trial 35 finished with value: 0.7697886087180523 and parameters: {'n_components': 0.9876608007584813, 'svd_solver': 'full', 'whiten': True, 'iterated_power': 5, 'power_iteration_normalizer': 'LU', 'solver': 'saga', 'C': 0.001112271554640626, 'l1_ratio': 0.0017226410604875286}. Best is trial 34 with value: 0.7705476471922582.
2026-05-20 12:08:24,935 - INFO - Trial 36 finished with value: 0.7687582081550041 and parameters: {'n_components': 0.9859488820156586, 'svd_solver': 'full', 'whiten': True, 'iterated_power': 5, 'power_iteration_normalizer': 'auto', 'solver': 'saga', 'C': 0.5221940507464686, 'l1_ratio': 0.022254266617471062}. Best is trial 34 with value: 0.7705476471922582.
2026-05-20 12:08:50,604 - INFO - Trial 37 finished with value: 0.7138119974878259 and parameters: {'n_components': 0.9630973798898518, 'svd_solver': 'full', 'whiten': True, 'iterated_power': 5, 'power_iteration_normalizer': 'auto', 'solver': 'saga', 'C': 0.37373394928225095, 'l1_ratio': 0.004209225441069907}. Best is trial 34 with value: 0.7705476471922582.
2026-05-20 12:09:12,268 - INFO - Trial 41 finished with value: 0.7136746552411599 and parameters: {'n_components': 0.9629255849503293, 'svd_solver': 'full', 'whiten': True, 'iterated_power': 9, 'power_iteration_normalizer': 'auto', 'solver': 'saga', 'C': 0.00014129401607761966, 'l1_ratio': 0.15680117130425827}. Best is trial 34 with value: 0.7705476471922582.
2026-05-20 12:09:12,278 - INFO - Trial 42 finished with value: 0.7704704515036861 and parameters: {'n_components': 0.9896137846091446, 'svd_solver': 'full', 'whiten': True, 'iterated_power': 9, 'power_iteration_normalizer': 'auto', 'solver': 'saga', 'C': 0.0002175097884556327, 'l1_ratio': 0.17905458988019463}. Best is trial 34 with value: 0.7705476471922582.
2026-05-20 12:09:22,352 - INFO - Trial 40 finished with value: 0.7700663713655105 and parameters: {'n_components': 0.9883519099063665, 'svd_solver': 'full', 'whiten': True, 'iterated_power': 9, 'power_iteration_normalizer': 'auto', 'solver': 'saga', 'C': 0.0002406719204448948, 'l1_ratio': 0.16971621495699044}. Best is trial 34 with value: 0.7705476471922582.
2026-05-20 12:09:22,423 - INFO - Trial 39 finished with value: 0.7690452618264068 and parameters: {'n_components': 0.9865350038725658, 'svd_solver': 'full', 'whiten': True, 'iterated_power': 9, 'power_iteration_normalizer': 'auto', 'solver': 'saga', 'C': 0.3342383224734819, 'l1_ratio': 0.0014220554502236554}. Best is trial 34 with value: 0.7705476471922582.
2026-05-20 12:09:22,710 - INFO - Trial 38 finished with value: 0.7695409564166387 and parameters: {'n_components': 0.9872507671340875, 'svd_solver': 'full', 'whiten': True, 'iterated_power': 9, 'power_iteration_normalizer': 'auto', 'solver': 'saga', 'C': 0.4283827809224008, 'l1_ratio': 0.19680656464911822}. Best is trial 34 with value: 0.7705476471922582.
2026-05-20 12:09:28,739 - INFO - Trial 44 finished with value: 0.7134876554273355 and parameters: {'n_components': 0.960661284072715, 'svd_solver': 'full', 'whiten': True, 'iterated_power': 9, 'power_iteration_normalizer': 'auto', 'solver': 'saga', 'C': 0.00014455821903808363, 'l1_ratio': 0.15247553898770716}. Best is trial 34 with value: 0.7705476471922582.
2026-05-20 12:09:28,758 - INFO - Trial 43 finished with value: 0.7136804455753766 and parameters: {'n_components': 0.9626212205371818, 'svd_solver': 'full', 'whiten': True, 'iterated_power': 9, 'power_iteration_normalizer': 'auto', 'solver': 'saga', 'C': 0.0001499829961560182, 'l1_ratio': 0.15867514399385588}. Best is trial 34 with value: 0.7705476471922582.
2026-05-20 12:09:34,708 - INFO - Trial 46 finished with value: 0.7137173180089349 and parameters: {'n_components': 0.9626173167577163, 'svd_solver': 'full', 'whiten': True, 'iterated_power': 9, 'power_iteration_normalizer': 'auto', 'solver': 'saga', 'C': 0.0002336304407093569, 'l1_ratio': 0.147570665647479}. Best is trial 34 with value: 0.7705476471922582.
2026-05-20 12:09:34,823 - INFO - Trial 45 finished with value: 0.7134438905029141 and parameters: {'n_components': 0.9609711471953654, 'svd_solver': 'full', 'whiten': True, 'iterated_power': 9, 'power_iteration_normalizer': 'auto', 'solver': 'saga', 'C': 8.950425877746039e-05, 'l1_ratio': 0.166207979555872}. Best is trial 34 with value: 0.7705476471922582.
2026-05-20 12:09:54,306 - INFO - Trial 47 finished with value: 0.713583893430144 and parameters: {'n_components': 0.961586803640684, 'svd_solver': 'full', 'whiten': True, 'iterated_power': 9, 'power_iteration_normalizer': 'LU', 'solver': 'saga', 'C': 0.00011590969535237635, 'l1_ratio': 0.24294240013424023}. Best is trial 34 with value: 0.7705476471922582.
2026-05-20 12:10:18,590 - INFO - Trial 49 pruned. 
2026-05-20 12:10:48,010 - INFO - Trial 50 pruned. 
2026-05-20 12:10:48,038 - INFO - Trial 51 pruned. 
2026-05-20 12:10:53,861 - INFO - Trial 52 pruned. 
2026-05-20 12:10:53,881 - INFO - Trial 54 pruned. 
2026-05-20 12:10:53,930 - INFO - Trial 53 pruned. 
2026-05-20 12:11:03,501 - INFO - Trial 48 finished with value: 0.7135502846709435 and parameters: {'n_components': 0.9630738377565862, 'svd_solver': 'full', 'whiten': True, 'iterated_power': 3, 'power_iteration_normalizer': 'LU', 'solver': 'saga', 'C': 9.928853650801143e-05, 'l1_ratio': 0.23926186863171656}. Best is trial 34 with value: 0.7705476471922582.
2026-05-20 12:11:11,297 - INFO - Trial 57 pruned. 
2026-05-20 12:11:11,307 - INFO - Trial 56 pruned. 
2026-05-20 12:11:11,320 - INFO - Trial 58 pruned. 
2026-05-20 12:11:11,335 - INFO - Trial 55 pruned. 
2026-05-20 12:11:27,695 - INFO - Trial 59 pruned. 
2026-05-20 12:11:44,040 - INFO - Trial 60 pruned. 
2026-05-20 12:12:16,876 - INFO - Trial 66 pruned. 
2026-05-20 12:12:38,559 - INFO - Trial 62 finished with value: 0.7193361064160223 and parameters: {'n_components': 0.9714124586499895, 'svd_solver': 'full', 'whiten': True, 'iterated_power': 10, 'power_iteration_normalizer': 'QR', 'solver': 'saga', 'C': 0.0004801991278648168, 'l1_ratio': 0.20813412140332485}. Best is trial 34 with value: 0.7705476471922582.
2026-05-20 12:12:38,609 - INFO - Trial 61 finished with value: 0.7194565266323197 and parameters: {'n_components': 0.9705720603716621, 'svd_solver': 'full', 'whiten': True, 'iterated_power': 10, 'power_iteration_normalizer': 'QR', 'solver': 'saga', 'C': 0.016561690782912118, 'l1_ratio': 0.33380448523520756}. Best is trial 34 with value: 0.7705476471922582.
2026-05-20 12:12:51,618 - INFO - Trial 67 finished with value: 0.7222042170942331 and parameters: {'n_components': 0.9720675065875477, 'svd_solver': 'auto', 'whiten': False, 'iterated_power': 7, 'power_iteration_normalizer': 'QR', 'solver': 'saga', 'C': 0.020022833141485435, 'l1_ratio': 0.4297796570108149}. Best is trial 34 with value: 0.7705476471922582.
2026-05-20 12:12:51,760 - INFO - Trial 64 finished with value: 0.7191955912815136 and parameters: {'n_components': 0.97077075379236, 'svd_solver': 'full', 'whiten': True, 'iterated_power': 4, 'power_iteration_normalizer': 'QR', 'solver': 'saga', 'C': 0.0003910107396385746, 'l1_ratio': 0.4469169269060953}. Best is trial 34 with value: 0.7705476471922582.
2026-05-20 12:12:51,967 - INFO - Trial 68 finished with value: 0.7220380698357626 and parameters: {'n_components': 0.9718345350299541, 'svd_solver': 'auto', 'whiten': False, 'iterated_power': 4, 'power_iteration_normalizer': 'QR', 'solver': 'saga', 'C': 0.0004932422029996358, 'l1_ratio': 0.4353964255416203}. Best is trial 34 with value: 0.7705476471922582.
2026-05-20 12:12:51,998 - INFO - Trial 69 finished with value: 0.7176228025096669 and parameters: {'n_components': 0.9693500865588165, 'svd_solver': 'auto', 'whiten': False, 'iterated_power': 4, 'power_iteration_normalizer': 'QR', 'solver': 'saga', 'C': 0.042564990945174894, 'l1_ratio': 0.44263941787306804}. Best is trial 34 with value: 0.7705476471922582.
