2026-05-18 20:09:00,653 - INFO - Trial 23 pruned. 
2026-05-18 20:09:22,069 - INFO - Trial 36 finished with value: 0.8870031194603465 and parameters: {'solver': 'lsqr', 'alpha': 62.56185170744695, 'tol': 0.00024430992216615107, 'fit_intercept': True, 'class_weight': 'balanced', 'max_iter': 3500}. Best is trial 28 with value: 0.888072701648684.
2026-05-18 20:09:22,097 - INFO - Trial 16 pruned. 
2026-05-18 20:09:36,243 - INFO - Trial 37 finished with value: 0.8871637033454599 and parameters: {'solver': 'lsqr', 'alpha': 3.0468980592209547e-05, 'tol': 0.000258713807699269, 'fit_intercept': True, 'class_weight': 'balanced', 'max_iter': 3500}. Best is trial 28 with value: 0.888072701648684.
2026-05-18 20:09:42,779 - INFO - Trial 35 finished with value: 0.8878385395938221 and parameters: {'solver': 'lsqr', 'alpha': 97.66683925125788, 'tol': 1.9089191136337704e-05, 'fit_intercept': True, 'class_weight': 'balanced', 'max_iter': 3500}. Best is trial 28 with value: 0.888072701648684.
2026-05-18 20:10:04,270 - INFO - Trial 38 finished with value: 0.8869807059158183 and parameters: {'solver': 'lsqr', 'alpha': 0.4367724087897714, 'tol': 0.0002171586036577829, 'fit_intercept': True, 'class_weight': 'balanced', 'max_iter': 3000}. Best is trial 28 with value: 0.888072701648684.
2026-05-18 20:10:10,504 - INFO - Trial 39 finished with value: 0.8870687876737435 and parameters: {'solver': 'lsqr', 'alpha': 0.3416931552407925, 'tol': 0.00025336203345603344, 'fit_intercept': True, 'class_weight': 'balanced', 'max_iter': 3500}. Best is trial 28 with value: 0.888072701648684.
2026-05-18 20:10:18,955 - INFO - Trial 40 finished with value: 0.8871805201690657 and parameters: {'solver': 'lsqr', 'alpha': 0.33590948056361564, 'tol': 0.0003373986005261128, 'fit_intercept': True, 'class_weight': 'balanced', 'max_iter': 3500}. Best is trial 28 with value: 0.888072701648684.
2026-05-18 20:10:45,532 - INFO - Trial 41 finished with value: 0.8871851285451902 and parameters: {'solver': 'lsqr', 'alpha': 0.419133390231304, 'tol': 0.000138050658093622, 'fit_intercept': True, 'class_weight': 'balanced', 'max_iter': 2000}. Best is trial 28 with value: 0.888072701648684.
2026-05-18 20:11:22,480 - INFO - Trial 42 finished with value: 0.8879984903202971 and parameters: {'solver': 'lsqr', 'alpha': 0.6597560201015289, 'tol': 2.491048653999811e-05, 'fit_intercept': True, 'class_weight': 'balanced', 'max_iter': 3500}. Best is trial 28 with value: 0.888072701648684.
2026-05-18 20:11:32,085 - INFO - Trial 43 finished with value: 0.8880002528121589 and parameters: {'solver': 'lsqr', 'alpha': 0.8241676662348597, 'tol': 2.5489260818808086e-05, 'fit_intercept': True, 'class_weight': 'balanced', 'max_iter': 3500}. Best is trial 28 with value: 0.888072701648684.
2026-05-18 20:11:41,061 - INFO - Trial 44 finished with value: 0.8879968458150922 and parameters: {'solver': 'lsqr', 'alpha': 0.7622758317499089, 'tol': 2.360145783513483e-05, 'fit_intercept': True, 'class_weight': 'balanced', 'max_iter': 3000}. Best is trial 28 with value: 0.888072701648684.
2026-05-18 20:11:42,548 - INFO - Trial 46 finished with value: 0.8874271780220319 and parameters: {'solver': 'lsqr', 'alpha': 13.149555975882228, 'tol': 0.00010941126568080003, 'fit_intercept': True, 'class_weight': 'balanced', 'max_iter': 2000}. Best is trial 28 with value: 0.888072701648684.
2026-05-18 20:11:52,022 - INFO - Trial 45 finished with value: 0.8879387766764225 and parameters: {'solver': 'lsqr', 'alpha': 10.310901947211372, 'tol': 2.5567116897627216e-05, 'fit_intercept': True, 'class_weight': 'balanced', 'max_iter': 3000}. Best is trial 28 with value: 0.888072701648684.
2026-05-18 20:11:52,122 - INFO - Trial 3 pruned. 
2026-05-18 20:11:58,716 - INFO - Trial 47 finished with value: 0.8880423069601477 and parameters: {'solver': 'lsqr', 'alpha': 11.218389272271576, 'tol': 2.411934509055938e-05, 'fit_intercept': True, 'class_weight': 'balanced', 'max_iter': 2000}. Best is trial 28 with value: 0.888072701648684.
2026-05-18 20:12:07,712 - INFO - Trial 48 finished with value: 0.8880045960638734 and parameters: {'solver': 'lsqr', 'alpha': 19.244279697313903, 'tol': 2.50722247097817e-05, 'fit_intercept': True, 'class_weight': 'balanced', 'max_iter': 2000}. Best is trial 28 with value: 0.888072701648684.
2026-05-18 20:12:10,687 - INFO - Trial 49 finished with value: 0.8874465848224433 and parameters: {'solver': 'lsqr', 'alpha': 14.429806819983584, 'tol': 8.175072150548557e-05, 'fit_intercept': False, 'class_weight': 'balanced', 'max_iter': 2000}. Best is trial 28 with value: 0.888072701648684.
