2026-05-18 18:50:50,689 - INFO - ----- Fine Tuning -----
2026-05-18 18:50:50,689 - INFO - A new study created in memory with name: no-name-2e2ebd38-ba32-4f51-83da-952add7ad1fe
2026-05-18 18:50:51,486 - WARNING - Trial 3 failed with parameters: {'alpha': 0.0025222345265211634, 'solver': 'lsqr', 'tol': 0.00019734784681357868, 'fit_intercept': True, 'max_iter': 2500} because of the following error: NameError("name 'CalibratedClassifierCV' is not defined").
Traceback (most recent call last):
  File "/home/junior/Documentos/GitHub/prediction-f1-pit-stops-kaggle-competition/.venv/lib/python3.13/site-packages/optuna/study/_optimize.py", line 206, in _run_trial
    value_or_values = func(trial)
  File "/home/junior/Documentos/GitHub/prediction-f1-pit-stops-kaggle-competition/src/ridge_tuning.py", line 124, in <lambda>
    study.optimize(lambda trial: objective(trial, X_train, y_train), n_trials=30, n_jobs=-1, show_progress_bar=True)
                                 ~~~~~~~~~^^^^^^^^^^^^^^^^^^^^^^^^^
  File "/home/junior/Documentos/GitHub/prediction-f1-pit-stops-kaggle-competition/src/ridge_tuning.py", line 103, in objective
    calibrated_ridge = CalibratedClassifierCV(
                       ^^^^^^^^^^^^^^^^^^^^^^
NameError: name 'CalibratedClassifierCV' is not defined
2026-05-18 18:50:51,500 - WARNING - Trial 6 failed with parameters: {'alpha': 0.04581299659172057, 'solver': 'saga', 'tol': 0.00012223271312299943, 'fit_intercept': True, 'max_iter': 4000} because of the following error: NameError("name 'CalibratedClassifierCV' is not defined").
Traceback (most recent call last):
  File "/home/junior/Documentos/GitHub/prediction-f1-pit-stops-kaggle-competition/.venv/lib/python3.13/site-packages/optuna/study/_optimize.py", line 206, in _run_trial
    value_or_values = func(trial)
  File "/home/junior/Documentos/GitHub/prediction-f1-pit-stops-kaggle-competition/src/ridge_tuning.py", line 124, in <lambda>
    study.optimize(lambda trial: objective(trial, X_train, y_train), n_trials=30, n_jobs=-1, show_progress_bar=True)
                                 ~~~~~~~~~^^^^^^^^^^^^^^^^^^^^^^^^^
  File "/home/junior/Documentos/GitHub/prediction-f1-pit-stops-kaggle-competition/src/ridge_tuning.py", line 103, in objective
    calibrated_ridge = CalibratedClassifierCV(
                       ^^^^^^^^^^^^^^^^^^^^^^
NameError: name 'CalibratedClassifierCV' is not defined
2026-05-18 18:50:51,503 - WARNING - Trial 3 failed with value None.
2026-05-18 18:50:51,507 - WARNING - Trial 6 failed with value None.
2026-05-18 18:50:51,514 - WARNING - Trial 10 failed with parameters: {'alpha': 0.2741068032344578, 'solver': 'sparse_cg', 'tol': 0.0012710661824801408, 'fit_intercept': True, 'max_iter': 500} because of the following error: NameError("name 'CalibratedClassifierCV' is not defined").
Traceback (most recent call last):
  File "/home/junior/Documentos/GitHub/prediction-f1-pit-stops-kaggle-competition/.venv/lib/python3.13/site-packages/optuna/study/_optimize.py", line 206, in _run_trial
    value_or_values = func(trial)
  File "/home/junior/Documentos/GitHub/prediction-f1-pit-stops-kaggle-competition/src/ridge_tuning.py", line 124, in <lambda>
    study.optimize(lambda trial: objective(trial, X_train, y_train), n_trials=30, n_jobs=-1, show_progress_bar=True)
                                 ~~~~~~~~~^^^^^^^^^^^^^^^^^^^^^^^^^
  File "/home/junior/Documentos/GitHub/prediction-f1-pit-stops-kaggle-competition/src/ridge_tuning.py", line 103, in objective
    calibrated_ridge = CalibratedClassifierCV(
                       ^^^^^^^^^^^^^^^^^^^^^^
NameError: name 'CalibratedClassifierCV' is not defined
2026-05-18 18:50:51,514 - WARNING - Trial 4 failed with parameters: {'alpha': 0.008250185308110223, 'solver': 'sag', 'tol': 8.65360153692318e-05, 'fit_intercept': False, 'max_iter': 4500} because of the following error: NameError("name 'CalibratedClassifierCV' is not defined").
Traceback (most recent call last):
  File "/home/junior/Documentos/GitHub/prediction-f1-pit-stops-kaggle-competition/.venv/lib/python3.13/site-packages/optuna/study/_optimize.py", line 206, in _run_trial
    value_or_values = func(trial)
  File "/home/junior/Documentos/GitHub/prediction-f1-pit-stops-kaggle-competition/src/ridge_tuning.py", line 124, in <lambda>
    study.optimize(lambda trial: objective(trial, X_train, y_train), n_trials=30, n_jobs=-1, show_progress_bar=True)
                                 ~~~~~~~~~^^^^^^^^^^^^^^^^^^^^^^^^^
  File "/home/junior/Documentos/GitHub/prediction-f1-pit-stops-kaggle-competition/src/ridge_tuning.py", line 103, in objective
    calibrated_ridge = CalibratedClassifierCV(
                       ^^^^^^^^^^^^^^^^^^^^^^
NameError: name 'CalibratedClassifierCV' is not defined
2026-05-18 18:50:51,518 - WARNING - Trial 10 failed with value None.
2026-05-18 18:50:51,519 - WARNING - Trial 4 failed with value None.
2026-05-18 18:50:51,522 - WARNING - Trial 0 failed with parameters: {'alpha': 0.003347762964076063, 'solver': 'sag', 'tol': 0.0016739421288610756, 'fit_intercept': False, 'max_iter': 3000} because of the following error: NameError("name 'CalibratedClassifierCV' is not defined").
Traceback (most recent call last):
  File "/home/junior/Documentos/GitHub/prediction-f1-pit-stops-kaggle-competition/.venv/lib/python3.13/site-packages/optuna/study/_optimize.py", line 206, in _run_trial
    value_or_values = func(trial)
  File "/home/junior/Documentos/GitHub/prediction-f1-pit-stops-kaggle-competition/src/ridge_tuning.py", line 124, in <lambda>
    study.optimize(lambda trial: objective(trial, X_train, y_train), n_trials=30, n_jobs=-1, show_progress_bar=True)
                                 ~~~~~~~~~^^^^^^^^^^^^^^^^^^^^^^^^^
  File "/home/junior/Documentos/GitHub/prediction-f1-pit-stops-kaggle-competition/src/ridge_tuning.py", line 103, in objective
    calibrated_ridge = CalibratedClassifierCV(
                       ^^^^^^^^^^^^^^^^^^^^^^
NameError: name 'CalibratedClassifierCV' is not defined
2026-05-18 18:50:51,523 - WARNING - Trial 8 failed with parameters: {'alpha': 5.5943232551898334e-05, 'solver': 'saga', 'tol': 0.00013799998660167967, 'fit_intercept': True, 'max_iter': 3000} because of the following error: NameError("name 'CalibratedClassifierCV' is not defined").
Traceback (most recent call last):
  File "/home/junior/Documentos/GitHub/prediction-f1-pit-stops-kaggle-competition/.venv/lib/python3.13/site-packages/optuna/study/_optimize.py", line 206, in _run_trial
    value_or_values = func(trial)
  File "/home/junior/Documentos/GitHub/prediction-f1-pit-stops-kaggle-competition/src/ridge_tuning.py", line 124, in <lambda>
    study.optimize(lambda trial: objective(trial, X_train, y_train), n_trials=30, n_jobs=-1, show_progress_bar=True)
                                 ~~~~~~~~~^^^^^^^^^^^^^^^^^^^^^^^^^
  File "/home/junior/Documentos/GitHub/prediction-f1-pit-stops-kaggle-competition/src/ridge_tuning.py", line 103, in objective
    calibrated_ridge = CalibratedClassifierCV(
                       ^^^^^^^^^^^^^^^^^^^^^^
NameError: name 'CalibratedClassifierCV' is not defined
2026-05-18 18:50:51,523 - WARNING - Trial 7 failed with parameters: {'alpha': 0.0013979730531628897, 'solver': 'lbfgs', 'tol': 2.930434096151731e-05, 'fit_intercept': False, 'max_iter': 2000} because of the following error: NameError("name 'CalibratedClassifierCV' is not defined").
Traceback (most recent call last):
  File "/home/junior/Documentos/GitHub/prediction-f1-pit-stops-kaggle-competition/.venv/lib/python3.13/site-packages/optuna/study/_optimize.py", line 206, in _run_trial
    value_or_values = func(trial)
  File "/home/junior/Documentos/GitHub/prediction-f1-pit-stops-kaggle-competition/src/ridge_tuning.py", line 124, in <lambda>
    study.optimize(lambda trial: objective(trial, X_train, y_train), n_trials=30, n_jobs=-1, show_progress_bar=True)
                                 ~~~~~~~~~^^^^^^^^^^^^^^^^^^^^^^^^^
  File "/home/junior/Documentos/GitHub/prediction-f1-pit-stops-kaggle-competition/src/ridge_tuning.py", line 103, in objective
    calibrated_ridge = CalibratedClassifierCV(
                       ^^^^^^^^^^^^^^^^^^^^^^
NameError: name 'CalibratedClassifierCV' is not defined
2026-05-18 18:50:51,526 - WARNING - Trial 11 failed with parameters: {'alpha': 0.01573232806200465, 'solver': 'cholesky', 'tol': 0.06648454537041208, 'fit_intercept': True, 'max_iter': 500} because of the following error: NameError("name 'CalibratedClassifierCV' is not defined").
Traceback (most recent call last):
  File "/home/junior/Documentos/GitHub/prediction-f1-pit-stops-kaggle-competition/.venv/lib/python3.13/site-packages/optuna/study/_optimize.py", line 206, in _run_trial
    value_or_values = func(trial)
  File "/home/junior/Documentos/GitHub/prediction-f1-pit-stops-kaggle-competition/src/ridge_tuning.py", line 124, in <lambda>
    study.optimize(lambda trial: objective(trial, X_train, y_train), n_trials=30, n_jobs=-1, show_progress_bar=True)
                                 ~~~~~~~~~^^^^^^^^^^^^^^^^^^^^^^^^^
  File "/home/junior/Documentos/GitHub/prediction-f1-pit-stops-kaggle-competition/src/ridge_tuning.py", line 103, in objective
    calibrated_ridge = CalibratedClassifierCV(
                       ^^^^^^^^^^^^^^^^^^^^^^
NameError: name 'CalibratedClassifierCV' is not defined
2026-05-18 18:50:51,526 - WARNING - Trial 2 failed with parameters: {'alpha': 0.007970951853461314, 'solver': 'lbfgs', 'tol': 1.24913419789593e-05, 'fit_intercept': False, 'max_iter': 3000} because of the following error: NameError("name 'CalibratedClassifierCV' is not defined").
Traceback (most recent call last):
  File "/home/junior/Documentos/GitHub/prediction-f1-pit-stops-kaggle-competition/.venv/lib/python3.13/site-packages/optuna/study/_optimize.py", line 206, in _run_trial
    value_or_values = func(trial)
  File "/home/junior/Documentos/GitHub/prediction-f1-pit-stops-kaggle-competition/src/ridge_tuning.py", line 124, in <lambda>
    study.optimize(lambda trial: objective(trial, X_train, y_train), n_trials=30, n_jobs=-1, show_progress_bar=True)
                                 ~~~~~~~~~^^^^^^^^^^^^^^^^^^^^^^^^^
  File "/home/junior/Documentos/GitHub/prediction-f1-pit-stops-kaggle-competition/src/ridge_tuning.py", line 103, in objective
    calibrated_ridge = CalibratedClassifierCV(
                       ^^^^^^^^^^^^^^^^^^^^^^
NameError: name 'CalibratedClassifierCV' is not defined
2026-05-18 18:50:51,527 - WARNING - Trial 9 failed with parameters: {'alpha': 0.058627863210087026, 'solver': 'svd', 'tol': 0.0005713246986916842, 'fit_intercept': False, 'max_iter': 3000} because of the following error: NameError("name 'CalibratedClassifierCV' is not defined").
Traceback (most recent call last):
  File "/home/junior/Documentos/GitHub/prediction-f1-pit-stops-kaggle-competition/.venv/lib/python3.13/site-packages/optuna/study/_optimize.py", line 206, in _run_trial
    value_or_values = func(trial)
  File "/home/junior/Documentos/GitHub/prediction-f1-pit-stops-kaggle-competition/src/ridge_tuning.py", line 124, in <lambda>
    study.optimize(lambda trial: objective(trial, X_train, y_train), n_trials=30, n_jobs=-1, show_progress_bar=True)
                                 ~~~~~~~~~^^^^^^^^^^^^^^^^^^^^^^^^^
  File "/home/junior/Documentos/GitHub/prediction-f1-pit-stops-kaggle-competition/src/ridge_tuning.py", line 103, in objective
    calibrated_ridge = CalibratedClassifierCV(
                       ^^^^^^^^^^^^^^^^^^^^^^
NameError: name 'CalibratedClassifierCV' is not defined
2026-05-18 18:50:51,528 - WARNING - Trial 0 failed with value None.
2026-05-18 18:50:51,529 - WARNING - Trial 8 failed with value None.
2026-05-18 18:50:51,530 - WARNING - Trial 7 failed with value None.
2026-05-18 18:50:51,531 - WARNING - Trial 5 failed with parameters: {'alpha': 0.014011268428796124, 'solver': 'auto', 'tol': 0.00028484006054277236, 'fit_intercept': True, 'max_iter': 4500} because of the following error: NameError("name 'CalibratedClassifierCV' is not defined").
Traceback (most recent call last):
  File "/home/junior/Documentos/GitHub/prediction-f1-pit-stops-kaggle-competition/.venv/lib/python3.13/site-packages/optuna/study/_optimize.py", line 206, in _run_trial
    value_or_values = func(trial)
  File "/home/junior/Documentos/GitHub/prediction-f1-pit-stops-kaggle-competition/src/ridge_tuning.py", line 124, in <lambda>
    study.optimize(lambda trial: objective(trial, X_train, y_train), n_trials=30, n_jobs=-1, show_progress_bar=True)
                                 ~~~~~~~~~^^^^^^^^^^^^^^^^^^^^^^^^^
  File "/home/junior/Documentos/GitHub/prediction-f1-pit-stops-kaggle-competition/src/ridge_tuning.py", line 103, in objective
    calibrated_ridge = CalibratedClassifierCV(
                       ^^^^^^^^^^^^^^^^^^^^^^
NameError: name 'CalibratedClassifierCV' is not defined
2026-05-18 18:50:51,532 - WARNING - Trial 11 failed with value None.
2026-05-18 18:50:51,533 - WARNING - Trial 1 failed with parameters: {'alpha': 0.00010588226818942915, 'solver': 'sag', 'tol': 5.644113873772704e-05, 'fit_intercept': True, 'max_iter': 500} because of the following error: NameError("name 'CalibratedClassifierCV' is not defined").
Traceback (most recent call last):
  File "/home/junior/Documentos/GitHub/prediction-f1-pit-stops-kaggle-competition/.venv/lib/python3.13/site-packages/optuna/study/_optimize.py", line 206, in _run_trial
    value_or_values = func(trial)
  File "/home/junior/Documentos/GitHub/prediction-f1-pit-stops-kaggle-competition/src/ridge_tuning.py", line 124, in <lambda>
    study.optimize(lambda trial: objective(trial, X_train, y_train), n_trials=30, n_jobs=-1, show_progress_bar=True)
                                 ~~~~~~~~~^^^^^^^^^^^^^^^^^^^^^^^^^
  File "/home/junior/Documentos/GitHub/prediction-f1-pit-stops-kaggle-competition/src/ridge_tuning.py", line 103, in objective
    calibrated_ridge = CalibratedClassifierCV(
                       ^^^^^^^^^^^^^^^^^^^^^^
NameError: name 'CalibratedClassifierCV' is not defined
2026-05-18 18:50:51,533 - WARNING - Trial 2 failed with value None.
2026-05-18 18:50:51,533 - WARNING - Trial 9 failed with value None.
2026-05-18 18:50:51,535 - WARNING - Trial 5 failed with value None.
2026-05-18 18:50:51,535 - WARNING - Trial 1 failed with value None.
2026-05-18 18:51:44,265 - INFO - ----- Fine Tuning -----
2026-05-18 18:51:44,265 - INFO - A new study created in memory with name: no-name-456a745f-d592-4e45-b460-65f33de71d5e
2026-05-18 18:51:45,069 - WARNING - Trial 2 failed with parameters: {'alpha': 0.0012166708034544935, 'solver': 'lbfgs', 'tol': 0.0010172326835657817, 'fit_intercept': True, 'max_iter': 500, 'calibration_method': 'isotonic'} because of the following error: TypeError("CalibratedClassifierCV.fit() missing 1 required positional argument: 'y'").
Traceback (most recent call last):
  File "/home/junior/Documentos/GitHub/prediction-f1-pit-stops-kaggle-competition/.venv/lib/python3.13/site-packages/optuna/study/_optimize.py", line 206, in _run_trial
    value_or_values = func(trial)
  File "/home/junior/Documentos/GitHub/prediction-f1-pit-stops-kaggle-competition/src/ridge_tuning.py", line 125, in <lambda>
    study.optimize(lambda trial: objective(trial, X_train, y_train), n_trials=30, n_jobs=-1, show_progress_bar=True)
                                 ~~~~~~~~~^^^^^^^^^^^^^^^^^^^^^^^^^
  File "/home/junior/Documentos/GitHub/prediction-f1-pit-stops-kaggle-competition/src/ridge_tuning.py", line 108, in objective
    ).fit(X_train)
      ~~~^^^^^^^^^
  File "/home/junior/Documentos/GitHub/prediction-f1-pit-stops-kaggle-competition/.venv/lib/python3.13/site-packages/sklearn/base.py", line 1336, in wrapper
    return fit_method(estimator, *args, **kwargs)
TypeError: CalibratedClassifierCV.fit() missing 1 required positional argument: 'y'
2026-05-18 18:51:45,076 - WARNING - Trial 4 failed with parameters: {'alpha': 0.001532780745704831, 'solver': 'auto', 'tol': 3.170285622884126e-05, 'fit_intercept': True, 'max_iter': 5000, 'calibration_method': 'sigmoid'} because of the following error: TypeError("CalibratedClassifierCV.fit() missing 1 required positional argument: 'y'").
Traceback (most recent call last):
  File "/home/junior/Documentos/GitHub/prediction-f1-pit-stops-kaggle-competition/.venv/lib/python3.13/site-packages/optuna/study/_optimize.py", line 206, in _run_trial
    value_or_values = func(trial)
  File "/home/junior/Documentos/GitHub/prediction-f1-pit-stops-kaggle-competition/src/ridge_tuning.py", line 125, in <lambda>
    study.optimize(lambda trial: objective(trial, X_train, y_train), n_trials=30, n_jobs=-1, show_progress_bar=True)
                                 ~~~~~~~~~^^^^^^^^^^^^^^^^^^^^^^^^^
  File "/home/junior/Documentos/GitHub/prediction-f1-pit-stops-kaggle-competition/src/ridge_tuning.py", line 108, in objective
    ).fit(X_train)
      ~~~^^^^^^^^^
  File "/home/junior/Documentos/GitHub/prediction-f1-pit-stops-kaggle-competition/.venv/lib/python3.13/site-packages/sklearn/base.py", line 1336, in wrapper
    return fit_method(estimator, *args, **kwargs)
TypeError: CalibratedClassifierCV.fit() missing 1 required positional argument: 'y'
2026-05-18 18:51:45,077 - WARNING - Trial 11 failed with parameters: {'alpha': 1.4430854089579904e-05, 'solver': 'cholesky', 'tol': 0.023639850014519338, 'fit_intercept': False, 'max_iter': 4500, 'calibration_method': 'isotonic'} because of the following error: TypeError("CalibratedClassifierCV.fit() missing 1 required positional argument: 'y'").
Traceback (most recent call last):
  File "/home/junior/Documentos/GitHub/prediction-f1-pit-stops-kaggle-competition/.venv/lib/python3.13/site-packages/optuna/study/_optimize.py", line 206, in _run_trial
    value_or_values = func(trial)
  File "/home/junior/Documentos/GitHub/prediction-f1-pit-stops-kaggle-competition/src/ridge_tuning.py", line 125, in <lambda>
    study.optimize(lambda trial: objective(trial, X_train, y_train), n_trials=30, n_jobs=-1, show_progress_bar=True)
                                 ~~~~~~~~~^^^^^^^^^^^^^^^^^^^^^^^^^
  File "/home/junior/Documentos/GitHub/prediction-f1-pit-stops-kaggle-competition/src/ridge_tuning.py", line 108, in objective
    ).fit(X_train)
      ~~~^^^^^^^^^
  File "/home/junior/Documentos/GitHub/prediction-f1-pit-stops-kaggle-competition/.venv/lib/python3.13/site-packages/sklearn/base.py", line 1336, in wrapper
    return fit_method(estimator, *args, **kwargs)
TypeError: CalibratedClassifierCV.fit() missing 1 required positional argument: 'y'
2026-05-18 18:51:45,077 - WARNING - Trial 6 failed with parameters: {'alpha': 0.9442209736805223, 'solver': 'sparse_cg', 'tol': 0.027622937487480907, 'fit_intercept': False, 'max_iter': 5000, 'calibration_method': 'isotonic'} because of the following error: TypeError("CalibratedClassifierCV.fit() missing 1 required positional argument: 'y'").
Traceback (most recent call last):
  File "/home/junior/Documentos/GitHub/prediction-f1-pit-stops-kaggle-competition/.venv/lib/python3.13/site-packages/optuna/study/_optimize.py", line 206, in _run_trial
    value_or_values = func(trial)
  File "/home/junior/Documentos/GitHub/prediction-f1-pit-stops-kaggle-competition/src/ridge_tuning.py", line 125, in <lambda>
    study.optimize(lambda trial: objective(trial, X_train, y_train), n_trials=30, n_jobs=-1, show_progress_bar=True)
                                 ~~~~~~~~~^^^^^^^^^^^^^^^^^^^^^^^^^
  File "/home/junior/Documentos/GitHub/prediction-f1-pit-stops-kaggle-competition/src/ridge_tuning.py", line 108, in objective
    ).fit(X_train)
      ~~~^^^^^^^^^
  File "/home/junior/Documentos/GitHub/prediction-f1-pit-stops-kaggle-competition/.venv/lib/python3.13/site-packages/sklearn/base.py", line 1336, in wrapper
    return fit_method(estimator, *args, **kwargs)
TypeError: CalibratedClassifierCV.fit() missing 1 required positional argument: 'y'
2026-05-18 18:51:45,080 - WARNING - Trial 2 failed with value None.
2026-05-18 18:51:45,083 - WARNING - Trial 8 failed with parameters: {'alpha': 20.819247528916996, 'solver': 'lbfgs', 'tol': 0.0005502044433888608, 'fit_intercept': False, 'max_iter': 2000, 'calibration_method': 'isotonic'} because of the following error: TypeError("CalibratedClassifierCV.fit() missing 1 required positional argument: 'y'").
Traceback (most recent call last):
  File "/home/junior/Documentos/GitHub/prediction-f1-pit-stops-kaggle-competition/.venv/lib/python3.13/site-packages/optuna/study/_optimize.py", line 206, in _run_trial
    value_or_values = func(trial)
  File "/home/junior/Documentos/GitHub/prediction-f1-pit-stops-kaggle-competition/src/ridge_tuning.py", line 125, in <lambda>
    study.optimize(lambda trial: objective(trial, X_train, y_train), n_trials=30, n_jobs=-1, show_progress_bar=True)
                                 ~~~~~~~~~^^^^^^^^^^^^^^^^^^^^^^^^^
  File "/home/junior/Documentos/GitHub/prediction-f1-pit-stops-kaggle-competition/src/ridge_tuning.py", line 108, in objective
    ).fit(X_train)
      ~~~^^^^^^^^^
  File "/home/junior/Documentos/GitHub/prediction-f1-pit-stops-kaggle-competition/.venv/lib/python3.13/site-packages/sklearn/base.py", line 1336, in wrapper
    return fit_method(estimator, *args, **kwargs)
TypeError: CalibratedClassifierCV.fit() missing 1 required positional argument: 'y'
2026-05-18 18:51:45,084 - WARNING - Trial 10 failed with parameters: {'alpha': 0.029711799277737625, 'solver': 'auto', 'tol': 1.5733920832274818e-05, 'fit_intercept': True, 'max_iter': 4000, 'calibration_method': 'sigmoid'} because of the following error: TypeError("CalibratedClassifierCV.fit() missing 1 required positional argument: 'y'").
Traceback (most recent call last):
  File "/home/junior/Documentos/GitHub/prediction-f1-pit-stops-kaggle-competition/.venv/lib/python3.13/site-packages/optuna/study/_optimize.py", line 206, in _run_trial
    value_or_values = func(trial)
  File "/home/junior/Documentos/GitHub/prediction-f1-pit-stops-kaggle-competition/src/ridge_tuning.py", line 125, in <lambda>
    study.optimize(lambda trial: obje