2026-05-18 19:22:26,508 - INFO - Trial 5 finished with value: 0.8823335604355107 and parameters: {'solver': 'cholesky', 'alpha': 0.033673141548458296, 'tol': 0.022482927814153997, 'fit_intercept': True, 'class_weight': None}. Best is trial 11 with value: 0.8823471930637469.
2026-05-18 19:22:26,577 - INFO - Trial 0 finished with value: 0.8877084952676768 and parameters: {'solver': 'cholesky', 'alpha': 55.084847237957355, 'tol': 0.0005792773720643268, 'fit_intercept': False, 'class_weight': 'balanced'}. Best is trial 0 with value: 0.8877084952676768.
2026-05-18 19:22:26,641 - INFO - Trial 9 finished with value: 0.8878181238767411 and parameters: {'solver': 'cholesky', 'alpha': 0.0042833021299830566, 'tol': 0.00010000533781340507, 'fit_intercept': True, 'class_weight': 'balanced'}. Best is trial 9 with value: 0.8878181238767411.
2026-05-18 19:22:26,653 - INFO - Trial 6 finished with value: 0.887816427952324 and parameters: {'solver': 'cholesky', 'alpha': 1.3845925885419728, 'tol': 0.00024643448723454293, 'fit_intercept': True, 'class_weight': 'balanced'}. Best is trial 9 with value: 0.8878181238767411.
2026-05-18 19:22:26,672 - INFO - Trial 2 finished with value: 0.882333432289532 and parameters: {'solver': 'cholesky', 'alpha': 0.28424591763243595, 'tol': 0.0021310096465169386, 'fit_intercept': False, 'class_weight': None}. Best is trial 9 with value: 0.8878181238767411.
2026-05-18 19:22:37,135 - INFO - Trial 7 finished with value: 0.8859353758406545 and parameters: {'solver': 'lsqr', 'alpha': 2.09823475346676e-05, 'tol': 0.0007438554521582029, 'fit_intercept': False, 'class_weight': 'balanced', 'max_iter': 5000}. Best is trial 9 with value: 0.8878181238767411.
2026-05-18 19:22:49,450 - INFO - Trial 14 pruned. 
2026-05-18 19:22:49,670 - INFO - Trial 17 pruned. 
2026-05-18 19:23:01,467 - INFO - Trial 15 finished with value: 0.8824177397801289 and parameters: {'solver': 'cholesky', 'alpha': 0.004351430928726529, 'tol': 0.00044756232632590584, 'fit_intercept': False, 'class_weight': None}. Best is trial 9 with value: 0.8878181238767411.
2026-05-18 19:23:01,485 - INFO - Trial 18 finished with value: 0.8824155291274348 and parameters: {'solver': 'auto', 'alpha': 0.009109620298026784, 'tol': 7.396852472756678e-05, 'fit_intercept': False, 'class_weight': None}. Best is trial 9 with value: 0.8878181238767411.
2026-05-18 19:23:02,569 - INFO - Trial 19 finished with value: 0.8824021380386776 and parameters: {'solver': 'cholesky', 'alpha': 0.9721212937325658, 'tol': 0.0008463678425674091, 'fit_intercept': True, 'class_weight': None}. Best is trial 9 with value: 0.8878181238767411.
2026-05-18 19:23:23,943 - INFO - Trial 20 finished with value: 0.8879317004380756 and parameters: {'solver': 'lsqr', 'alpha': 7.0821969620390215, 'tol': 2.0620592052335993e-05, 'fit_intercept': False, 'class_weight': 'balanced', 'max_iter': 3000}. Best is trial 20 with value: 0.8879317004380756.
2026-05-18 19:24:34,338 - INFO - Trial 12 pruned. 
2026-05-18 19:24:52,867 - INFO - Trial 13 pruned. 
2026-05-18 19:25:28,050 - INFO - Trial 28 finished with value: 0.8878273169117904 and parameters: {'solver': 'lsqr', 'alpha': 0.0005115712427379333, 'tol': 1.0811816664897012e-05, 'fit_intercept': True, 'class_weight': 'balanced', 'max_iter': 2500}. Best is trial 20 with value: 0.8879317004380756.
2026-05-18 19:25:57,471 - INFO - Trial 29 finished with value: 0.8878108506713801 and parameters: {'solver': 'lsqr', 'alpha': 0.00030075018697047086, 'tol': 1.8055451836686263e-05, 'fit_intercept': True, 'class_weight': 'balanced', 'max_iter': 2500}. Best is trial 20 with value: 0.8879317004380756.
2026-05-18 19:26:30,452 - INFO - Trial 30 finished with value: 0.8878821956142 and parameters: {'solver': 'lsqr', 'alpha': 0.00045615203455414116, 'tol': 1.1109584273696258e-05, 'fit_intercept': True, 'class_weight': 'balanced', 'max_iter': 3000}. Best is trial 20 with value: 0.8879317004380756.
2026-05-18 19:26:54,692 - INFO - Trial 31 finished with value: 0.887738238275636 and parameters: {'solver': 'lsqr', 'alpha': 11.251467129726917, 'tol': 3.951133131829473e-05, 'fit_intercept': True, 'class_weight': 'balanced', 'max_iter': 3500}. Best is trial 20 with value: 0.8879317004380756.
2026-05-18 19:27:28,363 - INFO - Trial 32 finished with value: 0.8878318281178175 and parameters: {'solver': 'lsqr', 'alpha': 0.0002782161106043673, 'tol': 1.3906669005723853e-05, 'fit_intercept': True, 'class_weight': 'balanced', 'max_iter': 3000}. Best is trial 20 with value: 0.8879317004380756.
2026-05-18 19:27:58,255 - INFO - Trial 33 finished with value: 0.8879616154937959 and parameters: {'solver': 'lsqr', 'alpha': 0.00016808255059767445, 'tol': 2.7758643807465033e-05, 'fit_intercept': True, 'class_weight': 'balanced', 'max_iter': 3500}. Best is trial 33 with value: 0.8879616154937959.
2026-05-18 19:28:24,730 - INFO - Trial 34 finished with value: 0.8877758784412068 and parameters: {'solver': 'lsqr', 'alpha': 1.3690916718005115e-05, 'tol': 2.9671267453058145e-05, 'fit_intercept': True, 'class_weight': 'balanced', 'max_iter': 1500}. Best is trial 33 with value: 0.8879616154937959.
2026-05-18 19:28:46,326 - INFO - Trial 35 finished with value: 0.8873870341787488 and parameters: {'solver': 'lsqr', 'alpha': 8.579813859762899e-05, 'tol': 8.409085665819642e-05, 'fit_intercept': True, 'class_weight': 'balanced', 'max_iter': 3500}. Best is trial 33 with value: 0.8879616154937959.
2026-05-18 19:28:47,237 - INFO - Trial 4 pruned. 
2026-05-18 19:29:28,033 - INFO - Trial 37 finished with value: 0.8877618986860398 and parameters: {'solver': 'lsqr', 'alpha': 0.002083814475763101, 'tol': 3.517782578974553e-05, 'fit_intercept': True, 'class_weight': 'balanced', 'max_iter': 3500}. Best is trial 33 with value: 0.8879616154937959.
2026-05-18 19:29:28,226 - INFO - Trial 36 finished with value: 0.8877673353333236 and parameters: {'solver': 'lsqr', 'alpha': 0.0010576021632877316, 'tol': 3.330056055363014e-05, 'fit_intercept': True, 'class_weight': 'balanced', 'max_iter': 3500}. Best is trial 33 with value: 0.8879616154937959.
2026-05-18 19:30:04,041 - INFO - Trial 38 finished with value: 0.887068723125582 and parameters: {'solver': 'lsqr', 'alpha': 0.02511197112559078, 'tol': 0.00015301876461313617, 'fit_intercept': True, 'class_weight': 'balanced', 'max_iter': 2000}. Best is trial 33 with value: 0.8879616154937959.
2026-05-18 19:30:26,761 - INFO - Trial 39 finished with value: 0.888079193972399 and parameters: {'solver': 'lsqr', 'alpha': 0.01870547106177371, 'tol': 1.0050898720441312e-05, 'fit_intercept': False, 'class_weight': 'balanced', 'max_iter': 2000}. Best is trial 39 with value: 0.888079193972399.
2026-05-18 19:31:00,825 - INFO - Trial 40 finished with value: 0.8879921461960649 and parameters: {'solver': 'lsqr', 'alpha': 0.0001857486113195569, 'tol': 1.0080267474466336e-05, 'fit_intercept': False, 'class_weight': 'balanced', 'max_iter': 3000}. Best is trial 39 with value: 0.888079193972399.
2026-05-18 19:31:07,166 - INFO - Trial 41 finished with value: 0.8877422927142333 and parameters: {'solver': 'lsqr', 'alpha': 58.16615283929074, 'tol': 5.8655200082347636e-05, 'fit_intercept': False, 'class_weight': 'balanced', 'max_iter': 2000}. Best is trial 39 with value: 0.888079193972399.
2026-05-18 19:31:51,389 - INFO - Trial 42 finished with value: 0.8878067747522032 and parameters: {'solver': 'lsqr', 'alpha': 7.085338555840314e-05, 'tol': 2.016001698473775e-05, 'fit_intercept': False, 'class_weight': 'balanced', 'max_iter': 2000}. Best is trial 39 with value: 0.888079193972399.
2026-05-18 19:31:53,012 - INFO - Trial 43 finished with value: 0.8879406936732674 and parameters: {'solver': 'lsqr', 'alpha': 0.000125832290225456, 'tol': 2.3139320013962158e-05, 'fit_intercept': False, 'class_weight': 'balanced', 'max_iter': 2000}. Best is trial 39 with value: 0.888079193972399.
2026-05-18 19:32:25,857 - INFO - Trial 44 finished with value: 0.8878682808318523 and parameters: {'solver': 'lsqr', 'alpha': 0.18114785620402013, 'tol': 2.0517047617937798e-05, 'fit_intercept': False, 'class_weight': 'balanced', 'max_iter': 3000}. Best is trial 39 with value: 0.888079193972399.
2026-05-18 19:33:39,275 - INFO - Trial 1 pruned. 
2026-05-18 19:36:31,766 - INFO - Trial 23 pruned. 
2026-05-18 19:36:42,028 - INFO - Trial 48 finished with value: 0.8878189540046696 and parameters: {'solver': 'auto', 'alpha': 0.000133013358999473, 'tol': 5.545510437912862e-05, 'fit_intercept': False, 'class_weight': 'balanced'}. Best is trial 39 with value: 0.888079193972399.
2026-05-18 19:36:50,157 - INFO - Trial 22 pruned. 
2026-05-18 19:36:53,075 - INFO - Trial 24 pruned. 
2026-05-18 19:36:54,338 - INFO - Trial 25 pruned. 
2026-05-18 19:37:51,941 - INFO - Trial 51 finished with value: 0.8869598236875357 and parameters: {'solver': 'lsqr', 'alpha': 0.00015576209441740753, 'tol': 0.00014650247370839238, 'fit_intercept': False, 'class_weight': 'balanced', 'max_iter': 1500}. Best is trial 39 with value: 0.888079193972399.
2026-05-18 19:37:52,094 - INFO - Trial 52 finished with value: 0.8870323349461466 and parameters: {'solver': 'lsqr', 'alpha': 0.00017347567416190488, 'tol': 0.00013157401554862648, 'fit_intercept': False, 'class_weight': 'balanced', 'max_iter': 1500}. Best is trial 39 with value: 0.888079193972399.
2026-05-18 19:38:11,829 - INFO - Trial 49 finished with value: 0.887880206722085 and parameters: {'solver': 'lsqr', 'alpha': 0.00016363605032458095, 'tol': 1.0117734490762127e-05, 'fit_intercept': False, 'class_weight': 'balanced', 'max_iter': 2000}. Best is trial 39 with value: 0.888079193972399.
2026-05-18 19:38:22,525 - INFO - Trial 50 finished with value: 0.888078166736326 and parameters: {'solver': 'lsqr', 'alpha': 1.066104461363732e-05, 'tol': 1.0871062321305385e-05, 'fit_intercept': False, 'class_weight': 'balanced', 'max_iter': 1500}. Best is trial 39 with value: 0.888079193972399.
2026-05-18 19:39:19,002 - INFO - Trial 55 finished with value: 0.8877437186501302 and parameters: {'solver': 'lsqr', 'alpha': 3.0788551497074724e-05, 'tol': 4.208643064153485e-05, 'fit_intercept': False, 'class_weight': 'balanced', 'max_iter': 4000}. Best is trial 39 with value: 0.888079193972399.
2026-05-18 19:39:30,635 - INFO - Trial 56 finished with value: 0.8879463883215161 and parameters: {'solver': 'lsqr', 'alpha': 3.2339933722183214e-05, 'tol': 5.311477343624582e-05, 'fit_intercept': False, 'class_weight': 'balanced', 'max_iter': 1500}. Best is trial 39 with value: 0.888079193972399.
2026-05-18 19:39:33,177 - INFO - Trial 53 finished with value: 0.8879961730238923 and parameters: {'solver': 'lsqr', 'alpha': 0.036968260248923177, 'tol': 1.1261166188606518e-05, 'fit_intercept': False, 'class_weight': 'balanced', 'max_iter': 2500}. Best is trial 39 with value: 0.888079193972399.
2026-05-18 19:39:33,349 - INFO - Trial 54 finished with value: 0.888005197712627 and parameters: {'solver': 'lsqr', 'alpha': 0.04743067735452017, 'tol': 1.0420839668805701e-05, 'fit_intercept': False, 'class_weight': 'balanced', 'max_iter': 4000}. Best is trial 39 with value: 0.888079193972399.
2026-05-18 19:39:59,596 - INFO - Trial 58 finished with value: 0.8878202430054154 and parameters: {'solver': 'auto', 'alpha': 1.2454639802824898e-05, 'tol': 0.0015627139733117264, 'fit_intercept': False, 'class_weight': 'balanced'}. Best is trial 39 with value: 0.888079193972399.
2026-05-18 19:40:02,938 - INFO - Trial 59 finished with value: 0.8878200742880796 and parameters: {'solver': 'auto', 'alpha': 0.04488515723685958, 'tol': 1.0197452269885441e-05, 'fit_intercept': False, 'class_weight': 'balanced'}. Best is trial 39 with value: 0.888079193972399.
2026-05-18 19:40:03,834 - INFO - Trial 60 finished with value: 0.8878201608329352 and parameters: {'solver': 'auto', 'alpha': 0.02228671902942497, 'tol': 0.012922464155532736, 'fit_intercept': False, 'class_weight': 'balanced'}. Best is trial 39 with value: 0.888079193972399.
2026-05-18 19:40:24,488 - INFO - Trial 61 finished with value: 0.8878188855013885 and parameters: {'solver': 'cholesky', 'alpha': 0.056662661684296366, 'tol': 0.012020633006030162, 'fit_intercept': False, 'class_weight': 'balanced'}. Best is trial 39 with value: 0.888079193972399.
2026-05-18 19:40:41,155 - INFO - Trial 57 finished with value: 0.8880306121542978 and parameters: {'solver': 'lsqr', 'alpha': 1.6056481503849948e-05, 'tol': 1.0287729032215371e-05, 'fit_intercept': False, 'class_weight': 'balanced', 'max_iter': 1500}. Best is trial 39 with value: 0.888079193972399.
2026-05-18 19:41:38,123 - INFO - Trial 63 finished with value: 0.8880557766829643 and parameters: {'solver': 'lsqr', 'alpha': 0.07393459309744206, 'tol': 1.4314339595634071e-05, 'fit_intercept': False, 'class_weight': 'balanced', 'max_iter': 4000}. Best is trial 39 with value: 0.888079193972399.
2026-05-18 19:41:39,534 - INFO - Trial 62 finished with value: 0.8880549489600128 and parameters: {'solver': 'lsqr', 'alpha': 0.015981502950415616, 'tol': 1.3470522567885245e-05, 'fit_intercept': False, 'class_weight': 'balanced', 'max_iter': 4000}. Best is trial 39 with value: 0.888079193972399.
2026-05-18 19:41:39,678 - INFO - Trial 65 pruned. 
2026-05-18 19:41:54,842 - INFO - Trial 64 finished with value: 0.8879302857021292 and parameters: {'solver': 'lsqr', 'alpha': 0.011437440699746412, 'tol': 1.4038614753979325e-05, 'fit_intercept': False, 'class_weight': 'balanced', 'max_iter': 4000}. Best is trial 39 with value: 0.888079193972399.
2026-05-18 19:41:55,211 - INFO - Trial 68 pruned. 
2026-05-18 19:42:11,117 - INFO - Trial 69 pruned. 
2026-05-18 19:42:31,089 - INFO - Trial 67 pruned. 
2026-05-18 19:42:32,897 - INFO - Trial 66 pruned. 
2026-05-18 19:42:46,101 - INFO - Trial 70 finished with value: 0.8864670588537387 and parameters: {'solver': 'lsqr', 'alpha': 0.07898128416768353, 'tol': 0.000498860084464306, 'fit_intercept': False, 'class_weight': 'balanced', 'max_iter': 5000}. Best is trial 39 with value: 0.888079193972399.
2026-05-18 19:43:16,945 - INFO - Trial 71 finished with value: 0.887827246535074 and parameters: {'solver': 'lsqr', 'alpha': 0.3315898667284239, 'tol': 4.0184985158285096e-05, 'fit_intercept': False, 'class_weight': 'balanced', 'max_iter': 5000}. Best is trial 39 with value: 0.888079193972399.
2026-05-18 19:43:50,619 - INFO - Trial 72 finished with value: 0.8879545815535949 and parameters: {'solver': 'lsqr', 'alpha': 0.006719984831342328, 'tol': 2.9455318499419765e-05, 'fit_intercept': False, 'class_weight': 'balanced', 'max_iter': 1000}. Best is trial 39 with value: 0.888079193972399.
2026-05-18 19:43:53,397 - INFO - Trial 73 finished with value: 0.8879877871650171 and parameters: {'solver': 'lsqr', 'alpha': 0.0773256287355177, 'tol': 2.6625512954573965e-05, 'fit_intercept': False, 'class_weight': 'balanced', 'max_iter': 1000}. Best is trial 39 with value: 0.888079193972399.
2026-05-18 19:44:04,870 - INFO - Trial 74 finished with value: 0.8880038629659186 and parameters: {'solver': 'lsqr', 'alpha': 0.006797398444286508, 'tol': 2.6625478617039478e-05, 'fit_intercept': False, 'class_weight': 'balanced', 'max_iter': 1000}. Best is trial 39 with value: 0.888079193972399.
2026-05-18 19:44:24,981 - INFO - Trial 75 finished with value: 0.8879158403953055 and parameters: {'solver': 'lsqr', 'alpha': 0.0059162629911217336, 'tol': 2.683674090552271e-05, 'fit_intercept': False, 'class_weight': 'balanced', 'max_iter': 1000}. Best is trial 39 with value: 0.888079193972399.
2026-05-18 19:44:38,534 - INFO - Trial 76 finished with value: 0.8878897629838363 and parameters: {'solver': 'lsqr', 'alpha': 0.23189947179828793, 'tol': 2.2989377551334688e-05, 'fit_intercept': False, 'class_weight': 'balanced', 'max_iter': 4500}. Best is trial 39 with value: 0.888079193972399.
2026-05-18 19:49:49,364 - INFO - Trial 3 pruned. 
2026-05-18 20:02:55,719 - INFO - ----- Fine Tuning -----
2026-05-18 20:02:55,719 - INFO - A new study created in memory with name: no-name-d87d96fa-e5e6-4d3a-9bc9-d7f9a1af7f12
2026-05-18 20:03:54,100 - INFO - ----- Fine Tuning -----
2026-05-18 20:03:54,100 - INFO - A new study created in memory with name: no-name-5d30583b-81ab-49e6-895f-75e352d88bf1
2026-05-18 20:04:50,440 - INFO - Trial 5 finished with value: 0.8878209863948822 and parameters: {'solver': 'cholesky', 'alpha': 0.018728029732574033, 'tol': 0.008333159830873555, 'fit_intercept': False, 'class_weight': 'balanced'}. Best is trial 5 with value: 0.8878209863948822.
2026-05-18 20:04:50,675 - INFO - Trial 1 finished with value: 0.8823349140856497 and parameters: {'solver': 'auto', 'alpha': 0.0019912006626877196, 'tol': 0.0032838482863512307, 'fit_intercept': False, 'class_weight': None}. Best is trial 5 with value: 0.8878209863948822.
2026-05-18 20:04:50,723 - INFO - Trial 10 finished with value: 0.8877539155127379 and parameters: {'solver': 'auto', 'alpha': 29.781230061745358, 'tol': 0.01616665022934625, 'fit_intercept': False, 'class_weight': 'balanced'}. Best is trial 5 with value: 0.8878209863948822.
2026-05-18 20:04:51,030 - INFO - Trial 0 finished with value: 0.8878143262459972 and parameters: {'solver': 'cholesky', 'alpha': 2.3097501976761166, 'tol': 0.0032299700584129576, 'fit_intercept': True, 'class_weight': 'balanced'}. Best is trial 5 with value: 0.8878209863948822.
2026-05-18 20:04:51,041 - INFO - Trial 8 finished with value: 0.8878114223824489 and parameters: {'solver': 'auto', 'alpha': 3.0856469963922133, 'tol': 1.1982762926418931e-05, 'fit_intercept': False, 'class_weight': 'balanced'}. Best is trial 5 with value: 0.8878209863948822.
2026-05-18 20:04:51,085 - INFO - Trial 2 finished with value: 0.8878180761258007 and parameters: {'solver': 'auto', 'alpha': 1.2694012597626907, 'tol': 0.0001618385987605233, 'fit_intercept': True, 'class_weight': 'balanced'}. Best is trial 5 with value: 0.8878209863948822.
2026-05-18 20:04:51,114 - INFO - Trial 6 finished with value: 0.8878207845128372 and parameters: {'solver': 'cholesky', 'alpha': 0.1137833478471946, 'tol': 0.005089151947469542, 'fit_intercept': False, 'class_weight': 'balanced'}. Best is trial 5 with value: 0.8878209863948822.
2026-05-18 20:04:51,131 - INFO - Trial 11 finished with value: 0.887820392652625 and parameters: {'solver': 'auto', 'alpha': 0.0004721318176321385, 'tol': 0.00024839886098244706, 'fit_intercept': True, 'class_weight': 'balanced'}. Best is trial 5 with value: 0.8878209863948822.
2026-05-18 20:04:51,629 - INFO - Trial 4 finished with value: 0.8878199361839366 and parameters: {'solver': 'cholesky', 'alpha': 0.0025364820825131817, 'tol': 7.69195108501101e-05, 'fit_intercept': True, 'class_weight': 'balanced'}. Best is trial 5 with value: 0.8878209863948822.
2026-05-18 20:05:02,808 - INFO - Trial 7 pruned. 
2026-05-18 20:05:20,006 - INFO - Trial 15 pruned. 
2026-05-18 20:05:20,109 - INFO - Trial 13 pruned. 
2026-05-18 20:05:24,645 - INFO - Trial 19 pruned. 
2026-05-18 20:05:34,103 - INFO - Trial 12 finished with value: 0.8878718306777396 and parameters: {'solver': 'auto', 'alpha': 0.09390479450230271, 'tol': 3.2183425028094784e-05, 'fit_intercept': False, 'class_weight': 'balanced'}. Best is trial 12 with value: 0.8878718306777396.
2026-05-18 20:05:35,641 - INFO - Trial 18 finished with value: 0.8878725887698824 and parameters: {'solver': 'auto', 'alpha': 6.793460027164618e-05, 'tol': 1.5672274145230922e-05, 'fit_intercept': True, 'class_weight': 'balanced'}. Best is trial 18 with value: 0.8878725887698824.
2026-05-18 20:05:35,668 - INFO - Trial 9 finished with value: 0.8880148231546328 and parameters: {'solver': 'lsqr', 'alpha': 8.40198175703907, 'tol': 2.072317000104866e-05, 'fit_intercept': False, 'class_weight': 'balanced', 'max_iter': 3000}. Best is trial 9 with value: 0.8880148231546328.
2026-05-18 20:05:37,163 - INFO - Trial 21 pruned. 
2026-05-18 20:05:56,591 - INFO - Trial 22 pruned. 
2026-05-18 20:06:28,201 - INFO - Trial 28 finished with value: 0.888072701648684 and parameters: {'solver': 'lsqr', 'alpha': 1.904647002579427e-05, 'tol': 1.0695698196513854e-05, 'fit_intercept': True, 'class_weight': 'balanced', 'max_iter': 2500}. Best is trial 28 with value: 0.888072701648684.
2026-05-18 20:06:49,924 - INFO - Trial 29 finished with value: 0.8880304130597422 and parameters: {'solver': 'lsqr', 'alpha': 2.2561780629586152e-05, 'tol': 1.920591136724941e-05, 'fit_intercept': True, 'class_weight': 'balanced', 'max_iter': 2500}. Best is trial 28 with value: 0.888072701648684.
2026-05-18 20:07:06,116 - INFO - Trial 17 pruned. 
2026-05-18 20:07:10,346 - INFO - Trial 30 finished with value: 0.8879864867304871 and parameters: {'solver': 'lsqr', 'alpha': 0.00015302658259335047, 'tol': 4.651571484758375e-05, 'fit_intercept': True, 'class_weight': 'balanced', 'max_iter': 2500}. Best is trial 28 with value: 0.888072701648684.
2026-05-18 20:07:38,946 - INFO - Trial 31 finished with value: 0.8878035302607824 and parameters: {'solver': 'lsqr', 'alpha': 0.0001098350860932941, 'tol': 6.82252258114073e-05, 'fit_intercept': True, 'class_weight': 'balanced', 'max_iter': 1500}. Best is trial 28 with value: 0.888072701648684.
2026-05-18 20:08:07,284 - INFO - Trial 32 finished with value: 0.8879349915992487 and parameters: {'solver': 'lsqr', 'alpha': 0.00013352935398243577, 'tol': 3.920068149230314e-05, 'fit_intercept': True, 'class_weight': 'balanced', 'max_iter': 2500}. Best is trial 28 with value: 0.888072701648684.
2026-05-18 20:08:20,470 - INFO - Trial 24 pruned. 
2026-05-18 20:08:28,009 - INFO - Trial 33 finished with value: 0.8879810615317076 and parameters: {'solver': 'lsqr', 'alpha': 75.70220947063738, 'tol': 1.0449082686303272e-05, 'fit_intercept': True, 'class_weight': 'balanced', 'max_iter': 2500}. Best is trial 28 with value: 0.888072701648684.
2026-05-18 20:08:47,480 - INFO - Trial 14 pruned. 
2026-05-18 20:08:55,469 - INFO - Trial 34 finished with value: 0.8880275513309298 and parameters: {'solver': 'lsqr', 'alpha': 25.902364171044002, 'tol': 2.275689766602529e-05, 'fit_intercept': True, 'class_weight': 'balanced', 'max_iter': 3000}. Best is trial 28 with value: 0.888072701648684.
