2026-05-18 21:32:43,608 - INFO - Trial 20 finished with value: 0.8864163334331104 and parameters: {'solver': 'sag', 'alpha': 0.023049316302420547, 'tol': 1.139556574109776e-05, 'fit_intercept': False, 'class_weight': 'balanced', 'max_iter': 4000}. Best is trial 28 with value: 0.888072701648684.
2026-05-18 21:35:08,681 - INFO - ----- Fine Tuning -----
2026-05-18 21:35:08,681 - INFO - A new study created in memory with name: no-name-b15e3a11-02b7-48a8-a56f-22f9778b957a
2026-05-18 21:35:09,341 - WARNING - Trial 1 failed with parameters: {'solver': 'sag', 'alpha': 0.0035134680931969476, 'tol': 0.0649761898883108, 'fit_intercept': False, 'class_weight': 'balanced', 'max_iter': 1500} because of the following error: TypeError("sklearn.linear_model._ridge.RidgeClassifier() got multiple values for keyword argument 'class_weight'").
Traceback (most recent call last):
  File "/home/junior/Documentos/GitHub/prediction-f1-pit-stops-kaggle-competition/.venv/lib/python3.13/site-packages/optuna/study/_optimize.py", line 206, in _run_trial
    value_or_values = func(trial)
  File "/home/junior/Documentos/GitHub/prediction-f1-pit-stops-kaggle-competition/src/ridge_tuning.py", line 120, in <lambda>
    study.optimize(lambda trial: objective(trial, X_train, y_train), n_trials=30, n_jobs=-1, show_progress_bar=True)
                                 ~~~~~~~~~^^^^^^^^^^^^^^^^^^^^^^^^^
  File "/home/junior/Documentos/GitHub/prediction-f1-pit-stops-kaggle-competition/src/ridge_tuning.py", line 104, in objective
    model = make_pipeline(column_transformer, RidgeClassifier(**params, class_weight="balanced", random_state=42))
                                              ~~~~~~~~~~~~~~~^^^^^^^^^^^^^^^^^^^^^^^^^^^^^^^^^^^^^^^^^^^^^^^^^^^^
TypeError: sklearn.linear_model._ridge.RidgeClassifier() got multiple values for keyword argument 'class_weight'
2026-05-18 21:35:09,356 - WARNING - Trial 1 failed with value None.
2026-05-18 21:35:09,448 - WARNING - Trial 2 failed with parameters: {'solver': 'auto', 'alpha': 61.371937003315104, 'tol': 0.0009576251190029771, 'fit_intercept': False, 'class_weight': None} because of the following error: TypeError("sklearn.linear_model._ridge.RidgeClassifier() got multiple values for keyword argument 'class_weight'").
Traceback (most recent call last):
  File "/home/junior/Documentos/GitHub/prediction-f1-pit-stops-kaggle-competition/.venv/lib/python3.13/site-packages/optuna/study/_optimize.py", line 206, in _run_trial
    value_or_values = func(trial)
  File "/home/junior/Documentos/GitHub/prediction-f1-pit-stops-kaggle-competition/src/ridge_tuning.py", line 120, in <lambda>
    study.optimize(lambda trial: objective(trial, X_train, y_train), n_trials=30, n_jobs=-1, show_progress_bar=True)
                                 ~~~~~~~~~^^^^^^^^^^^^^^^^^^^^^^^^^
  File "/home/junior/Documentos/GitHub/prediction-f1-pit-stops-kaggle-competition/src/ridge_tuning.py", line 104, in objective
    model = make_pipeline(column_transformer, RidgeClassifier(**params, class_weight="balanced", random_state=42))
                                              ~~~~~~~~~~~~~~~^^^^^^^^^^^^^^^^^^^^^^^^^^^^^^^^^^^^^^^^^^^^^^^^^^^^
TypeError: sklearn.linear_model._ridge.RidgeClassifier() got multiple values for keyword argument 'class_weight'
2026-05-18 21:35:09,454 - WARNING - Trial 2 failed with value None.
2026-05-18 21:35:09,503 - WARNING - Trial 3 failed with parameters: {'solver': 'sag', 'alpha': 7.977565747972979, 'tol': 0.0004010786262505232, 'fit_intercept': True, 'class_weight': None, 'max_iter': 500} because of the following error: TypeError("sklearn.linear_model._ridge.RidgeClassifier() got multiple values for keyword argument 'class_weight'").
Traceback (most recent call last):
  File "/home/junior/Documentos/GitHub/prediction-f1-pit-stops-kaggle-competition/.venv/lib/python3.13/site-packages/optuna/study/_optimize.py", line 206, in _run_trial
    value_or_values = func(trial)
  File "/home/junior/Documentos/GitHub/prediction-f1-pit-stops-kaggle-competition/src/ridge_tuning.py", line 120, in <lambda>
    study.optimize(lambda trial: objective(trial, X_train, y_train), n_trials=30, n_jobs=-1, show_progress_bar=True)
                                 ~~~~~~~~~^^^^^^^^^^^^^^^^^^^^^^^^^
  File "/home/junior/Documentos/GitHub/prediction-f1-pit-stops-kaggle-competition/src/ridge_tuning.py", line 104, in objective
    model = make_pipeline(column_transformer, RidgeClassifier(**params, class_weight="balanced", random_state=42))
                                              ~~~~~~~~~~~~~~~^^^^^^^^^^^^^^^^^^^^^^^^^^^^^^^^^^^^^^^^^^^^^^^^^^^^
TypeError: sklearn.linear_model._ridge.RidgeClassifier() got multiple values for keyword argument 'class_weight'
2026-05-18 21:35:09,506 - WARNING - Trial 10 failed with parameters: {'solver': 'sag', 'alpha': 0.006084292899710538, 'tol': 0.00010544343819261052, 'fit_intercept': False, 'class_weight': None, 'max_iter': 1500} because of the following error: TypeError("sklearn.linear_model._ridge.RidgeClassifier() got multiple values for keyword argument 'class_weight'").
Traceback (most recent call last):
  File "/home/junior/Documentos/GitHub/prediction-f1-pit-stops-kaggle-competition/.venv/lib/python3.13/site-packages/optuna/study/_optimize.py", line 206, in _run_trial
    value_or_values = func(trial)
  File "/home/junior/Documentos/GitHub/prediction-f1-pit-stops-kaggle-competition/src/ridge_tuning.py", line 120, in <lambda>
    study.optimize(lambda trial: objective(trial, X_train, y_train), n_trials=30, n_jobs=-1, show_progress_bar=True)
                                 ~~~~~~~~~^^^^^^^^^^^^^^^^^^^^^^^^^
  File "/home/junior/Documentos/GitHub/prediction-f1-pit-stops-kaggle-competition/src/ridge_tuning.py", line 104, in objective
    model = make_pipeline(column_transformer, RidgeClassifier(**params, class_weight="balanced", random_state=42))
                                              ~~~~~~~~~~~~~~~^^^^^^^^^^^^^^^^^^^^^^^^^^^^^^^^^^^^^^^^^^^^^^^^^^^^
TypeError: sklearn.linear_model._ridge.RidgeClassifier() got multiple values for keyword argument 'class_weight'
2026-05-18 21:35:09,509 - WARNING - Trial 3 failed with value None.
2026-05-18 21:35:09,510 - WARNING - Trial 10 failed with value None.
2026-05-18 21:35:09,511 - WARNING - Trial 5 failed with parameters: {'solver': 'auto', 'alpha': 30.67645404296912, 'tol': 0.052591123707681556, 'fit_intercept': False, 'class_weight': None} because of the following error: TypeError("sklearn.linear_model._ridge.RidgeClassifier() got multiple values for keyword argument 'class_weight'").
Traceback (most recent call last):
  File "/home/junior/Documentos/GitHub/prediction-f1-pit-stops-kaggle-competition/.venv/lib/python3.13/site-packages/optuna/study/_optimize.py", line 206, in _run_trial
    value_or_values = func(trial)
  File "/home/junior/Documentos/GitHub/prediction-f1-pit-stops-kaggle-competition/src/ridge_tuning.py", line 120, in <lambda>
    study.optimize(lambda trial: objective(trial, X_train, y_train), n_trials=30, n_jobs=-1, show_progress_bar=True)
                                 ~~~~~~~~~^^^^^^^^^^^^^^^^^^^^^^^^^
  File "/home/junior/Documentos/GitHub/prediction-f1-pit-stops-kaggle-competition/src/ridge_tuning.py", line 104, in objective
    model = make_pipeline(column_transformer, RidgeClassifier(**params, class_weight="balanced", random_state=42))
                                              ~~~~~~~~~~~~~~~^^^^^^^^^^^^^^^^^^^^^^^^^^^^^^^^^^^^^^^^^^^^^^^^^^^^
TypeError: sklearn.linear_model._ridge.RidgeClassifier() got multiple values for keyword argument 'class_weight'
2026-05-18 21:35:09,514 - WARNING - Trial 6 failed with parameters: {'solver': 'sag', 'alpha': 44.2317882092393, 'tol': 1.139074187451951e-05, 'fit_intercept': True, 'class_weight': None, 'max_iter': 500} because of the following error: TypeError("sklearn.linear_model._ridge.RidgeClassifier() got multiple values for keyword argument 'class_weight'").
Traceback (most recent call last):
  File "/home/junior/Documentos/GitHub/prediction-f1-pit-stops-kaggle-competition/.venv/lib/python3.13/site-packages/optuna/study/_optimize.py", line 206, in _run_trial
    value_or_values = func(trial)
  File "/home/junior/Documentos/GitHub/prediction-f1-pit-stops-kaggle-competition/src/ridge_tuning.py", line 120, in <lambda>
    study.optimize(lambda trial: objective(trial, X_train, y_train), n_trials=30, n_jobs=-1, show_progress_bar=True)
                                 ~~~~~~~~~^^^^^^^^^^^^^^^^^^^^^^^^^
  File "/home/junior/Documentos/GitHub/prediction-f1-pit-stops-kaggle-competition/src/ridge_tuning.py", line 104, in objective
    model = make_pipeline(column_transformer, RidgeClassifier(**params, class_weight="balanced", random_state=42))
                                              ~~~~~~~~~~~~~~~^^^^^^^^^^^^^^^^^^^^^^^^^^^^^^^^^^^^^^^^^^^^^^^^^^^^
TypeError: sklearn.linear_model._ridge.RidgeClassifier() got multiple values for keyword argument 'class_weight'
2026-05-18 21:35:09,516 - WARNING - Trial 5 failed with value None.
2026-05-18 21:35:09,516 - WARNING - Trial 8 failed with parameters: {'solver': 'lsqr', 'alpha': 0.0023428427647348643, 'tol': 1.2820785285990624e-05, 'fit_intercept': False, 'class_weight': None, 'max_iter': 5000} because of the following error: TypeError("sklearn.linear_model._ridge.RidgeClassifier() got multiple values for keyword argument 'class_weight'").
Traceback (most recent call last):
  File "/home/junior/Documentos/GitHub/prediction-f1-pit-stops-kaggle-competition/.venv/lib/python3.13/site-packages/optuna/study/_optimize.py", line 206, in _run_trial
    value_or_values = func(trial)
  File "/home/junior/Documentos/GitHub/prediction-f1-pit-stops-kaggle-competition/src/ridge_tuning.py", line 120, in <lambda>
    study.optimize(lambda trial: objective(trial, X_train, y_train), n_trials=30, n_jobs=-1, show_progress_bar=True)
                                 ~~~~~~~~~^^^^^^^^^^^^^^^^^^^^^^^^^
  File "/home/junior/Documentos/GitHub/prediction-f1-pit-stops-kaggle-competition/src/ridge_tuning.py", line 104, in objective
    model = make_pipeline(column_transformer, RidgeClassifier(**params, class_weight="balanced", random_state=42))
                                              ~~~~~~~~~~~~~~~^^^^^^^^^^^^^^^^^^^^^^^^^^^^^^^^^^^^^^^^^^^^^^^^^^^^
TypeError: sklearn.linear_model._ridge.RidgeClassifier() got multiple values for keyword argument 'class_weight'
2026-05-18 21:35:09,517 - WARNING - Trial 6 failed with value None.
2026-05-18 21:35:09,519 - WARNING - Trial 8 failed with value None.
2026-05-18 21:35:09,521 - WARNING - Trial 9 failed with parameters: {'solver': 'lsqr', 'alpha': 55.9802924785188, 'tol': 0.01555406982004735, 'fit_intercept': True, 'class_weight': 'balanced', 'max_iter': 1000} because of the following error: TypeError("sklearn.linear_model._ridge.RidgeClassifier() got multiple values for keyword argument 'class_weight'").
Traceback (most recent call last):
  File "/home/junior/Documentos/GitHub/prediction-f1-pit-stops-kaggle-competition/.venv/lib/python3.13/site-packages/optuna/study/_optimize.py", line 206, in _run_trial
    value_or_values = func(trial)
  File "/home/junior/Documentos/GitHub/prediction-f1-pit-stops-kaggle-competition/src/ridge_tuning.py", line 120, in <lambda>
    study.optimize(lambda trial: objective(trial, X_train, y_train), n_trials=30, n_jobs=-1, show_progress_bar=True)
                                 ~~~~~~~~~^^^^^^^^^^^^^^^^^^^^^^^^^
  File "/home/junior/Documentos/GitHub/prediction-f1-pit-stops-kaggle-competition/src/ridge_tuning.py", line 104, in objective
    model = make_pipeline(column_transformer, RidgeClassifier(**params, class_weight="balanced", random_state=42))
                                              ~~~~~~~~~~~~~~~^^^^^^^^^^^^^^^^^^^^^^^^^^^^^^^^^^^^^^^^^^^^^^^^^^^^
TypeError: sklearn.linear_model._ridge.RidgeClassifier() got multiple values for keyword argument 'class_weight'
2026-05-18 21:35:09,521 - WARNING - Trial 4 failed with parameters: {'solver': 'auto', 'alpha': 4.356611799302676e-05, 'tol': 0.0014465344949816372, 'fit_intercept': False, 'class_weight': None} because of the following error: TypeError("sklearn.linear_model._ridge.RidgeClassifier() got multiple values for keyword argument 'class_weight'").
Traceback (most recent call last):
  File "/home/junior/Documentos/GitHub/prediction-f1-pit-stops-kaggle-competition/.venv/lib/python3.13/site-packages/optuna/study/_optimize.py", line 206, in _run_trial
    value_or_values = func(trial)
  File "/home/junior/Documentos/GitHub/prediction-f1-pit-stops-kaggle-competition/src/ridge_tuning.py", line 120, in <lambda>
    study.optimize(lambda trial: objective(trial, X_train, y_train), n_trials=30, n_jobs=-1, show_progress_bar=True)
                                 ~~~~~~~~~^^^^^^^^^^^^^^^^^^^^^^^^^
  File "/home/junior/Documentos/GitHub/prediction-f1-pit-stops-kaggle-competition/src/ridge_tuning.py", line 104, in objective
    model = make_pipeline(column_transformer, RidgeClassifier(**params, class_weight="balanced", random_state=42))
                                              ~~~~~~~~~~~~~~~^^^^^^^^^^^^^^^^^^^^^^^^^^^^^^^^^^^^^^^^^^^^^^^^^^^^
TypeError: sklearn.linear_model._ridge.RidgeClassifier() got multiple values for keyword argument 'class_weight'
2026-05-18 21:35:09,522 - WARNING - Trial 9 failed with value None.
2026-05-18 21:35:09,523 - WARNING - Trial 4 failed with value None.
2026-05-18 21:35:09,524 - WARNING - Trial 7 failed with parameters: {'solver': 'sag', 'alpha': 0.03622338399195631, 'tol': 0.00022957706515553682, 'fit_intercept': True, 'class_weight': 'balanced', 'max_iter': 4000} because of the following error: TypeError("sklearn.linear_model._ridge.RidgeClassifier() got multiple values for keyword argument 'class_weight'").
Traceback (most recent call last):
  File "/home/junior/Documentos/GitHub/prediction-f1-pit-stops-kaggle-competition/.venv/lib/python3.13/site-packages/optuna/study/_optimize.py", line 206, in _run_trial
    value_or_values = func(trial)
  File "/home/junior/Documentos/GitHub/prediction-f1-pit-stops-kaggle-competition/src/ridge_tuning.py", line 120, in <lambda>
    study.optimize(lambda trial: objective(trial, X_train, y_train), n_trials=30, n_jobs=-1, show_progress_bar=True)
                                 ~~~~~~~~~^^^^^^^^^^^^^^^^^^^^^^^^^
  File "/home/junior/Documentos/GitHub/prediction-f1-pit-stops-kaggle-competition/src/ridge_tuning.py", line 104, in objective
    model = make_pipeline(column_transformer, RidgeClassifier(**params, class_weight="balanced", random_state=42))
                                              ~~~~~~~~~~~~~~~^^^^^^^^^^^^^^^^^^^^^^^^^^^^^^^^^^^^^^^^^^^^^^^^^^^^
TypeError: sklearn.linear_model._ridge.RidgeClassifier() got multiple values for keyword argument 'class_weight'
2026-05-18 21:35:09,525 - WARNING - Trial 0 failed with parameters: {'solver': 'auto', 'alpha': 0.18396806559956766, 'tol': 0.01008301780549832, 'fit_intercept': False, 'class_weight': None} because of the following error: TypeError("sklearn.linear_model._ridge.RidgeClassifier() got multiple values for keyword argument 'class_weight'").
Traceback (most recent call last):
  File "/home/junior/Documentos/GitHub/prediction-f1-pit-stops-kaggle-competition/.venv/lib/python3.13/site-packages/optuna/study/_optimize.py", line 206, in _run_trial
    value_or_values = func(trial)
  File "/home/junior/Documentos/GitHub/prediction-f1-pit-stops-kaggle-competition/src/ridge_tuning.py", line 120, in <lambda>
    study.optimize(lambda trial: objective(trial, X_train, y_train), n_trials=30, n_jobs=-1, show_progress_bar=True)
                                 ~~~~~~~~~^^^^^^^^^^^^^^^^^^^^^^^^^
  File "/home/junior/Documentos/GitHub/prediction-f1-pit-stops-kaggle-competition/src/ridge_tuning.py", line 104, in objective
    model = make_pipeline(column_transformer, RidgeClassifier(**params, class_weight="balanced", random_state=42))
                                              ~~~~~~~~~~~~~~~^^^^^^^^^^^^^^^^^^^^^^^^^^^^^^^^^^^^^^^^^^^^^^^^^^^^
TypeError: sklearn.linear_model._ridge.RidgeClassifier() got multiple values for keyword argument 'class_weight'
2026-05-18 21:35:09,525 - WARNING - Trial 7 failed with value None.
2026-05-18 21:35:09,526 - WARNING - Trial 0 failed with value None.
2026-05-18 21:35:09,527 - WARNING - Trial 11 failed with parameters: {'solver': 'cholesky', 'alpha': 0.1246323085116514, 'tol': 0.03616868991701115, 'fit_intercept': False, 'class_weight': 'balanced'} because of the following error: TypeError("sklearn.linear_model._ridge.RidgeClassifier() got multiple values for keyword argument 'class_weight'").
Traceback (most recent call last):
  File "/home/junior/Documentos/GitHub/prediction-f1-pit-stops-kaggle-competition/.venv/lib/python3.13/site-packages/optuna/study/_optimize.py", line 206, in _run_trial
    value_or_values = func(trial)
  File "/home/junior/Documentos/GitHub/prediction-f1-pit-stops-kaggle-competition/src/ridge_tuning.py", line 120, in <lambda>
    study.optimize(lambda trial: objective(trial, X_train, y_train), n_trials=30, n_jobs=-1, show_progress_bar=True)
                                 ~~~~~~~~~^^^^^^^^^^^^^^^^^^^^^^^^^
  File "/home/junior/Documentos/GitHub/prediction-f1-pit-stops-kaggle-competition/src/ridge_tuning.py", line 104, in objective
    model = make_pipeline(column_transformer, RidgeClassifier(**params, class_weight="balanced", random_state=42))
                                              ~~~~~~~~~~~~~~~^^^^^^^^^^^^^^^^^^^^^^^^^^^^^^^^^^^^^^^^^^^^^^^^^^^^
TypeError: sklearn.linear_model._ridge.RidgeClassifier() got multiple values for keyword argument 'class_weight'
2026-05-18 21:35:09,528 - WARNING - Trial 11 failed with value None.
2026-05-18 21:35:38,216 - INFO - ----- Fine Tuning -----
2026-05-18 21:35:38,216 - INFO - A new study created in memory with name: no-name-8c29e81c-a53d-41a6-982b-635d2d7b62f1
2026-05-18 21:36:23,899 - INFO - Trial 2 finished with value: 0.8823746668397996 and parameters: {'solver': 'auto', 'alpha': 0.038338304895024634, 'tol': 0.0002555051611813666, 'fit_intercept': True, 'class_weight': None}. Best is trial 2 with value: 0.8823746668397996.
2026-05-18 21:36:23,966 - INFO - Trial 8 finished with value: 0.774095088912324 and parameters: {'solver': 'lsqr', 'alpha': 0.05407967411986652, 'tol': 0.036473151898806684, 'fit_intercept': False, 'class_weight': None, 'max_iter': 500}. Best is trial 2 with value: 0.8823746668397996.
2026-05-18 21:36:24,026 - INFO - Trial 0 finished with value: 0.8878695064301066 and parameters: {'solver': 'auto', 'alpha': 0.008984854263343356, 'tol': 0.008485252591786287, 'fit_intercept': False, 'class_weight': 'balanced'}. Best is trial 0 with value: 0.8878695064301066.
2026-05-18 21:36:24,074 - INFO - Trial 4 finished with value: 0.8878124446220521 and parameters: {'solver': 'cholesky', 'alpha': 25.714686389151307, 'tol': 0.00612653188178018, 'fit_intercept': True, 'class_weight': 'balanced'}. Best is trial 0 with value: 0.8878695064301066.
2026-05-18 21:36:24,080 - INFO - Trial 7 finished with value: 0.7395483386599059 and parameters: {'solver': 'lsqr', 'alpha': 8.415914806770743e-05, 'tol': 0.07162856221195169, 'fit_intercept': True, 'class_weight': 'balanced', 'max_iter': 2500}. Best is trial 0 with value: 0.8878695064301066.
2026-05-18 21:36:24,085 - INFO - Trial 9 finished with value: 0.8878686624348328 and parameters: {'solver': 'cholesky', 'alpha': 1.07130376985463, 'tol': 0.03303204176776536, 'fit_intercept': False, 'class_weight': 'balanced'}. Best is trial 0 with value: 0.8878695064301066.
2026-05-18 21:36:24,148 - INFO - Trial 3 finished with value: 0.8879337470420644 and parameters: {'solver': 'auto', 'alpha': 0.042846934053319165, 'tol': 0.002012178015988554, 'fit_intercept': True, 'class_weight': 'balanced'}. Best is trial 3 with value: 0.8879337470420644.
2026-05-18 21:36:31,933 - INFO - Trial 10 pruned. 
2026-05-18 21:36:36,901 - INFO - Trial 6 pruned. 
2026-05-18 21:36:49,255 - INFO - Trial 17 pruned. 
2026-05-18 21:36:57,907 - INFO - Trial 19 pruned. 
2026-05-18 21:37:05,836 - INFO - Trial 12 finished with value: 0.8879825914448004 and parameters: {'solver': 'auto', 'alpha': 0.0002710223724844081, 'tol': 0.04684929149719355, 'fit_intercept': True, 'class_weight': 'balanced'}. Best is trial 12 with value: 0.8879825914448004.
2026-05-18 21:37:05,993 - INFO - Trial 18 finished with value: 0.8879844894957574 and parameters: {'solver': 'cholesky', 'alpha': 0.02632175036309405, 'tol': 0.02884409594774402, 'fit_intercept': False, 'class_weight': 'balanced'}. Best is trial 18 with value: 0.8879844894957574.
2026-05-18 21:37:12,089 - INFO - Trial 15 pruned. 
2026-05-18 21:37:19,223 - INFO - Trial 16 pruned. 
2026-05-18 21:37:23,432 - INFO - Trial 14 pruned. 
2026-05-18 21:37:25,315 - INFO - Trial 21 finished with value: 0.8880861768599859 and parameters: {'solver': 'auto', 'alpha': 1.2926809258095353, 'tol': 1.658877395640658e-05, 'fit_intercept': True, 'class_weight': 'balanced'}. Best is trial 21 with value: 0.8880861768599859.
2026-05-18 21:37:29,207 - INFO - Trial 22 finished with value: 0.8880518610387043 and parameters: {'solver': 'auto', 'alpha': 0.0032934313314624893, 'tol': 5.293814467049784e-05, 'fit_intercept': False, 'class_weight': 'balanced'}. Best is trial 21 with value: 0.8880861768599859.
2026-05-18 21:37:35,250 - INFO - Trial 23 finished with value: 0.88788370458388 and parameters: {'solver': 'auto', 'alpha': 0.0002640066342671658, 'tol': 1.0405943004096508e-05, 'fit_intercept': True, 'class_weight': 'balanced'}. Best is trial 21 with value: 0.8880861768599859.
2026-05-18 21:37:42,174 - INFO - Trial 27 finished with value: 0.887820856599159 and parameters: {'solver': 'auto', 'alpha': 0.0003954089756043867, 'tol': 0.0003253115188493496, 'fit_intercept': False, 'class_weight': 'balanced'}. Best is trial 21 with value: 0.8880861768599859.
