2026-05-18 21:37:44,751 - INFO - Trial 28 finished with value: 0.8880065256671335 and parameters: {'solver': 'cholesky', 'alpha': 0.6413808699315607, 'tol': 9.40095171076633e-05, 'fit_intercept': False, 'class_weight': 'balanced'}. Best is trial 21 with value: 0.8880861768599859.
2026-05-18 21:37:46,480 - INFO - Trial 29 finished with value: 0.8879986994612017 and parameters: {'solver': 'auto', 'alpha': 0.40904789545143694, 'tol': 9.068114662766747e-05, 'fit_intercept': False, 'class_weight': 'balanced'}. Best is trial 21 with value: 0.8880861768599859.
2026-05-18 21:38:15,748 - INFO - Trial 25 pruned. 
2026-05-18 21:38:19,532 - INFO - Trial 26 pruned. 
2026-05-18 21:40:19,469 - INFO - Trial 1 pruned. 
2026-05-18 21:43:56,730 - INFO - Trial 20 pruned. 
2026-05-18 21:46:48,913 - INFO - Trial 13 pruned. 
2026-05-18 21:49:42,216 - INFO - Trial 5 pruned. 
2026-05-18 21:55:33,709 - INFO - Trial 24 pruned. 
2026-05-18 22:07:48,782 - INFO - Trial 11 pruned. 
2026-05-18 22:07:48,787 - INFO - Best AUC: 0.8880861768599859 | Best params: {'solver': 'auto', 'alpha': 1.2926809258095353, 'tol': 1.658877395640658e-05, 'fit_intercept': True, 'class_weight': 'balanced'}
2026-05-18 22:07:48,787 - INFO - ----- Saving Pipeline -----
2026-05-19 10:18:26,114 - INFO - ----- Saving Pipeline -----
2026-05-19 10:40:03,022 - INFO - ----- Saving Pipeline -----
2026-05-19 10:40:24,963 - INFO - ----- Saving Pipeline -----
2026-05-19 10:40:52,040 - INFO - ----- Saving Pipeline -----
2026-05-19 10:42:09,429 - INFO - ----- Saving Pipeline -----
2026-05-19 12:33:14,574 - INFO - ----- Saving Pipeline -----
2026-05-19 12:33:26,471 - INFO - ----- Saving Pipeline -----
