2026-05-18 18:55:21,798 - INFO - Trial 10 finished with value: 0.8878166023479498 and parameters: {'alpha': 3.869726457583338, 'solver': 'cholesky', 'tol': 2.741912583854589e-05, 'fit_intercept': True, 'max_iter': 500, 'calibration_method': 'isotonic'}. Best is trial 10 with value: 0.8878166023479498.
2026-05-18 18:55:25,614 - INFO - Trial 5 finished with value: 0.8878351648041629 and parameters: {'alpha': 0.0001324143664934764, 'solver': 'auto', 'tol': 0.020109390563047506, 'fit_intercept': False, 'max_iter': 2500, 'calibration_method': 'sigmoid'}. Best is trial 5 with value: 0.8878351648041629.
2026-05-18 18:55:28,156 - INFO - Trial 4 finished with value: 0.8878350795175514 and parameters: {'alpha': 0.012662674550783765, 'solver': 'cholesky', 'tol': 3.847123776657924e-05, 'fit_intercept': False, 'max_iter': 3000, 'calibration_method': 'sigmoid'}. Best is trial 5 with value: 0.8878351648041629.
2026-05-18 18:56:18,201 - INFO - Trial 6 finished with value: 0.8866164496348409 and parameters: {'alpha': 0.0013087979141746973, 'solver': 'sparse_cg', 'tol': 0.012032836601684301, 'fit_intercept': True, 'max_iter': 5000, 'calibration_method': 'isotonic'}. Best is trial 5 with value: 0.8878351648041629.
2026-05-18 18:56:40,951 - INFO - Trial 11 finished with value: 0.8869294352744902 and parameters: {'alpha': 0.09201023854342416, 'solver': 'sparse_cg', 'tol': 0.005445940034703726, 'fit_intercept': False, 'max_iter': 1000, 'calibration_method': 'isotonic'}. Best is trial 5 with value: 0.8878351648041629.
2026-05-18 18:56:43,802 - INFO - Trial 9 finished with value: 0.8864980904155255 and parameters: {'alpha': 0.001919552183620336, 'solver': 'sparse_cg', 'tol': 0.012789091347933745, 'fit_intercept': False, 'max_iter': 3500, 'calibration_method': 'sigmoid'}. Best is trial 5 with value: 0.8878351648041629.
2026-05-18 18:56:44,820 - INFO - Trial 7 finished with value: 0.8878165523840954 and parameters: {'alpha': 0.06489105590125249, 'solver': 'svd', 'tol': 0.003527255002706486, 'fit_intercept': True, 'max_iter': 3500, 'calibration_method': 'isotonic'}. Best is trial 5 with value: 0.8878351648041629.
2026-05-18 18:57:09,724 - INFO - Trial 13 pruned. 
2026-05-18 18:58:23,231 - INFO - Trial 18 pruned. 
2026-05-18 18:58:50,304 - INFO - Trial 0 finished with value: 0.8878080184106025 and parameters: {'alpha': 0.02182730718224029, 'solver': 'sparse_cg', 'tol': 0.00025021626282844384, 'fit_intercept': True, 'max_iter': 2500, 'calibration_method': 'sigmoid'}. Best is trial 5 with value: 0.8878351648041629.
2026-05-18 18:59:11,789 - INFO - Trial 16 finished with value: 0.8878220420758225 and parameters: {'alpha': 3.2815009939905497, 'solver': 'cholesky', 'tol': 0.02691531879691059, 'fit_intercept': True, 'max_iter': 1000, 'calibration_method': 'isotonic'}. Best is trial 5 with value: 0.8878351648041629.
2026-05-18 18:59:22,087 - INFO - Trial 19 pruned. 
2026-05-18 18:59:24,975 - INFO - Trial 14 finished with value: 0.8869902200677167 and parameters: {'alpha': 0.00013638300116058808, 'solver': 'sparse_cg', 'tol': 0.003455886549595875, 'fit_intercept': True, 'max_iter': 5000, 'calibration_method': 'sigmoid'}. Best is trial 5 with value: 0.8878351648041629.
2026-05-18 19:00:01,068 - INFO - Trial 15 finished with value: 0.8878349920114974 and parameters: {'alpha': 0.04614789862148727, 'solver': 'svd', 'tol': 0.033930052621030854, 'fit_intercept': False, 'max_iter': 1000, 'calibration_method': 'sigmoid'}. Best is trial 5 with value: 0.8878351648041629.
2026-05-18 19:00:17,783 - INFO - Trial 2 finished with value: 0.8878127062905625 and parameters: {'alpha': 0.0012596005353157419, 'solver': 'sparse_cg', 'tol': 0.0001006357854669625, 'fit_intercept': False, 'max_iter': 2000, 'calibration_method': 'sigmoid'}. Best is trial 5 with value: 0.8878351648041629.
2026-05-18 19:00:52,459 - INFO - Trial 20 finished with value: 0.887566644474884 and parameters: {'alpha': 86.61375102580094, 'solver': 'cholesky', 'tol': 0.03602426268009495, 'fit_intercept': False, 'max_iter': 1000, 'calibration_method': 'sigmoid'}. Best is trial 5 with value: 0.8878351648041629.
2026-05-18 19:01:12,308 - INFO - Trial 21 finished with value: 0.8878334074308233 and parameters: {'alpha': 3.24008882226385e-05, 'solver': 'auto', 'tol': 0.0011463811692291961, 'fit_intercept': False, 'max_iter': 1500, 'calibration_method': 'sigmoid'}. Best is trial 5 with value: 0.8878351648041629.
2026-05-18 19:01:23,974 - INFO - Trial 22 finished with value: 0.8878356407460448 and parameters: {'alpha': 1.0125607195049596e-05, 'solver': 'auto', 'tol': 0.0003637435311349743, 'fit_intercept': False, 'max_iter': 3500, 'calibration_method': 'sigmoid'}. Best is trial 22 with value: 0.8878356407460448.
2026-05-18 19:01:35,299 - INFO - Trial 23 finished with value: 0.887834775527072 and parameters: {'alpha': 1.3972221907129424e-05, 'solver': 'auto', 'tol': 1.9949712886894104e-05, 'fit_intercept': False, 'max_iter': 2000, 'calibration_method': 'sigmoid'}. Best is trial 22 with value: 0.8878356407460448.
2026-05-18 19:01:35,368 - INFO - Trial 24 finished with value: 0.8878343376187816 and parameters: {'alpha': 2.1923309152527905e-05, 'solver': 'auto', 'tol': 1.4457788748001709e-05, 'fit_intercept': False, 'max_iter': 2000, 'calibration_method': 'sigmoid'}. Best is trial 22 with value: 0.8878356407460448.
2026-05-18 19:02:33,142 - INFO - ----- Fine Tuning -----
2026-05-18 19:02:33,142 - INFO - A new study created in memory with name: no-name-f9f73944-5606-406f-9c6b-f374902a34af
2026-05-18 19:02:39,338 - WARNING - Trial 7 failed with parameters: {'alpha': 0.6909193028852696, 'solver': 'lbfgs', 'tol': 6.143638272274603e-05, 'fit_intercept': True, 'max_iter': 4500, 'calibration_method': 'sigmoid'} because of the following error: ValueError("'lbfgs' solver can be used only when positive=True. Please use another solver.").
Traceback (most recent call last):
  File "/home/junior/Documentos/GitHub/prediction-f1-pit-stops-kaggle-competition/.venv/lib/python3.13/site-packages/optuna/study/_optimize.py", line 206, in _run_trial
    value_or_values = func(trial)
  File "/home/junior/Documentos/GitHub/prediction-f1-pit-stops-kaggle-competition/src/ridge_tuning.py", line 123, in <lambda>
    study.optimize(lambda trial: objective(trial, X_train, y_train), n_trials=50, n_jobs=-1, show_progress_bar=True)
                                 ~~~~~~~~~^^^^^^^^^^^^^^^^^^^^^^^^^
  File "/home/junior/Documentos/GitHub/prediction-f1-pit-stops-kaggle-competition/src/ridge_tuning.py", line 108, in objective
    ).fit(X_train, y_train)
      ~~~^^^^^^^^^^^^^^^^^^
  File "/home/junior/Documentos/GitHub/prediction-f1-pit-stops-kaggle-competition/.venv/lib/python3.13/site-packages/sklearn/base.py", line 1336, in wrapper
    return fit_method(estimator, *args, **kwargs)
  File "/home/junior/Documentos/GitHub/prediction-f1-pit-stops-kaggle-competition/.venv/lib/python3.13/site-packages/sklearn/calibration.py", line 438, in fit
    self.calibrated_classifiers_ = parallel(
                                   ~~~~~~~~^
        delayed(_fit_classifier_calibrator_pair)(
        ^^^^^^^^^^^^^^^^^^^^^^^^^^^^^^^^^^^^^^^^^
    ...<11 lines>...
        for train, test in cv.split(X, y, **routed_params.splitter.split)
        ^^^^^^^^^^^^^^^^^^^^^^^^^^^^^^^^^^^^^^^^^^^^^^^^^^^^^^^^^^^^^^^^^
    )
    ^
  File "/home/junior/Documentos/GitHub/prediction-f1-pit-stops-kaggle-competition/.venv/lib/python3.13/site-packages/sklearn/utils/parallel.py", line 91, in __call__
    return super().__call__(iterable_with_config_and_warning_filters)
           ~~~~~~~~~~~~~~~~^^^^^^^^^^^^^^^^^^^^^^^^^^^^^^^^^^^^^^^^^^
  File "/home/junior/Documentos/GitHub/prediction-f1-pit-stops-kaggle-competition/.venv/lib/python3.13/site-packages/joblib/parallel.py", line 1986, in __call__
    return output if self.return_generator else list(output)
                                                ~~~~^^^^^^^^
  File "/home/junior/Documentos/GitHub/prediction-f1-pit-stops-kaggle-competition/.venv/lib/python3.13/site-packages/joblib/parallel.py", line 1914, in _get_sequential_output
    res = func(*args, **kwargs)
  File "/home/junior/Documentos/GitHub/prediction-f1-pit-stops-kaggle-competition/.venv/lib/python3.13/site-packages/sklearn/utils/parallel.py", line 184, in __call__
    return self.function(*args, **kwargs)
           ~~~~~~~~~~~~~^^^^^^^^^^^^^^^^^
  File "/home/junior/Documentos/GitHub/prediction-f1-pit-stops-kaggle-competition/.venv/lib/python3.13/site-packages/sklearn/calibration.py", line 656, in _fit_classifier_calibrator_pair
    estimator.fit(X_train, y_train, **fit_params_train)
    ~~~~~~~~~~~~~^^^^^^^^^^^^^^^^^^^^^^^^^^^^^^^^^^^^^^
  File "/home/junior/Documentos/GitHub/prediction-f1-pit-stops-kaggle-competition/.venv/lib/python3.13/site-packages/sklearn/base.py", line 1336, in wrapper
    return fit_method(estimator, *args, **kwargs)
  File "/home/junior/Documentos/GitHub/prediction-f1-pit-stops-kaggle-competition/.venv/lib/python3.13/site-packages/sklearn/pipeline.py", line 621, in fit
    self._final_estimator.fit(Xt, y, **last_step_params["fit"])
    ~~~~~~~~~~~~~~~~~~~~~~~~~^^^^^^^^^^^^^^^^^^^^^^^^^^^^^^^^^^
  File "/home/junior/Documentos/GitHub/prediction-f1-pit-stops-kaggle-competition/.venv/lib/python3.13/site-packages/sklearn/base.py", line 1336, in wrapper
    return fit_method(estimator, *args, **kwargs)
  File "/home/junior/Documentos/GitHub/prediction-f1-pit-stops-kaggle-competition/.venv/lib/python3.13/site-packages/sklearn/linear_model/_ridge.py", line 1601, in fit
    super().fit(X, Y, sample_weight=sample_weight)
    ~~~~~~~~~~~^^^^^^^^^^^^^^^^^^^^^^^^^^^^^^^^^^^
  File "/home/junior/Documentos/GitHub/prediction-f1-pit-stops-kaggle-competition/.venv/lib/python3.13/site-packages/sklearn/linear_model/_ridge.py", line 929, in fit
    raise ValueError(
    ...<2 lines>...
    )
ValueError: 'lbfgs' solver can be used only when positive=True. Please use another solver.
2026-05-18 19:02:39,449 - WARNING - Trial 7 failed with value None.
2026-05-18 19:11:23,517 - INFO - ----- Fine Tuning -----
2026-05-18 19:11:23,517 - INFO - A new study created in memory with name: no-name-7d5954d2-e9e6-45ca-89ee-ce869ea659c5
2026-05-18 19:11:31,311 - WARNING - Trial 11 failed with parameters: {'alpha': 0.0014550888063321959, 'solver': 'lbfgs', 'tol': 0.0002872973380511859, 'fit_intercept': False, 'max_iter': 3000} because of the following error: ValueError("'lbfgs' solver can be used only when positive=True. Please use another solver.").
Traceback (most recent call last):
  File "/home/junior/Documentos/GitHub/prediction-f1-pit-stops-kaggle-competition/.venv/lib/python3.13/site-packages/optuna/study/_optimize.py", line 206, in _run_trial
    value_or_values = func(trial)
  File "/home/junior/Documentos/GitHub/prediction-f1-pit-stops-kaggle-competition/src/ridge_tuning.py", line 117, in <lambda>
    study.optimize(lambda trial: objective(trial, X_train, y_train), n_trials=50, n_jobs=-1, show_progress_bar=True)
                                 ~~~~~~~~~^^^^^^^^^^^^^^^^^^^^^^^^^
  File "/home/junior/Documentos/GitHub/prediction-f1-pit-stops-kaggle-competition/src/ridge_tuning.py", line 102, in objective
    ).fit(X_train, y_train)
      ~~~^^^^^^^^^^^^^^^^^^
  File "/home/junior/Documentos/GitHub/prediction-f1-pit-stops-kaggle-competition/.venv/lib/python3.13/site-packages/sklearn/base.py", line 1336, in wrapper
    return fit_method(estimator, *args, **kwargs)
  File "/home/junior/Documentos/GitHub/prediction-f1-pit-stops-kaggle-competition/.venv/lib/python3.13/site-packages/sklearn/pipeline.py", line 621, in fit
    self._final_estimator.fit(Xt, y, **last_step_params["fit"])
    ~~~~~~~~~~~~~~~~~~~~~~~~~^^^^^^^^^^^^^^^^^^^^^^^^^^^^^^^^^^
  File "/home/junior/Documentos/GitHub/prediction-f1-pit-stops-kaggle-competition/.venv/lib/python3.13/site-packages/sklearn/base.py", line 1336, in wrapper
    return fit_method(estimator, *args, **kwargs)
  File "/home/junior/Documentos/GitHub/prediction-f1-pit-stops-kaggle-competition/.venv/lib/python3.13/site-packages/sklearn/linear_model/_ridge.py", line 1601, in fit
    super().fit(X, Y, sample_weight=sample_weight)
    ~~~~~~~~~~~^^^^^^^^^^^^^^^^^^^^^^^^^^^^^^^^^^^
  File "/home/junior/Documentos/GitHub/prediction-f1-pit-stops-kaggle-competition/.venv/lib/python3.13/site-packages/sklearn/linear_model/_ridge.py", line 929, in fit
    raise ValueError(
    ...<2 lines>...
    )
ValueError: 'lbfgs' solver can be used only when positive=True. Please use another solver.
2026-05-18 19:11:31,356 - WARNING - Trial 11 failed with value None.
2026-05-18 19:11:31,362 - WARNING - Trial 1 failed with parameters: {'alpha': 0.0003282093985190827, 'solver': 'lbfgs', 'tol': 4.345971208362177e-05, 'fit_intercept': True, 'max_iter': 1000} because of the following error: ValueError("'lbfgs' solver can be used only when positive=True. Please use another solver.").
Traceback (most recent call last):
  File "/home/junior/Documentos/GitHub/prediction-f1-pit-stops-kaggle-competition/.venv/lib/python3.13/site-packages/optuna/study/_optimize.py", line 206, in _run_trial
    value_or_values = func(trial)
  File "/home/junior/Documentos/GitHub/prediction-f1-pit-stops-kaggle-competition/src/ridge_tuning.py", line 117, in <lambda>
    study.optimize(lambda trial: objective(trial, X_train, y_train), n_trials=50, n_jobs=-1, show_progress_bar=True)
                                 ~~~~~~~~~^^^^^^^^^^^^^^^^^^^^^^^^^
  File "/home/junior/Documentos/GitHub/prediction-f1-pit-stops-kaggle-competition/src/ridge_tuning.py", line 102, in objective
    ).fit(X_train, y_train)
      ~~~^^^^^^^^^^^^^^^^^^
  File "/home/junior/Documentos/GitHub/prediction-f1-pit-stops-kaggle-competition/.venv/lib/python3.13/site-packages/sklearn/base.py", line 1336, in wrapper
    return fit_method(estimator, *args, **kwargs)
  File "/home/junior/Documentos/GitHub/prediction-f1-pit-stops-kaggle-competition/.venv/lib/python3.13/site-packages/sklearn/pipeline.py", line 621, in fit
    self._final_estimator.fit(Xt, y, **last_step_params["fit"])
    ~~~~~~~~~~~~~~~~~~~~~~~~~^^^^^^^^^^^^^^^^^^^^^^^^^^^^^^^^^^
  File "/home/junior/Documentos/GitHub/prediction-f1-pit-stops-kaggle-competition/.venv/lib/python3.13/site-packages/sklearn/base.py", line 1336, in wrapper
    return fit_method(estimator, *args, **kwargs)
  File "/home/junior/Documentos/GitHub/prediction-f1-pit-stops-kaggle-competition/.venv/lib/python3.13/site-packages/sklearn/linear_model/_ridge.py", line 1601, in fit
    super().fit(X, Y, sample_weight=sample_weight)
    ~~~~~~~~~~~^^^^^^^^^^^^^^^^^^^^^^^^^^^^^^^^^^^
  File "/home/junior/Documentos/GitHub/prediction-f1-pit-stops-kaggle-competition/.venv/lib/python3.13/site-packages/sklearn/linear_model/_ridge.py", line 929, in fit
    raise ValueError(
    ...<2 lines>...
    )
ValueError: 'lbfgs' solver can be used only when positive=True. Please use another solver.
2026-05-18 19:11:31,374 - WARNING - Trial 1 failed with value None.
2026-05-18 19:12:07,828 - INFO - Trial 3 finished with value: 0.8878842991489249 and parameters: {'alpha': 9.926670861814036e-05, 'solver': 'cholesky', 'tol': 0.005214713276168711, 'fit_intercept': True, 'max_iter': 500}. Best is trial 3 with value: 0.8878842991489249.
2026-05-18 19:12:46,718 - INFO - Trial 9 finished with value: 0.8879023146740174 and parameters: {'alpha': 2.0711208416882396, 'solver': 'svd', 'tol': 8.506317057352965e-05, 'fit_intercept': True, 'max_iter': 4500}. Best is trial 9 with value: 0.8879023146740174.
2026-05-18 19:12:51,534 - INFO - Trial 8 finished with value: 0.8880800017314694 and parameters: {'alpha': 0.018846166599617607, 'solver': 'svd', 'tol': 0.06507741346418516, 'fit_intercept': True, 'max_iter': 4500}. Best is trial 8 with value: 0.8880800017314694.
2026-05-18 19:12:57,876 - INFO - Trial 4 finished with value: 0.8880698082846884 and parameters: {'alpha': 0.00018244658506585544, 'solver': 'svd', 'tol': 0.004250345185185366, 'fit_intercept': True, 'max_iter': 2500}. Best is trial 8 with value: 0.8880800017314694.
2026-05-18 19:13:13,528 - INFO - Trial 2 finished with value: 0.8879967187234776 and parameters: {'alpha': 0.0010367524645187288, 'solver': 'lsqr', 'tol': 1.143259090362447e-05, 'fit_intercept': True, 'max_iter': 3500}. Best is trial 8 with value: 0.8880800017314694.
2026-05-18 19:13:41,111 - INFO - Trial 5 finished with value: 0.8879547923055364 and parameters: {'alpha': 0.00041601828594407423, 'solver': 'sparse_cg', 'tol': 2.374448914165138e-05, 'fit_intercept': True, 'max_iter': 2000}. Best is trial 8 with value: 0.8880800017314694.
2026-05-18 19:15:23,692 - INFO - Trial 10 pruned. 
2026-05-18 19:15:31,569 - INFO - Trial 7 pruned. 
2026-05-18 19:17:16,681 - INFO - ----- Fine Tuning -----
2026-05-18 19:17:16,681 - INFO - A new study created in memory with name: no-name-70c975b6-50e7-4fd4-bbfb-7d9fafa146ec
2026-05-18 19:18:10,530 - INFO - Trial 10 finished with value: 0.8823805024277369 and parameters: {'solver': 'cholesky', 'alpha': 0.19136128726148055, 'tol': 0.0037294742929239707, 'fit_intercept': False, 'class_weight': None}. Best is trial 10 with value: 0.8823805024277369.
2026-05-18 19:18:11,275 - INFO - Trial 1 finished with value: 0.8823760327499848 and parameters: {'solver': 'cholesky', 'alpha': 0.029024164607423287, 'tol': 0.06670955946079361, 'fit_intercept': False, 'class_weight': None}. Best is trial 10 with value: 0.8823805024277369.
2026-05-18 19:18:11,342 - INFO - Trial 6 finished with value: 0.8823809829735234 and parameters: {'solver': 'auto', 'alpha': 0.00036818359232090365, 'tol': 4.243429105018954e-05, 'fit_intercept': True, 'class_weight': None}. Best is trial 6 with value: 0.8823809829735234.
2026-05-18 19:18:11,470 - INFO - Trial 7 finished with value: 0.8878696956078374 and parameters: {'solver': 'auto', 'alpha': 0.004763579713783934, 'tol': 0.052627733289294036, 'fit_intercept': False, 'class_weight': 'balanced'}. Best is trial 7 with value: 0.8878696956078374.
2026-05-18 19:18:11,513 - INFO - Trial 2 finished with value: 0.8824217912738014 and parameters: {'solver': 'auto', 'alpha': 0.00013262659731918142, 'tol': 0.0050817389605543415, 'fit_intercept': True, 'class_weight': None}. Best is trial 7 with value: 0.8878696956078374.
2026-05-18 19:18:11,514 - INFO - Trial 9 finished with value: 0.8823771957894339 and parameters: {'solver': 'cholesky', 'alpha': 2.8044246592769714e-05, 'tol': 0.0034188434923934103, 'fit_intercept': True, 'class_weight': None}. Best is trial 7 with value: 0.8878696956078374.
2026-05-18 19:18:11,814 - INFO - Trial 4 finished with value: 0.8879346264595039 and parameters: {'solver': 'cholesky', 'alpha': 0.0001266659400600067, 'tol': 0.016468907771053764, 'fit_intercept': False, 'class_weight': 'balanced'}. Best is trial 4 with value: 0.8879346264595039.
2026-05-18 19:18:12,177 - INFO - Trial 5 finished with value: 0.8879359569245568 and parameters: {'solver': 'auto', 'alpha': 0.00041710870240973836, 'tol': 1.0082757479695353e-05, 'fit_intercept': True, 'class_weight': 'balanced'}. Best is trial 5 with value: 0.8879359569245568.
2026-05-18 19:18:52,408 - INFO - Trial 12 pruned. 
2026-05-18 19:18:56,072 - INFO - Trial 8 finished with value: 0.8878918928268658 and parameters: {'solver': 'lsqr', 'alpha': 10.985160537390463, 'tol': 4.049291306675262e-05, 'fit_intercept': True, 'class_weight': 'balanced', 'max_iter': 5000}. Best is trial 5 with value: 0.8879359569245568.
2026-05-18 19:19:05,147 - INFO - Trial 14 finished with value: 0.8878180884038714 and parameters: {'solver': 'auto', 'alpha': 0.3729309406206613, 'tol': 0.011443838528909522, 'fit_intercept': False, 'class_weight': 'balanced'}. Best is trial 5 with value: 0.8879359569245568.
2026-05-18 19:19:05,252 - INFO - Trial 16 pruned. 
2026-05-18 19:19:05,458 - INFO - Trial 15 finished with value: 0.8878672767203746 and parameters: {'solver': 'cholesky', 'alpha': 6.196252802212333e-05, 'tol': 0.040762370834858376, 'fit_intercept': False, 'class_weight': 'balanced'}. Best is trial 5 with value: 0.8879359569245568.
2026-05-18 19:19:06,373 - INFO - Trial 13 finished with value: 0.8878068579688106 and parameters: {'solver': 'auto', 'alpha': 4.195805102392099, 'tol': 0.006177240527576731, 'fit_intercept': True, 'class_weight': 'balanced'}. Best is trial 5 with value: 0.8879359569245568.
2026-05-18 19:19:07,819 - INFO - Trial 19 finished with value: 0.8878612549099086 and parameters: {'solver': 'cholesky', 'alpha': 0.10439903159384095, 'tol': 0.00016950842344954262, 'fit_intercept': True, 'class_weight': 'balanced'}. Best is trial 5 with value: 0.8879359569245568.
2026-05-18 19:19:11,861 - INFO - Trial 3 pruned. 
2026-05-18 19:19:19,441 - INFO - Trial 20 finished with value: 0.8879058010933706 and parameters: {'solver': 'auto', 'alpha': 4.877252972973279, 'tol': 1.3196113344134092e-05, 'fit_intercept': True, 'class_weight': 'balanced'}. Best is trial 5 with value: 0.8879359569245568.
2026-05-18 19:21:41,490 - INFO - ----- Fine Tuning -----
2026-05-18 19:21:41,490 - INFO - A new study created in memory with name: no-name-b3bfa3e9-0353-4c34-bcad-fd6bf94cf0ad
2026-05-18 19:22:26,226 - INFO - Trial 8 finished with value: 0.8823344355188967 and parameters: {'solver': 'auto', 'alpha': 0.0005957654424830578, 'tol': 0.005914379430318779, 'fit_intercept': False, 'class_weight': None}. Best is trial 8 with value: 0.8823344355188967.
2026-05-18 19:22:26,298 - INFO - Trial 10 finished with value: 0.8823333112362652 and parameters: {'solver': 'cholesky', 'alpha': 0.6602218653222967, 'tol': 0.00341032507180805, 'fit_intercept': False, 'class_weight': None}. Best is trial 8 with value: 0.8823344355188967.
2026-05-18 19:22:26,436 - INFO - Trial 11 finished with value: 0.8823471930637469 and parameters: {'solver': 'auto', 'alpha': 5.479990415955302, 'tol': 0.0002705062166528303, 'fit_intercept': True, 'class_weight': None}. Best is trial 11 with value: 0.8823471930637469.
