2026-05-20 17:18:53,930 - INFO - ----- Model Tuning -----
2026-05-20 17:18:53,930 - INFO - A new study created in memory with name: no-name-fe161578-597f-4807-b152-e1c6e01f27d0
2026-05-20 17:18:54,780 - WARNING - Trial 1 failed with parameters: {} because of the following error: NameError("name 'TruncatedSVD' is not defined").
Traceback (most recent call last):
  File "/home/junior/Documentos/GitHub/prediction-f1-pit-stops-kaggle-competition/.venv/lib/python3.13/site-packages/optuna/study/_optimize.py", line 206, in _run_trial
    value_or_values = func(trial)
  File "/home/junior/Documentos/GitHub/prediction-f1-pit-stops-kaggle-competition/src/trucatedsvd_knn_tuning.py", line 130, in <lambda>
    study.optimize(lambda trial: objective(trial, X_train, y_train), n_trials=100, n_jobs=-1, show_progress_bar=True)
                                 ~~~~~~~~~^^^^^^^^^^^^^^^^^^^^^^^^^
  File "/home/junior/Documentos/GitHub/prediction-f1-pit-stops-kaggle-competition/src/trucatedsvd_knn_tuning.py", line 100, in objective
    TruncatedSVD(
    ^^^^^^^^^^^^
NameError: name 'TruncatedSVD' is not defined
2026-05-20 17:18:54,790 - WARNING - Trial 4 failed with parameters: {} because of the following error: NameError("name 'TruncatedSVD' is not defined").
Traceback (most recent call last):
  File "/home/junior/Documentos/GitHub/prediction-f1-pit-stops-kaggle-competition/.venv/lib/python3.13/site-packages/optuna/study/_optimize.py", line 206, in _run_trial
    value_or_values = func(trial)
  File "/home/junior/Documentos/GitHub/prediction-f1-pit-stops-kaggle-competition/src/trucatedsvd_knn_tuning.py", line 130, in <lambda>
    study.optimize(lambda trial: objective(trial, X_train, y_train), n_trials=100, n_jobs=-1, show_progress_bar=True)
                                 ~~~~~~~~~^^^^^^^^^^^^^^^^^^^^^^^^^
  File "/home/junior/Documentos/GitHub/prediction-f1-pit-stops-kaggle-competition/src/trucatedsvd_knn_tuning.py", line 100, in objective
    TruncatedSVD(
    ^^^^^^^^^^^^
NameError: name 'TruncatedSVD' is not defined
2026-05-20 17:18:54,810 - WARNING - Trial 1 failed with value None.
2026-05-20 17:18:54,813 - WARNING - Trial 4 failed with value None.
2026-05-20 17:18:54,820 - WARNING - Trial 5 failed with parameters: {} because of the following error: NameError("name 'TruncatedSVD' is not defined").
Traceback (most recent call last):
  File "/home/junior/Documentos/GitHub/prediction-f1-pit-stops-kaggle-competition/.venv/lib/python3.13/site-packages/optuna/study/_optimize.py", line 206, in _run_trial
    value_or_values = func(trial)
  File "/home/junior/Documentos/GitHub/prediction-f1-pit-stops-kaggle-competition/src/trucatedsvd_knn_tuning.py", line 130, in <lambda>
    study.optimize(lambda trial: objective(trial, X_train, y_train), n_trials=100, n_jobs=-1, show_progress_bar=True)
                                 ~~~~~~~~~^^^^^^^^^^^^^^^^^^^^^^^^^
  File "/home/junior/Documentos/GitHub/prediction-f1-pit-stops-kaggle-competition/src/trucatedsvd_knn_tuning.py", line 100, in objective
    TruncatedSVD(
    ^^^^^^^^^^^^
NameError: name 'TruncatedSVD' is not defined
2026-05-20 17:18:54,825 - WARNING - Trial 5 failed with value None.
2026-05-20 17:18:54,827 - WARNING - Trial 6 failed with parameters: {} because of the following error: NameError("name 'TruncatedSVD' is not defined").
Traceback (most recent call last):
  File "/home/junior/Documentos/GitHub/prediction-f1-pit-stops-kaggle-competition/.venv/lib/python3.13/site-packages/optuna/study/_optimize.py", line 206, in _run_trial
    value_or_values = func(trial)
  File "/home/junior/Documentos/GitHub/prediction-f1-pit-stops-kaggle-competition/src/trucatedsvd_knn_tuning.py", line 130, in <lambda>
    study.optimize(lambda trial: objective(trial, X_train, y_train), n_trials=100, n_jobs=-1, show_progress_bar=True)
                                 ~~~~~~~~~^^^^^^^^^^^^^^^^^^^^^^^^^
  File "/home/junior/Documentos/GitHub/prediction-f1-pit-stops-kaggle-competition/src/trucatedsvd_knn_tuning.py", line 100, in objective
    TruncatedSVD(
    ^^^^^^^^^^^^
NameError: name 'TruncatedSVD' is not defined
2026-05-20 17:18:54,829 - WARNING - Trial 9 failed with parameters: {} because of the following error: NameError("name 'TruncatedSVD' is not defined").
Traceback (most recent call last):
  File "/home/junior/Documentos/GitHub/prediction-f1-pit-stops-kaggle-competition/.venv/lib/python3.13/site-packages/optuna/study/_optimize.py", line 206, in _run_trial
    value_or_values = func(trial)
  File "/home/junior/Documentos/GitHub/prediction-f1-pit-stops-kaggle-competition/src/trucatedsvd_knn_tuning.py", line 130, in <lambda>
    study.optimize(lambda trial: objective(trial, X_train, y_train), n_trials=100, n_jobs=-1, show_progress_bar=True)
                                 ~~~~~~~~~^^^^^^^^^^^^^^^^^^^^^^^^^
  File "/home/junior/Documentos/GitHub/prediction-f1-pit-stops-kaggle-competition/src/trucatedsvd_knn_tuning.py", line 100, in objective
    TruncatedSVD(
    ^^^^^^^^^^^^
NameError: name 'TruncatedSVD' is not defined
2026-05-20 17:18:54,829 - WARNING - Trial 8 failed with parameters: {} because of the following error: NameError("name 'TruncatedSVD' is not defined").
Traceback (most recent call last):
  File "/home/junior/Documentos/GitHub/prediction-f1-pit-stops-kaggle-competition/.venv/lib/python3.13/site-packages/optuna/study/_optimize.py", line 206, in _run_trial
    value_or_values = func(trial)
  File "/home/junior/Documentos/GitHub/prediction-f1-pit-stops-kaggle-competition/src/trucatedsvd_knn_tuning.py", line 130, in <lambda>
    study.optimize(lambda trial: objective(trial, X_train, y_train), n_trials=100, n_jobs=-1, show_progress_bar=True)
                                 ~~~~~~~~~^^^^^^^^^^^^^^^^^^^^^^^^^
  File "/home/junior/Documentos/GitHub/prediction-f1-pit-stops-kaggle-competition/src/trucatedsvd_knn_tuning.py", line 100, in objective
    TruncatedSVD(
    ^^^^^^^^^^^^
NameError: name 'TruncatedSVD' is not defined
2026-05-20 17:18:54,830 - WARNING - Trial 3 failed with parameters: {} because of the following error: NameError("name 'TruncatedSVD' is not defined").
Traceback (most recent call last):
  File "/home/junior/Documentos/GitHub/prediction-f1-pit-stops-kaggle-competition/.venv/lib/python3.13/site-packages/optuna/study/_optimize.py", line 206, in _run_trial
    value_or_values = func(trial)
  File "/home/junior/Documentos/GitHub/prediction-f1-pit-stops-kaggle-competition/src/trucatedsvd_knn_tuning.py", line 130, in <lambda>
    study.optimize(lambda trial: objective(trial, X_train, y_train), n_trials=100, n_jobs=-1, show_progress_bar=True)
                                 ~~~~~~~~~^^^^^^^^^^^^^^^^^^^^^^^^^
  File "/home/junior/Documentos/GitHub/prediction-f1-pit-stops-kaggle-competition/src/trucatedsvd_knn_tuning.py", line 100, in objective
    TruncatedSVD(
    ^^^^^^^^^^^^
NameError: name 'TruncatedSVD' is not defined
2026-05-20 17:18:54,830 - WARNING - Trial 2 failed with parameters: {} because of the following error: NameError("name 'TruncatedSVD' is not defined").
Traceback (most recent call last):
  File "/home/junior/Documentos/GitHub/prediction-f1-pit-stops-kaggle-competition/.venv/lib/python3.13/site-packages/optuna/study/_optimize.py", line 206, in _run_trial
    value_or_values = func(trial)
  File "/home/junior/Documentos/GitHub/prediction-f1-pit-stops-kaggle-competition/src/trucatedsvd_knn_tuning.py", line 130, in <lambda>
    study.optimize(lambda trial: objective(trial, X_train, y_train), n_trials=100, n_jobs=-1, show_progress_bar=True)
                                 ~~~~~~~~~^^^^^^^^^^^^^^^^^^^^^^^^^
  File "/home/junior/Documentos/GitHub/prediction-f1-pit-stops-kaggle-competition/src/trucatedsvd_knn_tuning.py", line 100, in objective
    TruncatedSVD(
    ^^^^^^^^^^^^
NameError: name 'TruncatedSVD' is not defined
2026-05-20 17:18:54,831 - WARNING - Trial 6 failed with value None.
2026-05-20 17:18:54,832 - WARNING - Trial 9 failed with value None.
2026-05-20 17:18:54,833 - WARNING - Trial 7 failed with parameters: {} because of the following error: NameError("name 'TruncatedSVD' is not defined").
Traceback (most recent call last):
  File "/home/junior/Documentos/GitHub/prediction-f1-pit-stops-kaggle-competition/.venv/lib/python3.13/site-packages/optuna/study/_optimize.py", line 206, in _run_trial
    value_or_values = func(trial)
  File "/home/junior/Documentos/GitHub/prediction-f1-pit-stops-kaggle-competition/src/trucatedsvd_knn_tuning.py", line 130, in <lambda>
    study.optimize(lambda trial: objective(trial, X_train, y_train), n_trials=100, n_jobs=-1, show_progress_bar=True)
                                 ~~~~~~~~~^^^^^^^^^^^^^^^^^^^^^^^^^
  File "/home/junior/Documentos/GitHub/prediction-f1-pit-stops-kaggle-competition/src/trucatedsvd_knn_tuning.py", line 100, in objective
    TruncatedSVD(
    ^^^^^^^^^^^^
NameError: name 'TruncatedSVD' is not defined
2026-05-20 17:18:54,834 - WARNING - Trial 8 failed with value None.
2026-05-20 17:18:54,834 - WARNING - Trial 3 failed with value None.
2026-05-20 17:18:54,835 - WARNING - Trial 2 failed with value None.
2026-05-20 17:18:54,836 - WARNING - Trial 11 failed with parameters: {} because of the following error: NameError("name 'TruncatedSVD' is not defined").
Traceback (most recent call last):
  File "/home/junior/Documentos/GitHub/prediction-f1-pit-stops-kaggle-competition/.venv/lib/python3.13/site-packages/optuna/study/_optimize.py", line 206, in _run_trial
    value_or_values = func(trial)
  File "/home/junior/Documentos/GitHub/prediction-f1-pit-stops-kaggle-competition/src/trucatedsvd_knn_tuning.py", line 130, in <lambda>
    study.optimize(lambda trial: objective(trial, X_train, y_train), n_trials=100, n_jobs=-1, show_progress_bar=True)
                                 ~~~~~~~~~^^^^^^^^^^^^^^^^^^^^^^^^^
  File "/home/junior/Documentos/GitHub/prediction-f1-pit-stops-kaggle-competition/src/trucatedsvd_knn_tuning.py", line 100, in objective
    TruncatedSVD(
    ^^^^^^^^^^^^
NameError: name 'TruncatedSVD' is not defined
2026-05-20 17:18:54,836 - WARNING - Trial 7 failed with value None.
2026-05-20 17:18:54,837 - WARNING - Trial 10 failed with parameters: {} because of the following error: NameError("name 'TruncatedSVD' is not defined").
Traceback (most recent call last):
  File "/home/junior/Documentos/GitHub/prediction-f1-pit-stops-kaggle-competition/.venv/lib/python3.13/site-packages/optuna/study/_optimize.py", line 206, in _run_trial
    value_or_values = func(trial)
  File "/home/junior/Documentos/GitHub/prediction-f1-pit-stops-kaggle-competition/src/trucatedsvd_knn_tuning.py", line 130, in <lambda>
    study.optimize(lambda trial: objective(trial, X_train, y_train), n_trials=100, n_jobs=-1, show_progress_bar=True)
                                 ~~~~~~~~~^^^^^^^^^^^^^^^^^^^^^^^^^
  File "/home/junior/Documentos/GitHub/prediction-f1-pit-stops-kaggle-competition/src/trucatedsvd_knn_tuning.py", line 100, in objective
    TruncatedSVD(
    ^^^^^^^^^^^^
NameError: name 'TruncatedSVD' is not defined
2026-05-20 17:18:54,838 - WARNING - Trial 11 failed with value None.
2026-05-20 17:18:54,839 - WARNING - Trial 10 failed with value None.
2026-05-20 17:18:54,839 - WARNING - Trial 0 failed with parameters: {} because of the following error: NameError("name 'TruncatedSVD' is not defined").
Traceback (most recent call last):
  File "/home/junior/Documentos/GitHub/prediction-f1-pit-stops-kaggle-competition/.venv/lib/python3.13/site-packages/optuna/study/_optimize.py", line 206, in _run_trial
    value_or_values = func(trial)
  File "/home/junior/Documentos/GitHub/prediction-f1-pit-stops-kaggle-competition/src/trucatedsvd_knn_tuning.py", line 130, in <lambda>
    study.optimize(lambda trial: objective(trial, X_train, y_train), n_trials=100, n_jobs=-1, show_progress_bar=True)
                                 ~~~~~~~~~^^^^^^^^^^^^^^^^^^^^^^^^^
  File "/home/junior/Documentos/GitHub/prediction-f1-pit-stops-kaggle-competition/src/trucatedsvd_knn_tuning.py", line 100, in objective
    TruncatedSVD(
    ^^^^^^^^^^^^
NameError: name 'TruncatedSVD' is not defined
2026-05-20 17:18:54,840 - WARNING - Trial 0 failed with value None.
2026-05-20 17:19:21,112 - INFO - ----- Model Tuning -----
2026-05-20 17:19:21,113 - INFO - A new study created in memory with name: no-name-d28b07e9-80d3-4ddc-af8f-77e6897a7d94
2026-05-20 17:20:47,823 - INFO - ----- Model Tuning -----
2026-05-20 17:20:47,823 - INFO - A new study created in memory with name: no-name-876a641b-08ea-4a48-a6f7-fe305f5eb44b
2026-05-20 17:23:37,574 - INFO - Trial 4 finished with value: 0.721569409505637 and parameters: {'n_components': 3, 'algorithm': 'randomized', 'n_iter': 8, 'power_iteration_normalizer': 'auto', 'tol': 5.039240963227865e-05, 'n_neighbors': 5, 'weights': 'distance', 'metric': 'minkowski', 'p': 2, 'leaf_size': 90}. Best is trial 4 with value: 0.721569409505637.
2026-05-20 17:32:44,868 - INFO - Trial 10 finished with value: 0.8225935757441644 and parameters: {'n_components': 6, 'algorithm': 'randomized', 'n_iter': 7, 'power_iteration_normalizer': 'LU', 'tol': 0.0007870737653867851, 'n_neighbors': 9, 'weights': 'uniform', 'metric': 'euclidean', 'p': 1, 'leaf_size': 97}. Best is trial 10 with value: 0.8225935757441644.
2026-05-20 17:37:35,712 - INFO - Trial 0 finished with value: 0.9020320799591086 and parameters: {'n_components': 20, 'algorithm': 'randomized', 'n_iter': 8, 'power_iteration_normalizer': 'auto', 'tol': 1.4996154543695935e-05, 'n_neighbors': 9, 'weights': 'distance', 'metric': 'euclidean', 'p': 2, 'leaf_size': 100}. Best is trial 0 with value: 0.9020320799591086.
2026-05-20 17:40:14,244 - INFO - Trial 6 finished with value: 0.8945862968623279 and parameters: {'n_components': 40, 'algorithm': 'randomized', 'n_iter': 6, 'power_iteration_normalizer': 'LU', 'tol': 0.00165263965542511, 'n_neighbors': 6, 'weights': 'distance', 'metric': 'euclidean', 'p': 1, 'leaf_size': 96}. Best is trial 0 with value: 0.9020320799591086.
2026-05-20 17:42:17,211 - INFO - Trial 5 finished with value: 0.8925417041441618 and parameters: {'n_components': 50, 'algorithm': 'randomized', 'n_iter': 9, 'power_iteration_normalizer': 'OR', 'tol': 0.00969248101072019, 'n_neighbors': 6, 'weights': 'distance', 'metric': 'euclidean', 'p': 1, 'leaf_size': 96}. Best is trial 0 with value: 0.9020320799591086.
2026-05-20 17:43:01,852 - INFO - Trial 8 pruned. 
2026-05-20 17:48:31,048 - INFO - Trial 1 pruned. 
2026-05-20 17:51:01,667 - INFO - Trial 14 pruned. 
2026-05-20 17:55:16,462 - INFO - Trial 9 pruned. 
2026-05-20 18:00:50,902 - INFO - Trial 18 pruned. 
2026-05-20 18:02:30,685 - INFO - Trial 2 pruned. 
2026-05-20 18:04:44,949 - INFO - Trial 7 pruned. 
2026-05-20 18:12:27,724 - INFO - Trial 20 pruned. 
2026-05-20 18:16:27,210 - INFO - Trial 22 finished with value: 0.9049537053264325 and parameters: {'n_components': 24, 'algorithm': 'randomized', 'n_iter': 3, 'power_iteration_normalizer': 'OR', 'tol': 4.0635557219335745e-06, 'n_neighbors': 10, 'weights': 'uniform', 'metric': 'minkowski', 'p': 2, 'leaf_size': 12}. Best is trial 22 with value: 0.9049537053264325.
2026-05-20 18:18:57,034 - INFO - Trial 23 finished with value: 0.90434888403982 and parameters: {'n_components': 20, 'algorithm': 'randomized', 'n_iter': 4, 'power_iteration_normalizer': 'OR', 'tol': 4.280603530245439e-06, 'n_neighbors': 10, 'weights': 'distance', 'metric': 'minkowski', 'p': 2, 'leaf_size': 75}. Best is trial 22 with value: 0.9049537053264325.
2026-05-20 18:21:45,193 - INFO - Trial 13 finished with value: 0.9078548915006 and parameters: {'n_components': 22, 'algorithm': 'randomized', 'n_iter': 3, 'power_iteration_normalizer': 'LU', 'tol': 0.000502450719028915, 'n_neighbors': 10, 'weights': 'distance', 'metric': 'manhattan', 'p': 1, 'leaf_size': 99}. Best is trial 13 with value: 0.9078548915006.
2026-05-20 18:27:11,199 - INFO - Trial 24 finished with value: 0.9052292902150733 and parameters: {'n_components': 22, 'algorithm': 'randomized', 'n_iter': 4, 'power_iteration_normalizer': 'LU', 'tol': 4.74281268597509e-06, 'n_neighbors': 10, 'weights': 'distance', 'metric': 'minkowski', 'p': 2, 'leaf_size': 44}. Best is trial 13 with value: 0.9078548915006.
2026-05-20 18:30:04,639 - INFO - Trial 25 finished with value: 0.9030062911098684 and parameters: {'n_components': 20, 'algorithm': 'randomized', 'n_iter': 3, 'power_iteration_normalizer': 'OR', 'tol': 2.6099495585432287e-06, 'n_neighbors': 10, 'weights': 'uniform', 'metric': 'minkowski', 'p': 2, 'leaf_size': 40}. Best is trial 13 with value: 0.9078548915006.
2026-05-20 18:34:17,636 - INFO - Trial 19 pruned. 
2026-05-20 18:40:59,112 - INFO - Trial 16 finished with value: 0.902877016599153 and parameters: {'n_components': 28, 'algorithm': 'randomized', 'n_iter': 11, 'power_iteration_normalizer': 'OR', 'tol': 2.234218684304636e-05, 'n_neighbors': 10, 'weights': 'uniform', 'metric': 'manhattan', 'p': 1, 'leaf_size': 69}. Best is trial 13 with value: 0.9078548915006.
2026-05-20 18:41:37,224 - INFO - Trial 26 finished with value: 0.9081308240445815 and parameters: {'n_components': 73, 'algorithm': 'randomized', 'n_iter': 3, 'power_iteration_normalizer': 'OR', 'tol': 1.9219546772314105e-06, 'n_neighbors': 10, 'weights': 'uniform', 'metric': 'minkowski', 'p': 2, 'leaf_size': 43}. Best is trial 26 with value: 0.9081308240445815.
2026-05-20 18:43:57,003 - INFO - Trial 27 finished with value: 0.9079162849744481 and parameters: {'n_components': 75, 'algorithm': 'randomized', 'n_iter': 3, 'power_iteration_normalizer': 'OR', 'tol': 0.00018142537241081392, 'n_neighbors': 10, 'weights': 'uniform', 'metric': 'minkowski', 'p': 2, 'leaf_size': 42}. Best is trial 26 with value: 0.9081308240445815.
2026-05-20 18:45:32,663 - INFO - Trial 21 finished with value: 0.905940083181864 and parameters: {'n_components': 20, 'algorithm': 'randomized', 'n_iter': 3, 'power_iteration_normalizer': 'OR', 'tol': 2.004386130305251e-06, 'n_neighbors': 10, 'weights': 'uniform', 'metric': 'manhattan', 'p': 2, 'leaf_size': 17}. Best is trial 26 with value: 0.9081308240445815.
2026-05-20 18:50:32,431 - INFO - Trial 11 finished with value: 0.906347174301296 and parameters: {'n_components': 52, 'algorithm': 'randomized', 'n_iter': 12, 'power_iteration_normalizer': 'LU', 'tol': 0.00018003006653526858, 'n_neighbors': 7, 'weights': 'distance', 'metric': 'minkowski', 'p': 1, 'leaf_size': 98}. Best is trial 26 with value: 0.9081308240445815.
2026-05-20 18:59:03,999 - INFO - Trial 3 finished with value: 0.9111399758749241 and parameters: {'n_components': 63, 'algorithm': 'randomized', 'n_iter': 7, 'power_iteration_normalizer': 'LU', 'tol': 6.441887011440221e-06, 'n_neighbors': 9, 'weights': 'distance', 'metric': 'minkowski', 'p': 1, 'leaf_size': 39}. Best is trial 3 with value: 0.9111399758749241.
2026-05-20 19:03:18,519 - INFO - Trial 17 finished with value: 0.908016532397155 and parameters: {'n_components': 55, 'algorithm': 'randomized', 'n_iter': 6, 'power_iteration_normalizer': 'OR', 'tol': 0.0012131476560625848, 'n_neighbors': 9, 'weights': 'uniform', 'metric': 'manhattan', 'p': 2, 'leaf_size': 86}. Best is trial 3 with value: 0.9111399758749241.
2026-05-20 19:04:14,774 - INFO - Trial 12 finished with value: 0.9065136906272908 and parameters: {'n_components': 68, 'algorithm': 'randomized', 'n_iter': 9, 'power_iteration_normalizer': 'LU', 'tol': 1.5547384075847107e-05, 'n_neighbors': 8, 'weights': 'uniform', 'metric': 'manhattan', 'p': 1, 'leaf_size': 16}. Best is trial 3 with value: 0.9111399758749241.
2026-05-20 19:05:12,483 - INFO - Trial 15 pruned. 
2026-05-20 19:05:28,703 - INFO - Trial 29 finished with value: 0.9031636048638682 and parameters: {'n_components': 31, 'algorithm': 'randomized', 'n_iter': 5, 'power_iteration_normalizer': 'LU', 'tol': 0.00017370051988519072, 'n_neighbors': 8, 'weights': 'distance', 'metric': 'manhattan', 'p': 2, 'leaf_size': 48}. Best is trial 3 with value: 0.9111399758749241.
2026-05-20 19:13:33,055 - INFO - Trial 28 finished with value: 0.9072900143448258 and parameters: {'n_components': 69, 'algorithm': 'randomized', 'n_iter': 5, 'power_iteration_normalizer': 'LU', 'tol': 0.00025480535614836664, 'n_neighbors': 8, 'weights': 'distance', 'metric': 'manhattan', 'p': 2, 'leaf_size': 40}. Best is trial 3 with value: 0.9111399758749241.
2026-05-20 19:13:33,060 - INFO - Best AUC: 0.9111399758749241 | Best params: {'n_components': 63, 'algorithm': 'randomized', 'n_iter': 7, 'power_iteration_normalizer': 'LU', 'tol': 6.441887011440221e-06, 'n_neighbors': 9, 'weights': 'distance', 'metric': 'minkowski', 'p': 1, 'leaf_size': 39}
2026-05-20 19:13:33,061 - INFO - ----- Saving Pipeline -----
2026-05-20 23:02:23,012 - INFO - ----- Saving Pipeline -----
2026-05-20 23:02:57,928 - INFO - ----- Saving Pipeline -----
2026-05-20 23:03:10,776 - INFO - ----- Saving Pipeline -----
