2026-05-20 20:12:37,951 - INFO - Trial 25 finished with value: 0.8883182313760992 and parameters: {'solver': 'sag', 'alpha': 0.0012590930780247856, 'tol': 8.804610287179953e-05, 'fit_intercept': False, 'class_weight': 'balanced', 'max_iter': 1000, 'n_components': 75, 'algorithm': 'randomized', 'n_iter': 7, 'power_iteration_normalizer': 'LU', 'truncsvd_tol': 3.2634825986870737e-06}. Best is trial 25 with value: 0.8883182313760992.
2026-05-20 20:14:50,628 - INFO - Trial 32 finished with value: 0.8882246658219739 and parameters: {'solver': 'sag', 'alpha': 0.00017213104908397021, 'tol': 0.00016438941264615084, 'fit_intercept': False, 'class_weight': 'balanced', 'max_iter': 1000, 'n_components': 74, 'algorithm': 'randomized', 'n_iter': 5, 'power_iteration_normalizer': 'LU', 'truncsvd_tol': 3.0943167689864978e-06}. Best is trial 25 with value: 0.8883182313760992.
2026-05-20 20:15:14,393 - INFO - Trial 55 finished with value: 0.8880917392019725 and parameters: {'solver': 'sag', 'alpha': 0.029952657092676076, 'tol': 0.00033427819651958747, 'fit_intercept': False, 'class_weight': 'balanced', 'max_iter': 500, 'n_components': 60, 'algorithm': 'randomized', 'n_iter': 6, 'power_iteration_normalizer': 'LU', 'truncsvd_tol': 1.9889746689306948e-06}. Best is trial 25 with value: 0.8883182313760992.
2026-05-20 20:22:39,817 - INFO - Trial 58 finished with value: 0.8880119915022545 and parameters: {'solver': 'sag', 'alpha': 0.0011145714422319472, 'tol': 0.00034403174877399096, 'fit_intercept': False, 'class_weight': 'balanced', 'max_iter': 500, 'n_components': 59, 'algorithm': 'randomized', 'n_iter': 9, 'power_iteration_normalizer': 'auto', 'truncsvd_tol': 2.750281973005124e-05}. Best is trial 25 with value: 0.8883182313760992.
2026-05-20 20:23:44,066 - INFO - Trial 69 finished with value: 0.888007852700049 and parameters: {'solver': 'auto', 'alpha': 0.001167408291314108, 'tol': 2.0751919386158213e-05, 'fit_intercept': False, 'class_weight': 'balanced', 'n_components': 71, 'algorithm': 'randomized', 'n_iter': 3, 'power_iteration_normalizer': 'LU', 'truncsvd_tol': 1.522672368468116e-05}. Best is trial 25 with value: 0.8883182313760992.
2026-05-20 20:26:45,214 - INFO - Trial 59 finished with value: 0.8881091124133415 and parameters: {'solver': 'sag', 'alpha': 0.00041085385404169775, 'tol': 2.2444657447740038e-05, 'fit_intercept': False, 'class_weight': 'balanced', 'max_iter': 500, 'n_components': 59, 'algorithm': 'randomized', 'n_iter': 15, 'power_iteration_normalizer': 'auto', 'truncsvd_tol': 2.083383283131301e-05}. Best is trial 25 with value: 0.8883182313760992.
2026-05-20 20:26:46,337 - INFO - Trial 60 finished with value: 0.8881181000913312 and parameters: {'solver': 'sag', 'alpha': 0.0011213505376542177, 'tol': 0.0006629077719882097, 'fit_intercept': False, 'class_weight': 'balanced', 'max_iter': 500, 'n_components': 59, 'algorithm': 'randomized', 'n_iter': 3, 'power_iteration_normalizer': 'auto', 'truncsvd_tol': 2.434078513457213e-05}. Best is trial 25 with value: 0.8883182313760992.
2026-05-20 20:28:45,506 - INFO - Trial 62 finished with value: 0.8881383153421505 and parameters: {'solver': 'sag', 'alpha': 0.0011180212785041885, 'tol': 4.086543393979779e-05, 'fit_intercept': False, 'class_weight': 'balanced', 'max_iter': 500, 'n_components': 71, 'algorithm': 'randomized', 'n_iter': 3, 'power_iteration_normalizer': 'auto', 'truncsvd_tol': 7.293177030458724e-06}. Best is trial 25 with value: 0.8883182313760992.
2026-05-20 20:29:14,255 - INFO - Trial 66 pruned. 
2026-05-20 20:29:15,915 - INFO - Trial 63 finished with value: 0.8881416162249822 and parameters: {'solver': 'sag', 'alpha': 0.0009866022021404824, 'tol': 3.692180498943808e-05, 'fit_intercept': False, 'class_weight': 'balanced', 'max_iter': 500, 'n_components': 71, 'algorithm': 'randomized', 'n_iter': 4, 'power_iteration_normalizer': 'LU', 'truncsvd_tol': 6.410772383275297e-06}. Best is trial 25 with value: 0.8883182313760992.
2026-05-20 20:32:05,013 - INFO - Trial 67 finished with value: 0.888062832571044 and parameters: {'solver': 'sag', 'alpha': 0.001139758667812546, 'tol': 3.654390656143184e-05, 'fit_intercept': False, 'class_weight': 'balanced', 'max_iter': 500, 'n_components': 54, 'algorithm': 'randomized', 'n_iter': 3, 'power_iteration_normalizer': 'auto', 'truncsvd_tol': 1.3145691424616535e-05}. Best is trial 25 with value: 0.8883182313760992.
2026-05-20 20:32:38,492 - INFO - Trial 76 pruned. 
2026-05-20 20:35:31,585 - INFO - Trial 50 finished with value: 0.8879500224511991 and parameters: {'solver': 'sag', 'alpha': 0.23677124556366386, 'tol': 0.00017777480977319886, 'fit_intercept': False, 'class_weight': 'balanced', 'max_iter': 1500, 'n_components': 59, 'algorithm': 'randomized', 'n_iter': 6, 'power_iteration_normalizer': 'OR', 'truncsvd_tol': 1.838492788095051e-06}. Best is trial 25 with value: 0.8883182313760992.
2026-05-20 20:41:20,287 - INFO - Trial 73 pruned. 
2026-05-20 20:48:01,429 - INFO - Trial 75 pruned. 
2026-05-20 20:49:52,359 - INFO - Trial 80 finished with value: 0.8880282029762434 and parameters: {'solver': 'auto', 'alpha': 0.000323415947866604, 'tol': 1.1385670922780684e-05, 'fit_intercept': True, 'class_weight': 'balanced', 'n_components': 72, 'algorithm': 'randomized', 'n_iter': 10, 'power_iteration_normalizer': 'LU', 'truncsvd_tol': 0.004592986057855876}. Best is trial 25 with value: 0.8883182313760992.
2026-05-20 20:53:33,231 - INFO - Trial 74 finished with value: 0.8880755965710533 and parameters: {'solver': 'sag', 'alpha': 3.1797899785198824e-05, 'tol': 3.348242230802122e-05, 'fit_intercept': False, 'class_weight': 'balanced', 'max_iter': 1000, 'n_components': 69, 'algorithm': 'randomized', 'n_iter': 4, 'power_iteration_normalizer': 'auto', 'truncsvd_tol': 1.155408590812935e-05}. Best is trial 25 with value: 0.8883182313760992.
2026-05-20 20:55:15,075 - INFO - Trial 57 finished with value: 0.8881243856241721 and parameters: {'solver': 'sag', 'alpha': 0.004796518893117614, 'tol': 0.0004394132147443587, 'fit_intercept': False, 'class_weight': 'balanced', 'max_iter': 2000, 'n_components': 60, 'algorithm': 'randomized', 'n_iter': 9, 'power_iteration_normalizer': 'LU', 'truncsvd_tol': 2.5220520004792538e-05}. Best is trial 25 with value: 0.8883182313760992.
2026-05-20 20:57:57,444 - INFO - Trial 72 finished with value: 0.8882056232225635 and parameters: {'solver': 'sag', 'alpha': 3.476259578291812e-05, 'tol': 4.3777601282524284e-05, 'fit_intercept': False, 'class_weight': 'balanced', 'max_iter': 1000, 'n_components': 72, 'algorithm': 'randomized', 'n_iter': 4, 'power_iteration_normalizer': 'LU', 'truncsvd_tol': 0.002093048463001416}. Best is trial 25 with value: 0.8883182313760992.
2026-05-20 21:12:19,475 - INFO - Trial 65 finished with value: 0.8882245339285658 and parameters: {'solver': 'sag', 'alpha': 0.0010706946758999383, 'tol': 2.4242113839947993e-05, 'fit_intercept': False, 'class_weight': 'balanced', 'max_iter': 2000, 'n_components': 70, 'algorithm': 'randomized', 'n_iter': 3, 'power_iteration_normalizer': 'LU', 'truncsvd_tol': 1.4424545008952078e-05}. Best is trial 25 with value: 0.8883182313760992.
2026-05-20 21:16:36,244 - INFO - Trial 64 finished with value: 0.8880495257275804 and parameters: {'solver': 'sag', 'alpha': 0.0009062815962829094, 'tol': 3.568984168430818e-05, 'fit_intercept': False, 'class_weight': 'balanced', 'max_iter': 2000, 'n_components': 55, 'algorithm': 'randomized', 'n_iter': 15, 'power_iteration_normalizer': 'LU', 'truncsvd_tol': 6.156169753363196e-06}. Best is trial 25 with value: 0.8883182313760992.
2026-05-20 21:18:06,156 - INFO - Trial 86 finished with value: 0.8879716496177986 and parameters: {'solver': 'lsqr', 'alpha': 0.0021359043380915635, 'tol': 5.2968185443235534e-05, 'fit_intercept': False, 'class_weight': 'balanced', 'max_iter': 2500, 'n_components': 73, 'algorithm': 'randomized', 'n_iter': 5, 'power_iteration_normalizer': 'LU', 'truncsvd_tol': 0.0006183626116551434}. Best is trial 25 with value: 0.8883182313760992.
2026-05-20 21:19:40,253 - INFO - Trial 68 finished with value: 0.8880214735212817 and parameters: {'solver': 'sag', 'alpha': 0.0011871221836522391, 'tol': 3.5696362932092235e-05, 'fit_intercept': False, 'class_weight': 'balanced', 'max_iter': 2000, 'n_components': 54, 'algorithm': 'randomized', 'n_iter': 3, 'power_iteration_normalizer': 'auto', 'truncsvd_tol': 0.004104161074916758}. Best is trial 25 with value: 0.8883182313760992.
2026-05-20 21:27:26,333 - INFO - Trial 70 finished with value: 0.8875101929953504 and parameters: {'solver': 'sag', 'alpha': 4.0976907263255085e-05, 'tol': 4.114628268158447e-05, 'fit_intercept': False, 'class_weight': 'balanced', 'max_iter': 2000, 'n_components': 53, 'algorithm': 'randomized', 'n_iter': 4, 'power_iteration_normalizer': 'LU', 'truncsvd_tol': 0.004406773667419282}. Best is trial 25 with value: 0.8883182313760992.
2026-05-20 21:30:01,223 - INFO - Trial 71 finished with value: 0.887969792499233 and parameters: {'solver': 'sag', 'alpha': 3.8200094262586174e-05, 'tol': 4.412008514970057e-05, 'fit_intercept': False, 'class_weight': 'balanced', 'max_iter': 2000, 'n_components': 55, 'algorithm': 'randomized', 'n_iter': 4, 'power_iteration_normalizer': 'LU', 'truncsvd_tol': 0.002990942216132977}. Best is trial 25 with value: 0.8883182313760992.
2026-05-20 21:32:30,363 - INFO - Trial 84 finished with value: 0.8879364884653731 and parameters: {'solver': 'sag', 'alpha': 8.397543672402417e-05, 'tol': 5.58904814878474e-05, 'fit_intercept': False, 'class_weight': 'balanced', 'max_iter': 1000, 'n_components': 64, 'algorithm': 'randomized', 'n_iter': 5, 'power_iteration_normalizer': 'LU', 'truncsvd_tol': 0.0017597256834549098}. Best is trial 25 with value: 0.8883182313760992.
2026-05-20 21:36:27,933 - INFO - Trial 82 finished with value: 0.8882175847851936 and parameters: {'solver': 'sag', 'alpha': 0.002148732817400743, 'tol': 5.210534706952775e-05, 'fit_intercept': False, 'class_weight': 'balanced', 'max_iter': 2000, 'n_components': 72, 'algorithm': 'randomized', 'n_iter': 5, 'power_iteration_normalizer': 'LU', 'truncsvd_tol': 4.420008334469647e-06}. Best is trial 25 with value: 0.8883182313760992.
2026-05-20 21:39:57,187 - INFO - Trial 77 finished with value: 0.8880678227454653 and parameters: {'solver': 'sag', 'alpha': 0.00030432677969866777, 'tol': 1.0781079601550317e-05, 'fit_intercept': False, 'class_weight': 'balanced', 'max_iter': 2000, 'n_components': 62, 'algorithm': 'randomized', 'n_iter': 4, 'power_iteration_normalizer': 'LU', 'truncsvd_tol': 1.7607438460201208e-06}. Best is trial 25 with value: 0.8883182313760992.
2026-05-20 21:44:03,524 - INFO - Trial 78 finished with value: 0.8878188462539971 and parameters: {'solver': 'sag', 'alpha': 0.0003123896514148261, 'tol': 2.7967667173678752e-05, 'fit_intercept': False, 'class_weight': 'balanced', 'max_iter': 2000, 'n_components': 63, 'algorithm': 'randomized', 'n_iter': 4, 'power_iteration_normalizer': 'LU', 'truncsvd_tol': 0.0024051599553401317}. Best is trial 25 with value: 0.8883182313760992.
2026-05-20 21:48:30,145 - INFO - Trial 79 finished with value: 0.8879925844223095 and parameters: {'solver': 'sag', 'alpha': 0.00027707079137218434, 'tol': 1.3766383502789838e-05, 'fit_intercept': False, 'class_weight': 'balanced', 'max_iter': 2000, 'n_components': 62, 'algorithm': 'randomized', 'n_iter': 4, 'power_iteration_normalizer': 'LU', 'truncsvd_tol': 0.0022086603171098253}. Best is trial 25 with value: 0.8883182313760992.
2026-05-20 21:56:39,736 - INFO - Trial 81 finished with value: 0.8880614164277952 and parameters: {'solver': 'sag', 'alpha': 8.636867646420892e-05, 'tol': 5.540612731934265e-05, 'fit_intercept': False, 'class_weight': 'balanced', 'max_iter': 2000, 'n_components': 62, 'algorithm': 'randomized', 'n_iter': 7, 'power_iteration_normalizer': 'LU', 'truncsvd_tol': 4.7366400697732175e-06}. Best is trial 25 with value: 0.8883182313760992.
2026-05-20 22:02:17,685 - INFO - Trial 91 pruned. 
2026-05-20 22:03:29,321 - INFO - Trial 97 finished with value: 0.887939989415699 and parameters: {'solver': 'auto', 'alpha': 0.003058165819727002, 'tol': 2.4909536466611295e-05, 'fit_intercept': False, 'class_weight': 'balanced', 'n_components': 73, 'algorithm': 'randomized', 'n_iter': 5, 'power_iteration_normalizer': 'LU', 'truncsvd_tol': 7.474333883509368e-05}. Best is trial 25 with value: 0.8883182313760992.
2026-05-20 22:04:31,886 - INFO - Trial 98 finished with value: 0.8878201857303376 and parameters: {'solver': 'lsqr', 'alpha': 0.012400992067049461, 'tol': 0.0002628616783175022, 'fit_intercept': False, 'class_weight': 'balanced', 'max_iter': 2500, 'n_components': 67, 'algorithm': 'randomized', 'n_iter': 5, 'power_iteration_normalizer': 'LU', 'truncsvd_tol': 0.0010196499512344554}. Best is trial 25 with value: 0.8883182313760992.
2026-05-20 22:09:15,677 - INFO - Trial 87 finished with value: 0.8880553653032474 and parameters: {'solver': 'sag', 'alpha': 7.9566057980811e-05, 'tol': 1.5070161745444622e-05, 'fit_intercept': False, 'class_weight': 'balanced', 'max_iter': 1500, 'n_components': 64, 'algorithm': 'randomized', 'n_iter': 5, 'power_iteration_normalizer': 'LU', 'truncsvd_tol': 0.001423498382314963}. Best is trial 25 with value: 0.8883182313760992.
2026-05-20 22:26:13,399 - INFO - Trial 83 finished with value: 0.888010957700246 and parameters: {'solver': 'sag', 'alpha': 0.002869554893675283, 'tol': 4.9903798871496054e-05, 'fit_intercept': False, 'class_weight': 'balanced', 'max_iter': 3500, 'n_components': 72, 'algorithm': 'randomized', 'n_iter': 5, 'power_iteration_normalizer': 'LU', 'truncsvd_tol': 4.4437116562936e-06}. Best is trial 25 with value: 0.8883182313760992.
2026-05-20 22:35:14,738 - INFO - Trial 95 pruned. 
2026-05-20 22:35:21,207 - INFO - Trial 85 finished with value: 0.8880703084133383 and parameters: {'solver': 'sag', 'alpha': 0.00010759571341161658, 'tol': 4.915550485357805e-05, 'fit_intercept': False, 'class_weight': 'balanced', 'max_iter': 2500, 'n_components': 64, 'algorithm': 'randomized', 'n_iter': 5, 'power_iteration_normalizer': 'LU', 'truncsvd_tol': 0.0018362394123621615}. Best is trial 25 with value: 0.8883182313760992.
2026-05-20 22:37:19,506 - INFO - Trial 90 pruned. 
2026-05-20 22:45:22,896 - INFO - Trial 96 pruned. 
2026-05-20 22:45:45,411 - INFO - Trial 99 finished with value: 0.8881064199226797 and parameters: {'solver': 'sag', 'alpha': 1.9562108348304284e-05, 'tol': 0.00010492614206465522, 'fit_intercept': False, 'class_weight': 'balanced', 'max_iter': 3000, 'n_components': 73, 'algorithm': 'randomized', 'n_iter': 5, 'power_iteration_normalizer': 'LU', 'truncsvd_tol': 4.075928459532489e-06}. Best is trial 25 with value: 0.8883182313760992.
2026-05-20 22:50:26,062 - INFO - Trial 94 finished with value: 0.8880502391767614 and parameters: {'solver': 'sag', 'alpha': 0.0005270694690476923, 'tol': 1.5431819317284406e-05, 'fit_intercept': False, 'class_weight': 'balanced', 'max_iter': 2500, 'n_components': 72, 'algorithm': 'randomized', 'n_iter': 7, 'power_iteration_normalizer': 'LU', 'truncsvd_tol': 4.240215260747664e-06}. Best is trial 25 with value: 0.8883182313760992.
2026-05-20 22:53:27,829 - INFO - Trial 93 finished with value: 0.8881505703885832 and parameters: {'solver': 'sag', 'alpha': 0.00011479058422554052, 'tol': 1.6024747502770187e-05, 'fit_intercept': False, 'class_weight': 'balanced', 'max_iter': 3000, 'n_components': 73, 'algorithm': 'randomized', 'n_iter': 7, 'power_iteration_normalizer': 'LU', 'truncsvd_tol': 4.336104091140629e-06}. Best is trial 25 with value: 0.8883182313760992.
2026-05-20 22:54:15,089 - INFO - Trial 92 finished with value: 0.8882717898141864 and parameters: {'solver': 'sag', 'alpha': 0.00011473346954559197, 'tol': 1.4902117413443459e-05, 'fit_intercept': False, 'class_weight': 'balanced', 'max_iter': 3000, 'n_components': 73, 'algorithm': 'randomized', 'n_iter': 7, 'power_iteration_normalizer': 'LU', 'truncsvd_tol': 2.1923594948671485e-06}. Best is trial 25 with value: 0.8883182313760992.
2026-05-20 22:59:30,881 - INFO - Trial 88 finished with value: 0.887943642471555 and parameters: {'solver': 'sag', 'alpha': 9.679844505443444e-05, 'tol': 2.67411482001851e-05, 'fit_intercept': False, 'class_weight': 'balanced', 'max_iter': 3500, 'n_components': 64, 'algorithm': 'randomized', 'n_iter': 5, 'power_iteration_normalizer': 'LU', 'truncsvd_tol': 0.00015772459429856913}. Best is trial 25 with value: 0.8883182313760992.
2026-05-20 23:05:57,796 - INFO - Trial 89 finished with value: 0.8878764997364005 and parameters: {'solver': 'sag', 'alpha': 0.00011306121965966091, 'tol': 2.5293453265599313e-05, 'fit_intercept': False, 'class_weight': 'balanced', 'max_iter': 3500, 'n_components': 62, 'algorithm': 'randomized', 'n_iter': 5, 'power_iteration_normalizer': 'LU', 'truncsvd_tol': 0.00024116947856267002}. Best is trial 25 with value: 0.8883182313760992.
2026-05-20 23:05:57,799 - INFO - Best AUC: 0.8883182313760992 | Best params: {'solver': 'sag', 'alpha': 0.0012590930780247856, 'tol': 8.804610287179953e-05, 'fit_intercept': False, 'class_weight': 'balanced', 'max_iter': 1000, 'n_components': 75, 'algorithm': 'randomized', 'n_iter': 7, 'power_iteration_normalizer': 'LU', 'truncsvd_tol': 3.2634825986870737e-06}
2026-05-20 23:05:57,800 - INFO - ----- Saving Pipeline -----
2026-05-20 23:16:11,845 - INFO - ----- Saving Pipeline -----
