2026-05-20 19:12:16,734 - INFO - ----- Fine Tuning -----
2026-05-20 19:12:16,736 - INFO - A new study created in memory with name: no-name-3056d176-7717-434b-835a-e39537d77bde
2026-05-20 19:14:10,680 - INFO - ----- Fine Tuning -----
2026-05-20 19:14:10,681 - INFO - A new study created in memory with name: no-name-af4a66d7-26b2-4f7b-a382-67dc56b4e89b
2026-05-20 19:17:24,094 - INFO - Trial 10 finished with value: 0.857128595756939 and parameters: {'solver': 'auto', 'alpha': 0.032838372832616335, 'tol': 0.0037125343519751465, 'fit_intercept': True, 'class_weight': None, 'n_components': 36, 'algorithm': 'randomized', 'n_iter': 6, 'power_iteration_normalizer': 'OR', 'truncsvd_tol': 2.1282261537527008e-05}. Best is trial 10 with value: 0.857128595756939.
2026-05-20 19:17:25,720 - INFO - Trial 11 finished with value: 0.8356041144107886 and parameters: {'solver': 'cholesky', 'alpha': 0.02447564432427181, 'tol': 0.005460906304952898, 'fit_intercept': False, 'class_weight': None, 'n_components': 30, 'algorithm': 'randomized', 'n_iter': 8, 'power_iteration_normalizer': 'OR', 'truncsvd_tol': 9.74246633913338e-05}. Best is trial 10 with value: 0.857128595756939.
2026-05-20 19:17:31,171 - INFO - Trial 3 finished with value: 0.8866078410580712 and parameters: {'solver': 'cholesky', 'alpha': 28.40910351630581, 'tol': 0.0015943051471835447, 'fit_intercept': False, 'class_weight': 'balanced', 'n_components': 52, 'algorithm': 'randomized', 'n_iter': 7, 'power_iteration_normalizer': 'OR', 'truncsvd_tol': 0.00032896284698542247}. Best is trial 3 with value: 0.8866078410580712.
2026-05-20 19:17:44,478 - INFO - Trial 5 finished with value: 0.7802150874956972 and parameters: {'solver': 'lsqr', 'alpha': 0.03199087412883954, 'tol': 0.0769337526958831, 'fit_intercept': False, 'class_weight': 'balanced', 'max_iter': 2000, 'n_components': 18, 'algorithm': 'randomized', 'n_iter': 9, 'power_iteration_normalizer': 'auto', 'truncsvd_tol': 1.1490903429621308e-05}. Best is trial 3 with value: 0.8866078410580712.
2026-05-20 19:18:13,091 - INFO - ----- Fine Tuning -----
2026-05-20 19:18:13,092 - INFO - A new study created in memory with name: no-name-712c8a36-ddb9-4dd8-8a60-a301838ce58b
2026-05-20 19:21:35,499 - INFO - Trial 7 finished with value: 0.8694229067486863 and parameters: {'solver': 'sag', 'alpha': 0.015625377362416423, 'tol': 0.0389024559610863, 'fit_intercept': True, 'class_weight': None, 'max_iter': 4500, 'n_components': 40, 'algorithm': 'randomized', 'n_iter': 4, 'power_iteration_normalizer': 'auto', 'truncsvd_tol': 0.0013345096631552052}. Best is trial 7 with value: 0.8694229067486863.
2026-05-20 19:21:43,103 - INFO - Trial 5 finished with value: 0.8690009842606627 and parameters: {'solver': 'auto', 'alpha': 1.2266094407539216e-05, 'tol': 0.010634505063041784, 'fit_intercept': True, 'class_weight': None, 'n_components': 38, 'algorithm': 'randomized', 'n_iter': 7, 'power_iteration_normalizer': 'auto', 'truncsvd_tol': 0.007354183377160689}. Best is trial 7 with value: 0.8694229067486863.
2026-05-20 19:22:20,881 - INFO - Trial 9 finished with value: 0.8617254017959706 and parameters: {'solver': 'lsqr', 'alpha': 8.734158695409535, 'tol': 0.0008391855238813988, 'fit_intercept': True, 'class_weight': 'balanced', 'max_iter': 5000, 'n_components': 37, 'algorithm': 'randomized', 'n_iter': 13, 'power_iteration_normalizer': 'OR', 'truncsvd_tol': 1.8070828054054105e-05}. Best is trial 7 with value: 0.8694229067486863.
2026-05-20 19:22:31,453 - INFO - Trial 6 finished with value: 0.8642181316118303 and parameters: {'solver': 'lsqr', 'alpha': 0.2932999467488947, 'tol': 0.00014637845271479194, 'fit_intercept': False, 'class_weight': None, 'max_iter': 3000, 'n_components': 38, 'algorithm': 'randomized', 'n_iter': 12, 'power_iteration_normalizer': 'OR', 'truncsvd_tol': 0.00010748914158606319}. Best is trial 7 with value: 0.8694229067486863.
2026-05-20 19:22:46,660 - INFO - Trial 10 finished with value: 0.8821225079017033 and parameters: {'solver': 'auto', 'alpha': 7.450078273222745, 'tol': 0.07454926562229731, 'fit_intercept': True, 'class_weight': None, 'n_components': 48, 'algorithm': 'randomized', 'n_iter': 11, 'power_iteration_normalizer': 'auto', 'truncsvd_tol': 0.006853910610819679}. Best is trial 10 with value: 0.8821225079017033.
2026-05-20 19:22:50,900 - INFO - Trial 1 finished with value: 0.8720791416229231 and parameters: {'solver': 'lsqr', 'alpha': 3.739169915815807e-05, 'tol': 0.005136533660944266, 'fit_intercept': True, 'class_weight': 'balanced', 'max_iter': 3500, 'n_components': 38, 'algorithm': 'randomized', 'n_iter': 12, 'power_iteration_normalizer': 'auto', 'truncsvd_tol': 0.00037239928550289025}. Best is trial 10 with value: 0.8821225079017033.
2026-05-20 19:22:57,423 - INFO - Trial 0 pruned. 
2026-05-20 19:23:01,750 - INFO - Trial 11 pruned. 
2026-05-20 19:23:08,276 - INFO - Trial 3 finished with value: 0.8877830081343581 and parameters: {'solver': 'sag', 'alpha': 0.002095141002181233, 'tol': 0.0012383876663317206, 'fit_intercept': False, 'class_weight': 'balanced', 'max_iter': 3000, 'n_components': 62, 'algorithm': 'randomized', 'n_iter': 5, 'power_iteration_normalizer': 'LU', 'truncsvd_tol': 0.0001130305825431286}. Best is trial 3 with value: 0.8877830081343581.
2026-05-20 19:23:13,901 - INFO - Trial 4 finished with value: 0.8823899119779257 and parameters: {'solver': 'cholesky', 'alpha': 0.46080326656227577, 'tol': 0.00032473308458060994, 'fit_intercept': True, 'class_weight': None, 'n_components': 57, 'algorithm': 'randomized', 'n_iter': 14, 'power_iteration_normalizer': 'auto', 'truncsvd_tol': 0.0005320920746014567}. Best is trial 3 with value: 0.8877830081343581.
2026-05-20 19:23:43,032 - INFO - Trial 13 pruned. 
2026-05-20 19:23:52,599 - INFO - Trial 2 pruned. 
2026-05-20 19:23:52,901 - INFO - Trial 12 pruned. 
2026-05-20 19:24:57,278 - INFO - Trial 8 finished with value: 0.8866814608723695 and parameters: {'solver': 'sag', 'alpha': 0.010779593376197195, 'tol': 0.0060890946278019786, 'fit_intercept': False, 'class_weight': 'balanced', 'max_iter': 2500, 'n_components': 48, 'algorithm': 'randomized', 'n_iter': 12, 'power_iteration_normalizer': 'auto', 'truncsvd_tol': 5.110777836636747e-06}. Best is trial 3 with value: 0.8877830081343581.
2026-05-20 19:25:02,784 - INFO - Trial 18 pruned. 
2026-05-20 19:25:09,175 - INFO - Trial 14 pruned. 
2026-05-20 19:26:29,484 - INFO - Trial 17 finished with value: 0.8822014028997991 and parameters: {'solver': 'cholesky', 'alpha': 2.356069693034087e-05, 'tol': 0.014123474816744508, 'fit_intercept': False, 'class_weight': None, 'n_components': 52, 'algorithm': 'randomized', 'n_iter': 7, 'power_iteration_normalizer': 'OR', 'truncsvd_tol': 4.0458888303048385e-05}. Best is trial 3 with value: 0.8877830081343581.
2026-05-20 19:27:36,766 - INFO - Trial 20 finished with value: 0.882605822031685 and parameters: {'solver': 'auto', 'alpha': 1.0075795474795897, 'tol': 0.0011779170777424378, 'fit_intercept': True, 'class_weight': None, 'n_components': 53, 'algorithm': 'randomized', 'n_iter': 7, 'power_iteration_normalizer': 'LU', 'truncsvd_tol': 1.6222474537689566e-06}. Best is trial 3 with value: 0.8877830081343581.
2026-05-20 19:27:50,482 - INFO - Trial 24 finished with value: 0.8879891161629425 and parameters: {'solver': 'cholesky', 'alpha': 0.0021464738305160508, 'tol': 0.0002211575721100763, 'fit_intercept': False, 'class_weight': 'balanced', 'n_components': 71, 'algorithm': 'randomized', 'n_iter': 6, 'power_iteration_normalizer': 'LU', 'truncsvd_tol': 1.3166580984154649e-06}. Best is trial 24 with value: 0.8879891161629425.
2026-05-20 19:27:53,596 - INFO - Trial 19 finished with value: 0.8823397657224321 and parameters: {'solver': 'lsqr', 'alpha': 55.75360797713625, 'tol': 3.274825385801352e-05, 'fit_intercept': True, 'class_weight': None, 'max_iter': 2000, 'n_components': 64, 'algorithm': 'randomized', 'n_iter': 7, 'power_iteration_normalizer': 'LU', 'truncsvd_tol': 0.0007077680536277365}. Best is trial 24 with value: 0.8879891161629425.
2026-05-20 19:28:01,434 - INFO - Trial 16 finished with value: 0.8824808648246962 and parameters: {'solver': 'lsqr', 'alpha': 2.0269227352140358, 'tol': 0.001363627254779768, 'fit_intercept': True, 'class_weight': None, 'max_iter': 5000, 'n_components': 63, 'algorithm': 'randomized', 'n_iter': 10, 'power_iteration_normalizer': 'LU', 'truncsvd_tol': 0.0001488437536575364}. Best is trial 24 with value: 0.8879891161629425.
2026-05-20 19:28:22,372 - INFO - Trial 23 finished with value: 0.8881327937393655 and parameters: {'solver': 'cholesky', 'alpha': 0.8568931429858792, 'tol': 0.0002174882366344809, 'fit_intercept': False, 'class_weight': 'balanced', 'n_components': 71, 'algorithm': 'randomized', 'n_iter': 7, 'power_iteration_normalizer': 'LU', 'truncsvd_tol': 2.3670327200668348e-06}. Best is trial 23 with value: 0.8881327937393655.
2026-05-20 19:33:21,498 - INFO - Trial 15 finished with value: 0.8809495228279369 and parameters: {'solver': 'sag', 'alpha': 39.70620240810478, 'tol': 0.00023319571337349526, 'fit_intercept': False, 'class_weight': None, 'max_iter': 500, 'n_components': 47, 'algorithm': 'randomized', 'n_iter': 10, 'power_iteration_normalizer': 'LU', 'truncsvd_tol': 1.5296592453198443e-05}. Best is trial 23 with value: 0.8881327937393655.
2026-05-20 19:34:24,331 - INFO - Trial 34 finished with value: 0.8880431175196462 and parameters: {'solver': 'cholesky', 'alpha': 0.0001842785098005689, 'tol': 7.671412226079083e-05, 'fit_intercept': False, 'class_weight': 'balanced', 'n_components': 75, 'algorithm': 'randomized', 'n_iter': 5, 'power_iteration_normalizer': 'LU', 'truncsvd_tol': 3.6068595650633643e-06}. Best is trial 23 with value: 0.8881327937393655.
2026-05-20 19:35:52,138 - INFO - Trial 35 finished with value: 0.888104478933639 and parameters: {'solver': 'cholesky', 'alpha': 9.992374790615717e-05, 'tol': 5.436087604081986e-05, 'fit_intercept': False, 'class_weight': 'balanced', 'n_components': 75, 'algorithm': 'randomized', 'n_iter': 5, 'power_iteration_normalizer': 'LU', 'truncsvd_tol': 3.519337417314746e-06}. Best is trial 23 with value: 0.8881327937393655.
2026-05-20 19:36:53,103 - INFO - Trial 36 finished with value: 0.8879209337368495 and parameters: {'solver': 'cholesky', 'alpha': 0.00015971513398739342, 'tol': 7.187751840917791e-05, 'fit_intercept': False, 'class_weight': 'balanced', 'n_components': 73, 'algorithm': 'randomized', 'n_iter': 5, 'power_iteration_normalizer': 'LU', 'truncsvd_tol': 3.691712585067895e-06}. Best is trial 23 with value: 0.8881327937393655.
2026-05-20 19:37:12,045 - INFO - Trial 37 pruned. 
2026-05-20 19:38:48,610 - INFO - Trial 38 finished with value: 0.8881092691871764 and parameters: {'solver': 'cholesky', 'alpha': 0.08682043530471986, 'tol': 9.079551618868824e-05, 'fit_intercept': False, 'class_weight': 'balanced', 'n_components': 75, 'algorithm': 'randomized', 'n_iter': 6, 'power_iteration_normalizer': 'LU', 'truncsvd_tol': 2.788524929873281e-06}. Best is trial 23 with value: 0.8881327937393655.
2026-05-20 19:39:54,581 - INFO - Trial 39 finished with value: 0.8878884367028193 and parameters: {'solver': 'cholesky', 'alpha': 0.07596671221089189, 'tol': 0.0005040029297175698, 'fit_intercept': False, 'class_weight': 'balanced', 'n_components': 67, 'algorithm': 'randomized', 'n_iter': 9, 'power_iteration_normalizer': 'OR', 'truncsvd_tol': 2.475771611902128e-06}. Best is trial 23 with value: 0.8881327937393655.
2026-05-20 19:41:22,283 - INFO - Trial 40 finished with value: 0.8878952780002901 and parameters: {'solver': 'cholesky', 'alpha': 0.10027020292169102, 'tol': 2.1053845368150207e-05, 'fit_intercept': False, 'class_weight': 'balanced', 'n_components': 69, 'algorithm': 'randomized', 'n_iter': 8, 'power_iteration_normalizer': 'LU', 'truncsvd_tol': 7.515493712676193e-06}. Best is trial 23 with value: 0.8881327937393655.
2026-05-20 19:42:59,917 - INFO - Trial 41 finished with value: 0.8880000461390107 and parameters: {'solver': 'cholesky', 'alpha': 3.5499793519029765, 'tol': 0.00012159612348417885, 'fit_intercept': False, 'class_weight': 'balanced', 'n_components': 75, 'algorithm': 'randomized', 'n_iter': 6, 'power_iteration_normalizer': 'LU', 'truncsvd_tol': 9.488084167551145e-06}. Best is trial 23 with value: 0.8881327937393655.
2026-05-20 19:44:12,346 - INFO - Trial 42 finished with value: 0.8879917373852606 and parameters: {'solver': 'cholesky', 'alpha': 0.0005223304110763006, 'tol': 7.538731925052599e-05, 'fit_intercept': False, 'class_weight': 'balanced', 'n_components': 74, 'algorithm': 'randomized', 'n_iter': 4, 'power_iteration_normalizer': 'LU', 'truncsvd_tol': 2.7653568019397256e-06}. Best is trial 23 with value: 0.8881327937393655.
2026-05-20 19:45:26,226 - INFO - Trial 43 finished with value: 0.8877680801936745 and parameters: {'solver': 'cholesky', 'alpha': 5.0885590581001615e-05, 'tol': 3.30396812502845e-05, 'fit_intercept': False, 'class_weight': 'balanced', 'n_components': 59, 'algorithm': 'randomized', 'n_iter': 6, 'power_iteration_normalizer': 'LU', 'truncsvd_tol': 2.1789749299481236e-06}. Best is trial 23 with value: 0.8881327937393655.
2026-05-20 19:46:26,222 - INFO - Trial 30 finished with value: 0.8880021648568915 and parameters: {'solver': 'sag', 'alpha': 0.0001578464138198669, 'tol': 6.433982171208442e-05, 'fit_intercept': False, 'class_weight': 'balanced', 'max_iter': 500, 'n_components': 68, 'algorithm': 'randomized', 'n_iter': 5, 'power_iteration_normalizer': 'LU', 'truncsvd_tol': 5.6829783101938926e-06}. Best is trial 23 with value: 0.8881327937393655.
2026-05-20 19:46:46,173 - INFO - Trial 44 finished with value: 0.8879053584107055 and parameters: {'solver': 'cholesky', 'alpha': 0.0007392405492096944, 'tol': 9.284662431897931e-05, 'fit_intercept': False, 'class_weight': 'balanced', 'n_components': 68, 'algorithm': 'randomized', 'n_iter': 4, 'power_iteration_normalizer': 'LU', 'truncsvd_tol': 8.269722202625512e-06}. Best is trial 23 with value: 0.8881327937393655.
2026-05-20 19:48:53,746 - INFO - Trial 45 finished with value: 0.8878809642854737 and parameters: {'solver': 'cholesky', 'alpha': 0.0007865958123609916, 'tol': 0.00010686274360932481, 'fit_intercept': False, 'class_weight': 'balanced', 'n_components': 70, 'algorithm': 'randomized', 'n_iter': 8, 'power_iteration_normalizer': 'LU', 'truncsvd_tol': 1.0899013922910627e-05}. Best is trial 23 with value: 0.8881327937393655.
2026-05-20 19:49:08,425 - INFO - Trial 46 finished with value: 0.8882426878652202 and parameters: {'solver': 'cholesky', 'alpha': 0.006092493426662476, 'tol': 0.0006033507578329002, 'fit_intercept': False, 'class_weight': 'balanced', 'n_components': 75, 'algorithm': 'randomized', 'n_iter': 8, 'power_iteration_normalizer': 'LU', 'truncsvd_tol': 3.1864874035837866e-06}. Best is trial 46 with value: 0.8882426878652202.
2026-05-20 19:49:59,344 - INFO - Trial 31 finished with value: 0.8881253305523258 and parameters: {'solver': 'sag', 'alpha': 0.0002066876750052331, 'tol': 6.816010646433438e-05, 'fit_intercept': False, 'class_weight': 'balanced', 'max_iter': 500, 'n_components': 75, 'algorithm': 'randomized', 'n_iter': 5, 'power_iteration_normalizer': 'LU', 'truncsvd_tol': 3.2871939253962136e-06}. Best is trial 46 with value: 0.8882426878652202.
2026-05-20 19:51:19,126 - INFO - Trial 47 finished with value: 0.8881073285226485 and parameters: {'solver': 'cholesky', 'alpha': 0.06221639392266211, 'tol': 0.00038018600974872697, 'fit_intercept': False, 'class_weight': 'balanced', 'n_components': 75, 'algorithm': 'randomized', 'n_iter': 8, 'power_iteration_normalizer': 'LU', 'truncsvd_tol': 3.4483177844655244e-06}. Best is trial 46 with value: 0.8882426878652202.
2026-05-20 19:51:26,507 - INFO - Trial 48 finished with value: 0.8880027276256204 and parameters: {'solver': 'auto', 'alpha': 0.0072942467129135284, 'tol': 0.0006248068112597579, 'fit_intercept': False, 'class_weight': 'balanced', 'n_components': 59, 'algorithm': 'randomized', 'n_iter': 8, 'power_iteration_normalizer': 'LU', 'truncsvd_tol': 1.7224245436976924e-06}. Best is trial 46 with value: 0.8882426878652202.
2026-05-20 19:52:28,801 - INFO - Trial 33 finished with value: 0.888198540843123 and parameters: {'solver': 'sag', 'alpha': 0.00019188502519852248, 'tol': 0.00010719606603152489, 'fit_intercept': False, 'class_weight': 'balanced', 'max_iter': 500, 'n_components': 74, 'algorithm': 'randomized', 'n_iter': 5, 'power_iteration_normalizer': 'LU', 'truncsvd_tol': 4.157091208816454e-06}. Best is trial 46 with value: 0.8882426878652202.
2026-05-20 19:53:09,089 - INFO - Trial 51 finished with value: 0.8879257112481393 and parameters: {'solver': 'sag', 'alpha': 0.1698435467668781, 'tol': 0.002480131768381045, 'fit_intercept': False, 'class_weight': 'balanced', 'max_iter': 1500, 'n_components': 63, 'algorithm': 'randomized', 'n_iter': 6, 'power_iteration_normalizer': 'OR', 'truncsvd_tol': 6.0641763989090894e-05}. Best is trial 46 with value: 0.8882426878652202.
2026-05-20 19:54:55,506 - INFO - Trial 22 finished with value: 0.8880530782365911 and parameters: {'solver': 'sag', 'alpha': 0.5511081134469936, 'tol': 0.00021651401110912966, 'fit_intercept': False, 'class_weight': 'balanced', 'max_iter': 1000, 'n_components': 71, 'algorithm': 'randomized', 'n_iter': 7, 'power_iteration_normalizer': 'LU', 'truncsvd_tol': 3.0092414487644264e-06}. Best is trial 46 with value: 0.8882426878652202.
2026-05-20 19:56:04,335 - INFO - Trial 53 finished with value: 0.8880985147513669 and parameters: {'solver': 'sag', 'alpha': 1.3813008852112851e-05, 'tol': 0.00019041668233858003, 'fit_intercept': False, 'class_weight': 'balanced', 'max_iter': 1000, 'n_components': 66, 'algorithm': 'randomized', 'n_iter': 7, 'power_iteration_normalizer': 'LU', 'truncsvd_tol': 1.1061341827313422e-06}. Best is trial 46 with value: 0.8882426878652202.
2026-05-20 19:57:11,809 - INFO - Trial 54 finished with value: 0.8880210159553308 and parameters: {'solver': 'sag', 'alpha': 0.03357993972116898, 'tol': 0.00017095542335593408, 'fit_intercept': False, 'class_weight': 'balanced', 'max_iter': 1000, 'n_components': 66, 'algorithm': 'randomized', 'n_iter': 4, 'power_iteration_normalizer': 'LU', 'truncsvd_tol': 1.2700111226499284e-06}. Best is trial 46 with value: 0.8882426878652202.
2026-05-20 20:02:53,404 - INFO - Trial 52 finished with value: 0.8879969648716806 and parameters: {'solver': 'sag', 'alpha': 0.13223122586598932, 'tol': 0.00020803380934906313, 'fit_intercept': False, 'class_weight': 'balanced', 'max_iter': 1000, 'n_components': 65, 'algorithm': 'randomized', 'n_iter': 6, 'power_iteration_normalizer': 'OR', 'truncsvd_tol': 1.284281329216972e-06}. Best is trial 46 with value: 0.8882426878652202.
2026-05-20 20:04:00,591 - INFO - Trial 28 finished with value: 0.8881477483138595 and parameters: {'solver': 'sag', 'alpha': 0.00022884387882069824, 'tol': 6.785255162865363e-05, 'fit_intercept': False, 'class_weight': 'balanced', 'max_iter': 1000, 'n_components': 73, 'algorithm': 'randomized', 'n_iter': 6, 'power_iteration_normalizer': 'LU', 'truncsvd_tol': 3.2786082057011165e-06}. Best is trial 46 with value: 0.8882426878652202.
2026-05-20 20:07:02,339 - INFO - Trial 29 finished with value: 0.8880437093906117 and parameters: {'solver': 'sag', 'alpha': 68.94318952045717, 'tol': 7.958213753153936e-05, 'fit_intercept': False, 'class_weight': 'balanced', 'max_iter': 1500, 'n_components': 71, 'algorithm': 'randomized', 'n_iter': 5, 'power_iteration_normalizer': 'LU', 'truncsvd_tol': 4.256430644995672e-06}. Best is trial 46 with value: 0.8882426878652202.
2026-05-20 20:08:17,018 - INFO - Trial 27 finished with value: 0.8880994536873992 and parameters: {'solver': 'sag', 'alpha': 98.54527690185623, 'tol': 7.313269073525196e-05, 'fit_intercept': False, 'class_weight': 'balanced', 'max_iter': 1500, 'n_components': 74, 'algorithm': 'randomized', 'n_iter': 6, 'power_iteration_normalizer': 'LU', 'truncsvd_tol': 3.5108127228459086e-06}. Best is trial 46 with value: 0.8882426878652202.
2026-05-20 20:08:27,015 - INFO - Trial 49 finished with value: 0.8879245782774932 and parameters: {'solver': 'sag', 'alpha': 0.007022962286427106, 'tol': 0.0005196219124480539, 'fit_intercept': False, 'class_weight': 'balanced', 'max_iter': 1500, 'n_components': 59, 'algorithm': 'randomized', 'n_iter': 8, 'power_iteration_normalizer': 'OR', 'truncsvd_tol': 1.7502552596194286e-06}. Best is trial 46 with value: 0.8882426878652202.
2026-05-20 20:08:45,159 - INFO - Trial 26 finished with value: 0.88813511745954 and parameters: {'solver': 'sag', 'alpha': 0.004718359828713542, 'tol': 8.157767465651775e-05, 'fit_intercept': False, 'class_weight': 'balanced', 'max_iter': 1000, 'n_components': 73, 'algorithm': 'randomized', 'n_iter': 6, 'power_iteration_normalizer': 'LU', 'truncsvd_tol': 3.051033227443231e-06}. Best is trial 46 with value: 0.8882426878652202.
2026-05-20 20:09:04,253 - INFO - Trial 61 pruned. 
2026-05-20 20:10:48,551 - INFO - Trial 21 finished with value: 0.888147075962733 and parameters: {'solver': 'sag', 'alpha': 0.0007999812380568819, 'tol': 4.745817886127496e-05, 'fit_intercept': False, 'class_weight': 'balanced', 'max_iter': 1000, 'n_components': 71, 'algorithm': 'randomized', 'n_iter': 3, 'power_iteration_normalizer': 'LU', 'truncsvd_tol': 1.5319694846960234e-06}. Best is trial 46 with value: 0.8882426878652202.
2026-05-20 20:11:28,166 - INFO - Trial 56 finished with value: 0.88794662348935 and parameters: {'solver': 'sag', 'alpha': 0.004290893297727183, 'tol': 0.0003832674893131478, 'fit_intercept': False, 'class_weight': 'balanced', 'max_iter': 2000, 'n_components': 59, 'algorithm': 'randomized', 'n_iter': 6, 'power_iteration_normalizer': 'OR', 'truncsvd_tol': 5.623600107353004e-06}. Best is trial 46 with value: 0.8882426878652202.
